,Key,Status,Summary,Url,Last_Date
1628445,1628445,Fix Committed,Fuel UI uses deprecated Keystone v2 API,https://bugs.launchpad.net/fuel/+bug/1628445,2017-01-17
1656230,1656230,Fix Released,The fakezhmcclient has a dependency on zhmcclient internal,https://bugs.launchpad.net/nova-dpm/+bug/1656230,2017-01-17
1656758,1656758,Fix Released,tox does not report test coverage,https://bugs.launchpad.net/networking-dpm/+bug/1656758,2017-01-17
1609400,1609400,Fix Released,[ccp] command line tool is accepted no parameter for commit sha/tag/branch,https://bugs.launchpad.net/fuel-ccp/+bug/1609400,2017-01-17
1656500,1656500,Fix Released,tap-metadata exists that cause metadata service start failure,https://bugs.launchpad.net/dragonflow/+bug/1656500,2017-01-17
1643034,1643034,Fix Released,Allow users of manila-image-create pick the filesystem they want in their image,https://bugs.launchpad.net/manila-image-elements/+bug/1643034,2017-01-17
1656877,1656877,Fix Released,Incorrect references to COLLECTD_CEILOMETER_UNITS in docs,https://bugs.launchpad.net/collectd-ceilometer-plugin/+bug/1656877,2017-01-17
1653088,1653088,Fix Released,RPC timeout when we validate Heat resources,https://bugs.launchpad.net/fuel-ccp/+bug/1653088,2017-01-17
1645779,1645779,Fix Released,[fuel-ccp-neutron] Invalid initial network is created when calico agent is used,https://bugs.launchpad.net/fuel-ccp/+bug/1645779,2017-01-17
1655614,1655614,Fix Released,use instance.uuid for partition name and nova.conf.CONF.host for partition description parameter,https://bugs.launchpad.net/nova-dpm/+bug/1655614,2017-01-17
1657005,1657005,Fix Released,`erase_devices` clean step is not called by ProliantHardwareManager,https://bugs.launchpad.net/proliantutils/+bug/1657005,2017-01-17
1656724,1656724,Fix Released,Failed to retype clone volume from rbd to lvm.,https://bugs.launchpad.net/cinder/+bug/1656724,2017-01-17
1644789,1644789,Fix Released,[fuel-qa] release version for mirrors,https://bugs.launchpad.net/fuel/+bug/1644789,2017-01-17
1637304,1637304,Fix Released,Zaqar queue can be inadvertently deleted,https://bugs.launchpad.net/heat/+bug/1637304,2017-01-17
1655677,1655677,Fix Released,Add details on how to contribute,https://bugs.launchpad.net/networking-ovs-dpdk/+bug/1655677,2017-01-17
1590231,1590231,Fix Released,rabbit configuration should not be in DEFAULT section,https://bugs.launchpad.net/barbican/+bug/1590231,2017-01-17
1652568,1652568,Fix Released,hostmonitor script raised bash error,https://bugs.launchpad.net/masakari-monitors/+bug/1652568,2017-01-17
1651502,1651502,Fix Released,Swift Authentication failure on log-tail,https://bugs.launchpad.net/trove/+bug/1651502,2017-01-17
1656745,1656745,Fix Released,Heat url error in local.conf.sample,https://bugs.launchpad.net/karbor/+bug/1656745,2017-01-17
1655632,1655632,Fix Released,Exception when setting ext gateway with  empty network,https://bugs.launchpad.net/networking-ovn/+bug/1655632,2017-01-17
1575227,1575227,Fix Released,OPENSTACK_KEYSTONE_BACKEND should be configurable,https://bugs.launchpad.net/puppet-horizon/+bug/1575227,2017-01-16
1651702,1651702,Fix Released,VirtualDisk objects do not contain constituent physical disks,https://bugs.launchpad.net/python-dracclient/+bug/1651702,2017-01-16
1528990,1528990,Fix Released,boot from volume tests does boot server from volume,https://bugs.launchpad.net/tempest/+bug/1528990,2017-01-16
1498981,1498981,Fix Released,Tempest connects using 127.0.0.1 when SERVICE_IP_VERSION=6,https://bugs.launchpad.net/tempest/+bug/1498981,2017-01-16
1650220,1650220,Fix Released,[Update] mos_mu tool: playbook mos9_apply_patches.yml has failed on task [OpenStack services status checking],https://bugs.launchpad.net/fuel/+bug/1650220,2017-01-16
1649871,1649871,Fix Released,[Update] Scaling cluster after update to 9.2 leads to provisioning error,https://bugs.launchpad.net/fuel/+bug/1649871,2017-01-16
1652795,1652795,Fix Released,[Update] Update cluster with customization from 9.1 to 9.2 failed on upgrade package [openvswitch-common],https://bugs.launchpad.net/fuel/+bug/1652795,2017-01-16
1648332,1648332,Fix Released,hzResourceProperty cannot handle 'priority' attribute,https://bugs.launchpad.net/horizon/+bug/1648332,2017-01-16
1655719,1655719,Fix Released,Deleted unstaged files cause reno to fail in scanner,https://bugs.launchpad.net/reno/+bug/1655719,2017-01-16
1650726,1650726,Fix Released,Clean-up Kolla-Kubernetes developer quickstart guide,https://bugs.launchpad.net/kolla-kubernetes/+bug/1650726,2017-01-16
1652236,1652236,Fix Released,Delete configMap volume in cinder_create_db.yaml,https://bugs.launchpad.net/kolla-kubernetes/+bug/1652236,2017-01-16
1652553,1652553,Fix Released,Fix wrong keywords in nova-create-keystone-user,https://bugs.launchpad.net/kolla-kubernetes/+bug/1652553,2017-01-16
1650266,1650266,Fix Released,Running tox -e cover results in failure,https://bugs.launchpad.net/kolla-kubernetes/+bug/1650266,2017-01-16
1613964,1613964,Fix Released,Consistency group CRUD in volume,https://bugs.launchpad.net/python-openstackclient/+bug/1613964,2017-01-16
1648307,1648307,Fix Released,list network rbac policy filtering option,https://bugs.launchpad.net/python-openstackclient/+bug/1648307,2017-01-16
1651288,1651288,Fix Released,Should support 'auto' and 'none' as network parameter when boot instances,https://bugs.launchpad.net/python-openstackclient/+bug/1651288,2017-01-16
1652054,1652054,Fix Released,Releasenotes check in Jenkins is failing because of earliest-version number,https://bugs.launchpad.net/python-openstackclient/+bug/1652054,2017-01-16
1612194,1612194,Fix Released,Add support for QoS rule types,https://bugs.launchpad.net/python-openstackclient/+bug/1612194,2017-01-16
1652827,1652827,Fix Released,openstackclient fails to add v2 suffix for certain conditions,https://bugs.launchpad.net/python-openstackclient/+bug/1652827,2017-01-16
1620481,1620481,Fix Released,Add 'image project set' command,https://bugs.launchpad.net/python-openstackclient/+bug/1620481,2017-01-16
1654221,1654221,Fix Released,create flavor fails to set project,https://bugs.launchpad.net/python-openstackclient/+bug/1654221,2017-01-16
1653139,1653139,Fix Released,Functional test test_ip_availability_show broken,https://bugs.launchpad.net/python-openstackclient/+bug/1653139,2017-01-16
1653138,1653138,Fix Released,Functional test test_network_service_provider_list broken,https://bugs.launchpad.net/python-openstackclient/+bug/1653138,2017-01-16
1641868,1641868,Fix Released,Add options to allow filtering by agent type and host on agent list,https://bugs.launchpad.net/python-openstackclient/+bug/1641868,2017-01-16
1654887,1654887,Fix Released,Upgrade to 3.6.0 causes AttributeError: 'SecurityGroup' object has no attribute 'keys',https://bugs.launchpad.net/python-openstackclient/+bug/1654887,2017-01-16
1609472,1609472,Fix Released,Add support for Network QoS rules,https://bugs.launchpad.net/python-openstackclient/+bug/1609472,2017-01-16
1655947,1655947,Fix Released,Network QoS rule attributes parser doesn't allow 0 value,https://bugs.launchpad.net/python-openstackclient/+bug/1655947,2017-01-16
1656018,1656018,Fix Released,flavor create help is misleading re swap size units,https://bugs.launchpad.net/python-openstackclient/+bug/1656018,2017-01-16
1653137,1653137,Fix Released,Functional test  test_qos_rule_type_list broken,https://bugs.launchpad.net/python-openstackclient/+bug/1653137,2017-01-16
1655537,1655537,Fix Released,"Cannot see Network quota  using ""openstack quota show""",https://bugs.launchpad.net/python-openstackclient/+bug/1655537,2017-01-16
1656402,1656402,Fix Released,floating ip delete by IP does not work,https://bugs.launchpad.net/python-openstackclient/+bug/1656402,2017-01-16
1656572,1656572,Fix Released,quota show --default broken,https://bugs.launchpad.net/python-openstackclient/+bug/1656572,2017-01-16
1656542,1656542,Fix Released,network agent show traceback,https://bugs.launchpad.net/python-openstackclient/+bug/1656542,2017-01-16
1642428,1642428,Fix Released,Add sha384 and sha512 auth algorithms for vendor drivers,https://bugs.launchpad.net/neutron/+bug/1642428,2017-01-16
1649079,1649079,Fix Released,TypeError seen on gate-neutron-lib-api-ref,https://bugs.launchpad.net/neutron/+bug/1649079,2017-01-16
1654957,1654957,Fix Released,the comment is inconsistent with the developer doc,https://bugs.launchpad.net/python-cinderclient/+bug/1654957,2017-01-16
1614817,1614817,Fix Released,api-ref: Floating IPs is wrong some in of paramaters,https://bugs.launchpad.net/neutron/+bug/1614817,2017-01-16
1648442,1648442,Fix Released,[api-ref] The maximum number of characters for a tag not mentioned anywhere,https://bugs.launchpad.net/neutron/+bug/1648442,2017-01-16
1643121,1643121,Fix Released,The Result is different from API document about 'qos-policy-show',https://bugs.launchpad.net/neutron/+bug/1643121,2017-01-16
1650174,1650174,Fix Released,"api-ref: project_id/tenant_id in request/response body are shown as ""path""",https://bugs.launchpad.net/neutron/+bug/1650174,2017-01-16
1614822,1614822,Fix Released,api-ref: security-group-rules api missing request parameters table.,https://bugs.launchpad.net/neutron/+bug/1614822,2017-01-16
1614815,1614815,Fix Released,api-ref: security-group api show wrong description of security_group_id parameter,https://bugs.launchpad.net/neutron/+bug/1614815,2017-01-16
1626955,1626955,Fix Released,No way to override roles_data.yaml,https://bugs.launchpad.net/tripleo/+bug/1626955,2017-01-16
1649238,1649238,Fix Released,monasca-agent: RabbitMQ detection plugin will never read .rabbitmq.cnf,https://bugs.launchpad.net/monasca/+bug/1649238,2017-01-16
1653178,1653178,Fix Released,kuryr-libnetwork IPAM gateway address creation fails,https://bugs.launchpad.net/kuryr-libnetwork/+bug/1653178,2017-01-16
1578279,1578279,Fix Released,OSA-security V-38668 /etc/init/control-alt-delete.conf does not exist,https://bugs.launchpad.net/openstack-ansible/+bug/1578279,2017-01-16
1655397,1655397,Fix Released,jinja2 >= 2.9 throws safe_eval() exception,https://bugs.launchpad.net/openstack-ansible/+bug/1655397,2017-01-16
1620675,1620675,Fix Released,[DOCS] Security architecture content and review of existing security info,https://bugs.launchpad.net/openstack-ansible/+bug/1620675,2017-01-16
1655547,1655547,Fix Released,NSX|V: unable to use a provider network from openstack,https://bugs.launchpad.net/vmware-nsx/+bug/1655547,2017-01-16
1656797,1656797,Fix Released,[fuel-ccp-neutron] image build failure,https://bugs.launchpad.net/fuel-ccp/+bug/1656797,2017-01-16
1616034,1616034,Fix Released,etcd advertises wrong port,https://bugs.launchpad.net/fuel-ccp/+bug/1616034,2017-01-16
1588158,1588158,Fix Released,Lma toolchain cannot be deployed using default plugin values,https://bugs.launchpad.net/lma-toolchain/+bug/1588158,2017-01-16
1655938,1655938,Fix Released,CI: overcloud image creation fails on all periodic jobs,https://bugs.launchpad.net/tripleo/+bug/1655938,2017-01-16
1628401,1628401,Fix Released,Monasca-agent statsd doesn't starts on Openstack Mitaka,https://bugs.launchpad.net/monasca/+bug/1628401,2017-01-16
1545407,1545407,Fix Released,Queries with unintentional fragment identifier part in test_volumes_negative module,https://bugs.launchpad.net/tempest/+bug/1545407,2017-01-16
