"Bug ID","Product","Component","Assignee","Status","Resolution","Summary","Changed"
411118,"Dali JPA Tools","JPA","neil.hauge","VERIFIED","FIXED","The state field path 'b.auction.id' cannot be resolved to a valid type.","2013-09-09 08:35:41"
367782,"Dali JPA Tools","JPA","pascal.filion","VERIFIED","FIXED","NPE with dynamic persistence and jpql validation","2012-01-31 10:55:48"
379997,"Dali JPA Tools","JPA","pascal.filion","VERIFIED","FIXED","NullPointerException: invoke JPQL code assist in JPA Details and switch editor w/o selecting any proposal","2013-09-23 11:32:11"
382150,"Dali JPA Tools","JPA","pascal.filion","VERIFIED","FIXED","ClassCastExpression in JpaMapping when the mapping type is ElementCollection","2013-02-05 14:39:20"
384185,"Dali JPA Tools","JPA","pascal.filion","VERIFIED","FIXED","WSW TCT#23 'first argument is not an Integer...'","2012-09-26 11:27:31"
384610,"Dali JPA Tools","JPA","pascal.filion","VERIFIED","FIXED","WSW38 TCT#31 Copy/Paste error?","2012-11-25 20:25:02"
384745,"Dali JPA Tools","JPA","pascal.filion","VERIFIED","FIXED","WSW38 TCT#29 ""any number of any number of""","2012-11-01 12:00:20"
386416,"Dali JPA Tools","JPA","pascal.filion","VERIFIED","FIXED","query text area in JPA Details View should be larger","2013-01-02 07:28:14"
386491,"Dali JPA Tools","JPA","pascal.filion","VERIFIED","DUPLICATE","JPQL CCE for query including element collection mapping","2013-02-05 14:37:40"
388609,"Dali JPA Tools","JPA","pascal.filion","VERIFIED","FIXED","JPA_JPQL_VALIDATION.PROPERTIES: '{0}' will be resolved to the literal text: {0}","2012-12-05 10:37:46"
367890,"Dali JPA Tools","JAXB","paul.fullbright","VERIFIED","FIXED","[Validation] Improper validation for XmlElement with type specified alongside XmlJavaTypeAdapter","2012-01-26 14:36:25"
369684,"Dali JPA Tools","JAXB","paul.fullbright","VERIFIED","FIXED","Create JAXB Project, Create JAXB Classes from schema, Close project Receive NPE Error","2012-05-15 12:38:02"
374379,"Dali JPA Tools","Framework","paul.fullbright","VERIFIED","FIXED","Once the severity is changed, JPQL queries are no longer validated","2012-04-30 13:15:55"
375415,"Dali JPA Tools","JAXB","paul.fullbright","VERIFIED","FIXED","NPEs in JAXB validation","2012-04-09 06:17:22"
391578,"Dali JPA Tools","JAXB","paul.fullbright","VERIFIED","FIXED","EclipseLink OXM Mapping File creation wizard","2013-05-14 12:17:39"
397765,"Dali JPA Tools","JPA","paul.fullbright","VERIFIED","FIXED","New Entity toolbar drop-down button appearing in all perspectives instead of just JPA perspective","2013-06-09 20:52:31"
403387,"Dali JPA Tools","JAXB","paul.fullbright","VERIFIED","FIXED","[EclipseLink] Need EclipseLink 2.5 platform for JAXB 2.2 projects","2013-05-14 13:48:29"
406572,"Dali JPA Tools","JAXB","paul.fullbright","VERIFIED","FIXED","Remove jaxb binding schema from jaxb.core","2013-05-05 21:15:14"
408149,"Dali JPA Tools","JAXB","paul.fullbright","VERIFIED","FIXED","Missing key in jpt_jaxb_eclipselink_core_validation_description.properties","2013-05-28 10:25:33"
408172,"Dali JPA Tools","JAXB","paul.fullbright","VERIFIED","FIXED","2.1 is default facet version for JAXB facet","2013-05-27 19:05:56"
408174,"Dali JPA Tools","JAXB","paul.fullbright","VERIFIED","FIXED","[EclipseLink] StringIndexOutOfBoundsException when typing new java type in oxm.xml","2013-05-28 11:45:32"
408900,"Dali JPA Tools","JPA","paul.fullbright","VERIFIED","FIXED","NPE in join column validation","2013-06-06 10:50:45"
414574,"Dali JPA Tools","General","paul.fullbright","VERIFIED","FIXED","ClassCastException when editing order-by for custom in orm.xml editor","2013-09-10 11:31:44"
412790,"Dali JPA Tools","Doc","rick.sapir","VERIFIED","FIXED","Incomplete sentence in reference069.htm","2013-07-22 15:51:56"
412791,"Dali JPA Tools","Doc","rick.sapir","VERIFIED","FIXED","Incorrect alt tags and title tags in org.eclipse.jpt.user.doc","2013-07-23 09:59:09"
412792,"Dali JPA Tools","Doc","rick.sapir","VERIFIED","FIXED","Incorrect text and link in tasks017.htm","2013-07-23 08:17:15"
374661,"Dali JPA Tools","JPA","tranle1","VERIFIED","FIXED","[EclipseLink] Generate Dynamic entities requires JPA project selection if in a view other than Project Explorer","2012-04-19 15:52:36"
375216,"Dali JPA Tools","JAXB","tranle1","VERIFIED","FIXED","JAXB Schema generation fails if classes are in default package","2012-04-11 11:46:03"
377529,"Dali JPA Tools","General","tranle1","VERIFIED","WORKSFORME","Delete orm.xml from Package Explorer it remains in persistence.xml","2013-08-27 09:18:55"
386485,"Dali JPA Tools","JPA","tranle1","VERIFIED","FIXED","org.eclipse.jpt.jpa.feature wraps ""old"" org.apache.commons.lang","2013-02-12 11:12:56"
388631,"Dali JPA Tools","JPA","tranle1","VERIFIED","FIXED","Generate entities from tables: FileNotFoundException if directory name in Eclipse's path begins with '!'","2013-09-11 11:02:41"
390047,"Dali JPA Tools","JPA","tranle1","VERIFIED","FIXED","NullPointerException: Click Browse or hyperlink for persistence eclipselink.profiler property","2012-12-04 11:34:20"
390871,"Dali JPA Tools","JAXB","tranle1","VERIFIED","FIXED","ClassCastException: open ""JAXB Classes from Schema"" wizard through Quick Access","2012-12-04 11:02:23"
390873,"Dali JPA Tools","JPA","tranle1","VERIFIED","FIXED","AssertionFailedException: Run ""Convert to JPA Project..."" command w/o selecting any project","2012-12-04 12:02:11"
396880,"Dali JPA Tools","Doc","tranle1","VERIFIED","FIXED","jpt.doc is missing .qualifier?","2013-04-15 14:51:45"
407652,"Dali JPA Tools","JPA","tranle1","VERIFIED","FIXED","Generate entities from tables wizard does not generate entities implementing java.io.Serializable","2013-05-28 13:24:30"
395385,"Dali JPA Tools","Diagram Editor","petya.sabeva","CLOSED","INVALID","The diagram editor feature license needs to match the current Eclipse license text","2013-04-11 15:31:09"
484883,"Dali JPA Tools","JPA","brian.vosburgh","CLOSED","FIXED","Compilation Errors Due to JpaContextModel.update(IProgressMonitor) method","2016-01-05 16:45:18"
376219,"Dali JPA Tools","Diagram Editor","dali.diagrameditor-inbox","CLOSED","WORKSFORME","Open Diagram menu item is missing from the context menus","2012-04-19 14:07:39"
381435,"Dali JPA Tools","Diagram Editor","dali.diagrameditor-inbox","CLOSED","DUPLICATE","ClassCastException: rename Java persistent type when mapping file has persistent type","2012-06-15 04:34:41"
372478,"Dali JPA Tools","JPA","dali.general-inbox","CLOSED","NOT_ECLIPSE","JPA validation of column fails to append id to name","2012-02-27 13:49:50"
374761,"Dali JPA Tools","JPA","dali.general-inbox","CLOSED","DUPLICATE","JPQL queries should participate in the class rename refactoring","2012-03-20 11:30:48"
374800,"Dali JPA Tools","JPA","dali.general-inbox","CLOSED","INVALID","[EclipseLink] JPQL incorrect validation for virtual attribute","2012-04-11 13:45:32"
375676,"Dali JPA Tools","JPA","dali.general-inbox","CLOSED","DUPLICATE","invalid validation error: ""The left parenthesis is missing from the IN expression.""","2012-03-30 14:23:26"
385442,"Dali JPA Tools","JPA","dali.general-inbox","CLOSED","DUPLICATE","giorgo ch","2012-09-14 18:08:22"
387474,"Dali JPA Tools","JPA","dali.general-inbox","CLOSED","DUPLICATE","NPE in tests while building a JPA project is causing many test failures in the WTP 3.5M1 build","2012-08-31 17:43:09"
391733,"Dali JPA Tools","General","dali.general-inbox","CLOSED","DUPLICATE","NPE when editing a POJO in a project with JPA facet","2012-10-11 22:13:57"
449246,"Dali JPA Tools","JPA","dali.general-inbox","CLOSED","DUPLICATE","Option to add @XmlRootElement in generated entities","2017-08-20 02:41:30"
466496,"Dali JPA Tools","General","dali.general-inbox","CLOSED","DUPLICATE","Dali bundles must be signed for Mars","2015-05-06 09:34:12"
371147,"Dali JPA Tools","JPA","karenfbutzke","CLOSED","WONTFIX","Dynamic Entities: Change delete refactoring participant to exclude virtual entities","2012-03-20 07:51:32"
422806,"Dali JPA Tools","JPA","nan.n.li","CLOSED","FIXED","Typo in 'Make persistent' wizard","2013-12-02 15:31:04"
397927,"Dali JPA Tools","JPA","neil.hauge","CLOSED","DUPLICATE","Generate sample queries with entity generation","2013-04-30 12:42:15"
401779,"Dali JPA Tools","JPA","neil.hauge","CLOSED","INVALID","Some JPA validators flag errors when super class is outside project","2019-01-16 07:56:50"
406216,"Dali JPA Tools","JPA","neil.hauge","CLOSED","DUPLICATE","NPE in JpaFacetVersionChangeDataModelProvider","2013-04-26 09:45:43"
409334,"Dali JPA Tools","JPA","neil.hauge","CLOSED","FIXED","""Persistence xml editor"" has no input field for persistence unit name","2013-08-22 05:18:00"
392717,"Dali JPA Tools","Diagram Editor","petya.sabeva","CLOSED","FIXED","Update user documentation in eclipse","2013-04-24 07:28:52"
431961,"Dali JPA Tools","JAXB","tranle1","CLOSED","FIXED","[CBI] Enable JUnit tests for dali jpa and jaxb","2014-04-30 10:15:59"
465988,"Dali JPA Tools","JPA","tranle1","CLOSED","FIXED","JptJpaCoreModelTests reported 2 Junit failures on WTP builds","2015-06-02 10:18:01"
465989,"Dali JPA Tools","JPA","tranle1","CLOSED","FIXED","JptJpaCoreResourceModelTests test bucket reported 41 Junit failures on WTP builds","2015-05-22 15:00:00"
465990,"Dali JPA Tools","JPA","tranle1","CLOSED","FIXED","JptJpaEclipseLinkCoreResourceModelTests reported 1 failure in WTP 3.7.0 build.","2015-05-22 14:57:44"
465991,"Dali JPA Tools","General","tranle1","CLOSED","FIXED","Junit test failures for WTP 3.7.0 build","2015-06-25 10:26:20"
468497,"Dali JPA Tools","JPA","tranle1","CLOSED","FIXED","JaxbCoreMiscTests reported 2 test failures on WTP 3.7.0 build","2015-06-03 12:32:32"