"Bug ID","Product","Component","Assignee","Status","Resolution","Summary","Changed"
250738,"WTP Common Tools","Faceted Project Framework","konstantin","RESOLVED","FIXED","Cannot add second source folder to JavaFacetInstallConfig","2008-11-13 16:22:27"
250947,"WTP Common Tools","wst.common","konstantin","RESOLVED","FIXED","Versioning issue failing 3.0.3 Junit test","2008-10-15 14:43:25"
251253,"WTP Common Tools","Faceted Project Framework","konstantin","RESOLVED","FIXED","FacetProjectWorkingCopy creating many threads.....","2009-02-18 11:14:07"
251722,"WTP Common Tools","Faceted Project Framework","konstantin","RESOLVED","FIXED","defaultFacets extension point should support optional contributions","2009-02-18 10:01:38"
251947,"WTP Common Tools","Faceted Project Framework","konstantin","RESOLVED","FIXED","User library provider should support custom validation","2008-11-13 15:51:17"
251949,"WTP Common Tools","Faceted Project Framework","konstantin","RESOLVED","FIXED","User library provider should remember it's last state","2008-11-03 11:55:49"
253026,"WTP Common Tools","Faceted Project Framework","konstantin","RESOLVED","FIXED","LibraryInstallDelegate.refresh() should be desclared as public","2009-05-26 14:19:12"
253033,"WTP Common Tools","Faceted Project Framework","konstantin","RESOLVED","FIXED","Support easy downloading of libraries","2009-01-29 09:58:11"
253068,"WTP Common Tools","Faceted Project Framework","konstantin","RESOLVED","INVALID","Dynamic Presets need access to latest resolved default.config","2008-12-09 10:00:53"
253111,"WTP Common Tools","wst.common","konstantin","RESOLVED","FIXED","Unpolished look on new web project wizards. Needs UI Polish. (patch included)","2009-12-15 11:12:56"
253134,"WTP Common Tools","Faceted Project Framework","konstantin","RESOLVED","FIXED","Faceted Project Framework plugins should be configured for API Tools","2008-11-12 17:46:10"
254790,"WTP Common Tools","Faceted Project Framework","konstantin","RESOLVED","FIXED","User should be able to disable library configuration for a facet","2008-11-14 11:37:48"
254963,"WTP Common Tools","Faceted Project Framework","konstantin","RESOLVED","FIXED","Bad logging from the defaultFacets extension point","2008-11-11 18:54:56"
258402,"WTP Common Tools","Faceted Project Framework","konstantin","RESOLVED","FIXED","Need better API to check if project is faceted","2009-01-27 00:29:21"
263113,"WTP Common Tools","Faceted Project Framework","konstantin","RESOLVED","FIXED","Versionable no longer compiles as of I20090125-2000","2009-01-31 20:58:50"
263214,"WTP Common Tools","Faceted Project Framework","konstantin","RESOLVED","DUPLICATE","Project Facets page is too big on 1280x800","2009-02-18 11:49:59"
263412,"WTP Common Tools","Faceted Project Framework","konstantin","RESOLVED","FIXED","Need OSGi bundles library provider","2009-02-03 17:09:04"
266949,"WTP Common Tools","Faceted Project Framework","konstantin","RESOLVED","FIXED","Facet framework should have event tracing","2009-03-11 11:27:26"
267099,"WTP Common Tools","Faceted Project Framework","konstantin","RESOLVED","FIXED","RuntimesPropertyPage needs ProgressMonitor","2009-03-05 01:33:20"
268163,"WTP Common Tools","Faceted Project Framework","konstantin","RESOLVED","FIXED","Provide ability to customize the container lable for OSGi Library Provider","2009-03-11 23:50:27"
268862,"WTP Common Tools","wst.common","konstantin","RESOLVED","FIXED","Localization - Babel PTT","2009-03-17 22:33:03"
269993,"WTP Common Tools","Faceted Project Framework","konstantin","RESOLVED","FIXED","ProjectFacetPreferencesGroup.getPreferences() calls save that can cause deadlocks","2009-07-01 13:19:58"
270889,"WTP Common Tools","Faceted Project Framework","konstantin","RESOLVED","FIXED","LibraryInstallDelegate is not updated with changes in facet version","2009-04-14 11:01:49"
271906,"WTP Common Tools","Faceted Project Framework","konstantin","RESOLVED","FIXED","IFacetedProjectWorkingCopy not disposing causing memory leaks","2009-04-12 23:25:13"
274546,"WTP Common Tools","Faceted Project Framework","konstantin","RESOLVED","FIXED","NLS unused messages logged","2009-05-21 22:53:12"
277192,"WTP Common Tools","Faceted Project Framework","konstantin","RESOLVED","DUPLICATE","Dialog box width is way off the screen","2009-07-01 12:38:49"
277531,"WTP Common Tools","Faceted Project Framework","konstantin","RESOLVED","FIXED","OSGi bundle library provider bundle details should show resolved bundle versions","2012-01-03 14:32:14"
277549,"WTP Common Tools","Faceted Project Framework","konstantin","RESOLVED","FIXED","OSGi Bundles Library Provider puts libraries in system bootstrap claspath","2009-05-23 14:49:35"
282094,"WTP Common Tools","Faceted Project Framework","konstantin","RESOLVED","FIXED","widget is disposed exception because of listener not removed","2012-01-03 14:32:15"
282188,"WTP Common Tools","Faceted Project Framework","konstantin","RESOLVED","FIXED","ProjectFacetPreferencesGroup.getPreferences() calls save that can cause deadlocks","2012-01-03 14:32:18"
282204,"WTP Common Tools","Faceted Project Framework","konstantin","RESOLVED","FIXED","Layout problems with facets selection panel","2012-01-03 14:32:20"
283892,"WTP Common Tools","Faceted Project Framework","konstantin","RESOLVED","FIXED","OSGi bundles container should be tolerant of missing facets","2009-11-14 19:23:25"
289462,"WTP Common Tools","Faceted Project Framework","konstantin","RESOLVED","FIXED","cannot create faceted project outside workspace directory","2010-05-21 14:35:06"
289743,"WTP Common Tools","Faceted Project Framework","konstantin","RESOLVED","FIXED","Bad recovery cases under denied validateEdit","2010-05-19 23:56:55"
291843,"WTP Common Tools","Faceted Project Framework","konstantin","RESOLVED","FIXED","List of files missing copyright","2010-04-28 23:06:42"
294472,"WTP Common Tools","Faceted Project Framework","konstantin","RESOLVED","INVALID","No validation for empty source folder in JavaFacetInstallPage","2009-11-16 16:54:13"
294630,"WTP Common Tools","Faceted Project Framework","konstantin","RESOLVED","FIXED","Invalid thread access FacetsSelectionPanel.handleProjectFacetsChangedEvent","2010-05-17 13:01:57"
294913,"WTP Common Tools","Faceted Project Framework","konstantin","RESOLVED","FIXED","Deadlock while refreshing projects at startup","2009-11-14 13:05:49"
295544,"WTP Common Tools","Faceted Project Framework","konstantin","RESOLVED","FIXED","Not possible to Enable an arbitrary project as a Faceted Project from UI","2010-03-04 14:34:20"
295737,"WTP Common Tools","Faceted Project Framework","konstantin","RESOLVED","FIXED","Allow extenders to disable download library button and menu","2009-12-01 14:34:55"
298712,"WTP Common Tools","Faceted Project Framework","konstantin","RESOLVED","FIXED","Java Facet should utilize Execution Environment when updating Java Build Path","2010-01-13 12:16:58"
298904,"WTP Common Tools","Faceted Project Framework","konstantin","RESOLVED","FIXED","Support Java 7 in Java facet and Standard JRE runtime component","2010-01-13 12:17:02"
298905,"WTP Common Tools","Faceted Project Framework","konstantin","RESOLVED","FIXED","Change Java Facet id from ""jst.java"" to ""java""","2010-03-19 14:58:46"
298906,"WTP Common Tools","Faceted Project Framework","konstantin","RESOLVED","FIXED","Change Java Facet version for 5.0/6.0 to 1.5/1.6","2011-10-25 10:50:05"
298974,"WTP Common Tools","Faceted Project Framework","konstantin","RESOLVED","FIXED","Aliasing system is needed for facet id and facet version","2010-01-13 12:17:14"
300182,"WTP Common Tools","Faceted Project Framework","konstantin","RESOLVED","FIXED","Expose convert to faceted form action from configure menu","2010-01-20 14:30:29"
300875,"WTP Common Tools","Faceted Project Framework","konstantin","RESOLVED","FIXED","Add keyboard mnemonics to the Java Facet page","2010-02-05 15:03:06"
300881,"WTP Common Tools","Faceted Project Framework","konstantin","RESOLVED","FIXED","Add keyboard mnemonics to project creation wizards","2010-02-05 15:03:34"
301680,"WTP Common Tools","Faceted Project Framework","konstantin","RESOLVED","FIXED","Mnemonics conflict on the first project creation page","2010-02-05 15:05:56"
307574,"WTP Common Tools","Faceted Project Framework","konstantin","RESOLVED","FIXED","NPE at org.eclipse.wst.common.project.facet.core.internal.FacetedProjectWorkingCopy.getHighestAvailableVersion()","2010-04-21 17:05:46"
310561,"WTP Common Tools","Faceted Project Framework","konstantin","RESOLVED","FIXED","Facet group error message text","2010-04-27 20:03:32"
312684,"WTP Common Tools","Faceted Project Framework","konstantin","RESOLVED","FIXED","Image leak on the library provider install panel","2010-05-17 12:06:04"
313189,"WTP Common Tools","Faceted Project Framework","konstantin","RESOLVED","FIXED","Available target runtimes list sometimes not filtered correctly","2010-05-19 23:56:55"
317505,"WTP Common Tools","Faceted Project Framework","konstantin","RESOLVED","FIXED","[NLS] Accessibility: Labels of lists are not read by JAWS in several wizards","2010-06-28 18:33:37"
318254,"WTP Common Tools","Faceted Project Framework","konstantin","RESOLVED","FIXED","Confusing error message in the log","2010-06-28 18:33:52"
318506,"WTP Common Tools","Faceted Project Framework","konstantin","RESOLVED","FIXED","Revert button on Property Page is truncated in Japanese","2010-08-16 20:21:58"
318613,"WTP Common Tools","Faceted Project Framework","konstantin","RESOLVED","FIXED","Improve context info in the deprecated version syntax message","2010-07-08 15:35:01"
318698,"WTP Common Tools","Faceted Project Framework","konstantin","RESOLVED","FIXED","[api] Additional API for supported facets in IProjectFacet","2012-01-03 14:32:21"
318755,"WTP Common Tools","Faceted Project Framework","konstantin","RESOLVED","FIXED","[NLS] Java Facet Install Page not checking for duplicate folder names on add","2010-07-15 14:09:22"
318765,"WTP Common Tools","Faceted Project Framework","konstantin","RESOLVED","FIXED","[api] Consolidate getSortedVersions() method with getVersions() method family","2012-01-03 14:32:19"
322182,"WTP Common Tools","Faceted Project Framework","konstantin","RESOLVED","FIXED","[NLS] Java Facet Install Page not checking for empty Default output folder","2010-08-20 14:44:16"
322646,"WTP Common Tools","wst.common","konstantin","RESOLVED","FIXED","No IDataModel adapter for JavaFacetInstallConfig if o.e.jst.common.frameworks plugin hasn't loaded","2010-08-16 16:46:16"
323665,"WTP Common Tools","Faceted Project Framework","konstantin","RESOLVED","INVALID","Deadlock while changing the library provider for a JSF faceted project","2010-09-02 11:15:11"
323775,"WTP Common Tools","Faceted Project Framework","konstantin","RESOLVED","WORKSFORME","LibraryFacetPropertyPage doesn't commit changes on OK after trip to facets page","2010-09-02 14:05:45"
323870,"WTP Common Tools","Faceted Project Framework","konstantin","RESOLVED","DUPLICATE","WtpOsgiBundlesLibraryProviderInstallOperation does not set the classpath entry attribute to include libraries with the application","2010-09-01 20:29:41"
325172,"WTP Common Tools","Faceted Project Framework","konstantin","RESOLVED","WONTFIX","Facet framework does not respect conflicts if one facet is undefined","2010-09-28 09:48:11"
332804,"WTP Common Tools","Faceted Project Framework","konstantin","RESOLVED","WONTFIX","template in facet extesion point requires deprecated preset element","2011-01-05 14:45:49"
332806,"WTP Common Tools","Faceted Project Framework","konstantin","RESOLVED","FIXED","FacetedProjectWizard class bug","2011-01-05 15:03:13"
333234,"WTP Common Tools","Faceted Project Framework","konstantin","RESOLVED","WORKSFORME","Problem during conversion to facet projetct","2011-01-19 12:26:54"
334438,"WTP Common Tools","Faceted Project Framework","konstantin","RESOLVED","FIXED","Disable the Cancel button in Project Facets dialog","2011-01-19 14:56:04"
334835,"WTP Common Tools","Faceted Project Framework","konstantin","RESOLVED","FIXED","Remove cancel button from project facets dialog","2011-01-27 13:05:51"
334844,"WTP Common Tools","Faceted Project Framework","konstantin","RESOLVED","FIXED","Remove the disabled Cancel button from Project Facets dialog","2011-01-23 20:04:17"
334948,"WTP Common Tools","Faceted Project Framework","konstantin","RESOLVED","FIXED","Workspace compile errors in HEAD","2011-01-24 11:56:42"
336545,"WTP Common Tools","Faceted Project Framework","konstantin","RESOLVED","FIXED","NPE when parsing the file content that is located in different file system","2011-03-16 23:33:37"
340221,"WTP Common Tools","Faceted Project Framework","konstantin","RESOLVED","FIXED","Setting enablement context variable on LibraryInstallDelegate causes refresh, even if no change","2011-03-16 23:04:02"
341376,"WTP Common Tools","Faceted Project Framework","konstantin","RESOLVED","FIXED","redundant null check in FacetsPropertyPage","2011-03-31 12:02:37"
348784,"WTP Common Tools","Faceted Project Framework","konstantin","RESOLVED","FIXED","""Argument not valid"" exception when locking project facet using the Project Facets Dialog after it has been opened previously","2011-10-06 01:03:02"
362754,"WTP Common Tools","Faceted Project Framework","konstantin","RESOLVED","FIXED","Faceted Project Framework versioning problems prevent WTP 3.4.0 M3 declare","2011-11-03 00:26:56"
416829,"WTP Common Tools","Faceted Project Framework","konstantin","RESOLVED","INVALID","Project Facet Validation against Java version","2014-06-24 11:58:03"
426884,"WTP Common Tools","Faceted Project Framework","konstantin","RESOLVED","FIXED","Java Version 1.8 of project facet java does not exist","2017-09-25 11:11:15"
436495,"WTP Common Tools","wst.common","ktsao","RESOLVED","FIXED","ArrayIndexOutOfBoundsException occurs randomly during a headless build","2015-01-29 14:23:25"
445591,"WTP Common Tools","Faceted Project Framework","marcel.bruch","RESOLVED","DUPLICATE","Failed while invoking preset factory ""org.eclipse.wst.common.project.facet.co... (err_grp: b5afab60)","2015-04-01 13:04:34"
86309,"WTP Common Tools","wst.validation","nagrawal","RESOLVED","WONTFIX","[validation] Move core helper from XML validator to validation framework","2009-08-18 15:55:57"
137312,"WTP Common Tools","wst.validation","nagrawal","RESOLVED","WONTFIX","[validation] Need public Validation Framework API","2009-08-18 16:11:03"
138706,"WTP Common Tools","wst.validation","nagrawal","RESOLVED","WONTFIX","[validation] Validation extension point documentation is incomplete","2009-08-18 16:05:31"
159149,"WTP Common Tools","wst.common","nagrawal","RESOLVED","FIXED","[validation] Random validation failure","2008-11-13 13:10:24"
178108,"WTP Common Tools","wst.validation","nagrawal","RESOLVED","INVALID","NLS33: Unexternalized strings in validation preference page","2007-09-10 13:53:24"
188711,"WTP Common Tools","wst.validation","nagrawal","RESOLVED","WONTFIX","[validation] Attempted to beginRule: F/workshop-struts-tour/site/WEB-INF, does not match outer scope rule: L/workshop-struts-tour/site/WEB-INF/web.xml","2007-06-13 15:19:20"
191294,"WTP Common Tools","wst.validation","nagrawal","RESOLVED","FIXED","Erratic errors reported by EAR validator","2007-09-10 13:53:24"
266543,"WTP Common Tools","wst.validation","nagrawal","RESOLVED","FIXED","[hotbug_request][WST] org.eclipse.core.internal.resources.ResourceException: Resource /testValue does not exist.","2009-03-12 05:03:55"
303232,"WTP Common Tools","wst.common","nagrawal","RESOLVED","FIXED","A Set of types can also register to a Component type","2010-03-01 17:53:42"
284017,"WTP Common Tools","wst.common","nsand.dev","RESOLVED","FIXED","ComponentResolver does not resolve absolute references to the context root","2009-07-22 16:56:06"
285071,"WTP Common Tools","wst.common","nsand.dev","RESOLVED","FIXED","ComponentResolver does not resolve absolute references to the context root","2009-08-10 15:31:10"
288120,"WTP Common Tools","Snippets Framework","nsand.dev","RESOLVED","FIXED","Double clicking to insert a snippet can modify a read-only file","2009-10-05 16:16:50"
290055,"WTP Common Tools","Snippets Framework","nsand.dev","RESOLVED","FIXED","Double clicking to insert a snippet can modify a read-only file","2010-01-27 19:15:26"
319219,"WTP Common Tools","Snippets Framework","nsand.dev","RESOLVED","FIXED","[Palette] Scroll Bar is missing for Template in customize palette dialog","2012-03-26 16:59:20"
333695,"WTP Common Tools","Snippets Framework","nsand.dev","RESOLVED","FIXED","'Snippets' customization dialog can get into an infinite error loop","2011-01-12 15:06:52"
334176,"WTP Common Tools","Snippets Framework","nsand.dev","RESOLVED","FIXED","Canceling the variable insertion dialog causes errors","2011-01-12 23:43:01"
384397,"WTP Common Tools","wst.validation","nsand.dev","RESOLVED","FIXED","ValidationPlugin#stop() should stop its jobs instead of join()ing them","2013-01-25 15:44:07"
393683,"WTP Common Tools","Snippets Framework","nsand.dev","RESOLVED","FIXED","NPE when cancelling out of snippets import operation","2012-11-19 11:55:10"
453099,"WTP Common Tools","Faceted Project Framework","platform-ui-triaged","RESOLVED","INVALID","[BiDi] Bidirectional text: The arrows of the combo box are not placed correctly","2015-02-17 06:36:35"
102702,"WTP Common Tools","wst.internet","pmoogk","RESOLVED","WONTFIX","Fail to respond to http 407 error messages","2010-03-11 15:01:02"
111964,"WTP Common Tools","wst.internet","pmoogk","RESOLVED","WONTFIX","Cache (and cache related preferences) should be configuration scoped.","2010-03-11 14:59:33"
120277,"WTP Common Tools","wst.internet","pmoogk","RESOLVED","WONTFIX","We should test the many cases of server responses when getting remote resources","2010-03-11 14:58:59"
130533,"WTP Common Tools","wst.internet","pmoogk","RESOLVED","WONTFIX","WTP extremely slow on linux system without a LAN connection","2010-03-11 14:58:07"
133430,"WTP Common Tools","wst.internet","pmoogk","RESOLVED","WONTFIX","Internet cache prompts with license dialog in headless mode","2010-03-11 14:57:32"
161635,"WTP Common Tools","wst.internet","pmoogk","RESOLVED","WONTFIX","Cache attempts to refresh in main thread","2010-03-11 14:56:50"
161636,"WTP Common Tools","wst.internet","pmoogk","RESOLVED","WONTFIX","Cache default expiration time is 1 day, it should be much longer","2010-03-11 14:56:17"
161998,"WTP Common Tools","wst.internet","pmoogk","RESOLVED","WONTFIX","Cache can't be used headless","2010-03-11 14:55:27"
170387,"WTP Common Tools","wst.internet","pmoogk","RESOLVED","WONTFIX","Cache of web-app_2_4.xsd hangs forever","2010-03-11 15:00:19"
181686,"WTP Common Tools","wst.internet","pmoogk","RESOLVED","WONTFIX","[Cache] javax.xml.parsers.DocumentBuilder#parse(String) method fails","2010-03-11 14:54:34"
200635,"WTP Common Tools","wst.common","pmoogk","RESOLVED","FIXED","old proxy projects should be ""nulled out"" in HEAD","2007-08-21 17:58:47"
237878,"WTP Common Tools","wst.internet","pmoogk","RESOLVED","DUPLICATE","testRelativeSystemId Unit test fails frequently","2008-08-26 15:49:42"
192712,"WTP Common Tools","wst.common","ramanday","RESOLVED","FIXED","EMF2SAXWriter.shouldRenderDOMPath has suspect code that writes out empty tags","2007-09-13 16:57:56"
192752,"WTP Common Tools","wst.common","ramanday","RESOLVED","FIXED","presence of duplicate http-method inside of web.xml can cause EMF2DOMAdapterImpl to throw exceptions","2007-09-10 13:53:42"
257640,"WTP Common Tools","wst.validation","rosendo","RESOLVED","FIXED","V2 Validation Framework ignoring IResourceDelta.REMOVED events","2012-02-22 12:57:49"
277428,"WTP Common Tools","wst.validation","rosendo","RESOLVED","FIXED","Validation preferences not imported correctly","2011-09-01 13:23:35"
302914,"WTP Common Tools","wst.validation","rosendo","RESOLVED","FIXED","[UI] Filter settings UI needs polish","2011-09-08 12:42:14"
356521,"WTP Common Tools","wst.common","rosendo","RESOLVED","FIXED","Deadlock occurring due to ModuleStructuralModel.checkSync() in 3.0.5 P","2011-09-13 11:48:58"
358291,"WTP Common Tools","wst.validation","rosendo","RESOLVED","FIXED","NPE when trying to get Nature Descriptor","2011-10-20 00:28:05"
361077,"WTP Common Tools","wst.validation","rosendo","RESOLVED","FIXED","NullPointerException during validation when dep.index filesize is 0","2012-10-30 17:14:39"
366065,"WTP Common Tools","wst.validation","rosendo","RESOLVED","FIXED","Add a new filter rule to include/exclude based on a target runtime","2012-01-04 20:56:46"
366103,"WTP Common Tools","wst.validation","rosendo","RESOLVED","FIXED","Add a new filter rule to include/exclude based on a target runtime WTP 3.3.2","2012-02-22 13:00:08"
367860,"WTP Common Tools","wst.validation","rosendo","RESOLVED","FIXED","Avoid IllegalArgumentException in Validation filters","2012-01-11 11:50:37"
367882,"WTP Common Tools","wst.validation","rosendo","RESOLVED","FIXED","Avoid IllegalArgumentException in Validation filters","2012-02-22 13:01:52"
369587,"WTP Common Tools","wst.validation","rosendo","RESOLVED","FIXED","V2 Validation Framework ignoring IResourceDelta.REMOVED events","2012-03-22 16:06:31"
369593,"WTP Common Tools","wst.validation","rosendo","RESOLVED","FIXED","New filter rule for target runtime in validator extension point is not working","2012-02-22 13:16:42"
370881,"WTP Common Tools","wst.validation","rosendo","RESOLVED","FIXED","Add JUnit to test target runtime filter rule","2012-02-22 13:17:11"
370981,"WTP Common Tools","wst.validation","rosendo","RESOLVED","FIXED","New filter rule for target runtime in validator extension point is not working","2012-03-16 16:35:05"
372398,"WTP Common Tools","wst.common","rosendo","RESOLVED","FIXED","Common API should not be provisional/experimental","2012-03-14 13:52:59"
372524,"WTP Common Tools","wst.validation","rosendo","RESOLVED","FIXED","Remove reference to JBoss","2012-03-16 16:19:50"
373416,"WTP Common Tools","wst.validation","rosendo","RESOLVED","FIXED","Remove reference to JBoss","2012-03-06 22:47:06"
373419,"WTP Common Tools","wst.validation","rosendo","RESOLVED","FIXED","Remove reference to JBoss","2012-04-25 20:50:48"
373570,"WTP Common Tools","wst.validation","rosendo","RESOLVED","FIXED","V2 Validation Framework ignoring IResourceDelta.REMOVED events","2012-03-23 12:44:47"
373575,"WTP Common Tools","wst.validation","rosendo","RESOLVED","FIXED","IResourceDelta.REMOVED is sent for Dependent Resources","2012-04-04 09:46:54"
380173,"WTP Common Tools","wst.validation","rosendo","RESOLVED","FIXED","Validation rule for target runtime is not working on EJB Validator","2013-04-02 17:05:27"
385221,"WTP Common Tools","wst.validation","rosendo","RESOLVED","FIXED","Validation rule for target runtime is not working on EJB Validator","2012-09-06 16:32:04"
387244,"WTP Common Tools","wst.validation","rosendo","RESOLVED","FIXED","Validator is not called when server created if workspace is not empty","2012-08-16 15:27:42"
388611,"WTP Common Tools","wst.validation","rosendo","RESOLVED","FIXED","Errors in FAQ.HTML","2012-09-05 17:34:19"
397814,"WTP Common Tools","wst.common","rosendo","RESOLVED","FIXED","NPE in FilterRule - TargetRuntime when project has no runtime","2013-02-20 11:49:57"
414918,"WTP Common Tools","wst.common","rosendo","RESOLVED","FIXED","Using relative path to include a XML file leads to a XML Definition validation error","2013-09-05 14:05:20"
203809,"WTP Common Tools","wst.common","sandakith","RESOLVED","INVALID","Axis2:  Generate bottom-up WS fails: Unable to add the follwing facets to project SecureMessagingWS: Axis2 Web Services Extensions, Axis2 Web Services Core.","2007-09-18 23:09:24"
121460,"WTP Common Tools","wst.common","shr31223","RESOLVED","FIXED","[modulecore] Behavior when multiple src dirs are mapped to component root","2011-11-29 16:03:57"
127950,"WTP Common Tools","wst.common","shr31223","RESOLVED","WORKSFORME","[project creation] EAR default should take into account server targets","2011-06-08 12:09:27"
155974,"WTP Common Tools","Snippets Framework","shr31223","RESOLVED","DUPLICATE","[snippets] When Customizing a snippet with very long lines, the Customize dialog grows too large","2015-06-02 10:34:38"
157428,"WTP Common Tools","Snippets Framework","shr31223","RESOLVED","DUPLICATE","customize snippets dialog does not properly resize for long template pattern","2015-06-02 11:08:51"
183700,"WTP Common Tools","Snippets Framework","shr31223","RESOLVED","FIXED","[Snippets] An empty category name and the template name can be made.","2016-02-26 21:21:31"
331719,"WTP Common Tools","wst.common","shr31223","RESOLVED","FIXED","Deadlock in DependencyGraphImpl call to yieldRule from the AutoBuildJob","2011-09-13 09:43:23"
337742,"WTP Common Tools","Faceted Project Framework","shr31223","RESOLVED","FIXED","FACET_PROJECT_NAME not updated in DataModel when project name is changed for facet added after opening the new project wizard","2011-02-25 17:40:48"
354757,"WTP Common Tools","wst.common","shr31223","RESOLVED","FIXED","Default root source folder not tagged when creating a web fragment project","2011-08-16 10:31:35"
355343,"WTP Common Tools","Faceted Project Framework","shr31223","RESOLVED","FIXED","NPE in log when accessing project facets page of closed faceted project","2014-07-12 12:03:25"
357558,"WTP Common Tools","wst.common","shr31223","RESOLVED","FIXED","FacetProjectCreationDataModelProvider creates listeners that are not cleaned up in the dispose method","2011-09-15 13:34:02"
357846,"WTP Common Tools","wst.common","shr31223","RESOLVED","FIXED","FacetProjectCreationDataModelProvider creates listeners that are not cleaned up in the dispose method","2011-10-10 16:44:23"
357866,"WTP Common Tools","wst.common","shr31223","RESOLVED","FIXED","[modulecore] Behavior when multiple src dirs are mapped to component root","2011-11-29 16:03:57"
