"Bug ID","Product","Component","Assignee","Status","Resolution","Summary","Changed"
482343,"WTP Source Editing","wst.xsl","wst.xsl-inbox","NEW"," ---","Opening an empty xsl-File leads to a SAXParserException","2015-11-17 05:24:25"
372827,"WTP Source Editing","jst.jsp","zalapa","NEW"," ---","[validation] Wrong warning on JSP: import is never used","2012-07-27 04:13:16"
373854,"WTP Source Editing","wst.xml","zalapa","NEW"," ---","[formatting] MalformedTreeException when formatting XML","2014-09-18 13:58:41"
385113,"WTP Source Editing","wst.xml","zalapa","NEW"," ---","Bad XML Formatting","2013-06-19 11:13:36"
390741,"WTP Source Editing","wst.xml","zalapa","NEW"," ---","[accessibility]Some shortcuts missing in xml source outline's context menu","2014-09-18 13:58:38"
391648,"WTP Source Editing","jst.jsp","zalapa","NEW"," ---","Wrong indentation when formatting scriptlet on JSP","2014-09-18 13:58:32"
404735,"WTP Source Editing","wst.html","zalapa","NEW"," ---","HTML 5 wrong warning about a tag containing div tag","2017-02-15 16:41:00"
398602,"WTP Source Editing","wst.xpath","jesper","ASSIGNED"," ---","[xpath2] Return native values which are as narrow as possible.","2013-01-20 22:10:02"
375883,"WTP Source Editing","wst.xml","nsand.dev","ASSIGNED"," ---","[formatting] xml formatter throws exception on numeric character reference","2013-06-19 11:13:31"
423197,"WTP Source Editing","wst.sse","nsand.dev","ASSIGNED"," ---","Remove unnecessary double buffering from StructuredFileTaskScanner","2014-09-18 13:58:44"
370425,"WTP Source Editing","wst.html","zalapa","ASSIGNED"," ---","[formatting] Formatter inserts an extra line break before closing inline tag if there is some other inline tag inside.","2014-09-18 13:58:37"
388687,"WTP Source Editing","wst.xsd","keith.chong.ca","REOPENED"," ---","Unhandled event loop exception - NPE in ADTMultiPageEditor","2016-04-14 17:48:00"
420688,"WTP Source Editing","wst.dtd","wst.dtd-inbox","REOPENED"," ---","Impossible to disable *.mod validation or file association to DTD","2013-12-05 14:07:51"
388007,"WTP Source Editing","wst.sse","thatnitind","RESOLVED","FIXED","add JAXB bindingschema to jst standard schemas","2013-04-24 11:20:46"
410161,"WTP Source Editing","jst.jsp","thatnitind","RESOLVED","FIXED","NPE when editing a JSP file in maven project with war overlays","2013-06-07 12:07:00"
473556,"WTP Source Editing","wst.sse","vrubezhny","RESOLVED","FIXED","NullPointerException in ToggleBreakpointsTarget.getBreakpoints (108)","2019-04-28 18:16:10"
428246,"WTP Source Editing","wst.xml","alina","RESOLVED","FIXED","XML indentation size preference spinner is disabled since Kepler on Linux GTK","2016-03-03 16:01:36"
444871,"WTP Source Editing","wst.html","alina","RESOLVED","FIXED","[Validation - HTML5] The (type) attribute of the (ol) element is no longer obsolete","2019-05-29 11:28:27"
458779,"WTP Source Editing","wst.html","alina","RESOLVED","FIXED","NPE thrown by org.eclipse.wst.html.core.internal.format.HTMLTextFormatter.isWordInComplexRegion() when text.getFirstStructuredDocumentRegion() returns null","2015-01-31 16:42:35"
459345,"WTP Source Editing","wst.css","alina","RESOLVED","FIXED","NPE in quick outline","2017-04-24 21:25:24"
462343,"WTP Source Editing","wst.html","alina","RESOLVED","FIXED","Unrecognized muted attribute for video tag","2017-12-17 15:30:15"
439914,"WTP Source Editing","wst.xml","arturd","RESOLVED","FIXED","Can not change names in XML Schema Editor when schema does not have a target namespace","2014-08-13 11:22:02"
440912,"WTP Source Editing","wst.xml","arturd","RESOLVED","FIXED","Can not change names in XML Schema Editor when schema does not have a target namespace","2015-01-27 15:38:56"
441104,"WTP Source Editing","wst.css","harawata","RESOLVED","FIXED","Source format damages css definition to un-usable","2020-04-12 12:54:57"
384233,"WTP Source Editing","wst.xsl","jesper","RESOLVED","DUPLICATE","Umlauts in Tag-Names are marked as wrong XPath within XSL-Documents.","2013-04-22 17:47:21"
388504,"WTP Source Editing","wst.xpath","jesper","RESOLVED","FIXED","[xpath2] XPath scanner does not detect non-ASCII names","2013-04-22 17:47:02"
404956,"WTP Source Editing","wst.xsl","jesper","RESOLVED","FIXED","[xsl][launch] Launching an XML file as 'XSL Transformation' doesn't transform anything","2013-04-08 19:16:01"
405220,"WTP Source Editing","wst.xsl","jesper","RESOLVED","FIXED","[NLS][xsl] Add default shortcut for launching XSLT","2014-03-22 13:03:02"
406262,"WTP Source Editing","wst.xsl","jesper","RESOLVED","FIXED","[xsl][validation] StackOverflow when checking for circular includes on next level import","2013-04-22 19:15:02"
429611,"WTP Source Editing","wst.xsl","jesper","RESOLVED","FIXED","[CBI] Enable JUnit tests for sourceediting.xsl.tests repo","2018-07-05 14:46:45"
477864,"WTP Source Editing","wst.xpath","jesper","RESOLVED","FIXED","Remove dependency on org.eclipse.core.runtime.compatibility bundle","2015-10-08 14:23:11"
482859,"WTP Source Editing","wst.xsd","jgwest","RESOLVED","FIXED","Failure to check namespace in OpenOnSelectionHelper","2015-11-23 22:03:28"
379129,"WTP Source Editing","jst.jsp","jst.jsp-inbox","RESOLVED","FIXED","NullPointerException from JSPBatchValidator.validateFile","2013-01-02 14:33:56"
383498,"WTP Source Editing","jst.jsp","jst.jsp-inbox","RESOLVED","WORKSFORME","ServletContext cannot be resolved to a type","2012-08-13 10:51:11"
385008,"WTP Source Editing","jst.jsp","jst.jsp-inbox","RESOLVED","FIXED","Missing of JSP components in Eclipse Juno","2013-01-08 19:09:03"
385044,"WTP Source Editing","jst.jsp","jst.jsp-inbox","RESOLVED","WORKSFORME","[regression] Select enclosing/next/prev element not longer available in jsp editor","2018-05-05 03:53:33"
386409,"WTP Source Editing","jst.jsp","jst.jsp-inbox","RESOLVED","WORKSFORME","Logs are filled continuously with ""could not match input""","2018-05-05 03:49:14"
389766,"WTP Source Editing","jst.jsp","jst.jsp-inbox","RESOLVED","WORKSFORME","Failed to read schema document error in ejb-jar.xml","2013-06-06 14:05:40"
418748,"WTP Source Editing","jst.jsp","jst.jsp-inbox","RESOLVED","FIXED","Excessive memory usage in TLDTagRegistry.initialize() cause by FacetModuleCoreSupportDelegate.getReferenced()","2013-10-05 14:32:13"
420948,"WTP Source Editing","jst.jsp","jst.jsp-inbox","RESOLVED","INVALID","Missing end tag for ""c:out"" inside <-- -->comment","2013-11-04 12:25:38"
431922,"WTP Source Editing","jst.jsp","jst.jsp-inbox","RESOLVED","FIXED","[CBI] org.eclipse.jst.jsp.core.tests java.lang.IllegalArgumentException: Path must include project and resource name","2014-05-16 13:23:54"
431925,"WTP Source Editing","jst.jsp","jst.jsp-inbox","RESOLVED","FIXED","[CBI] org.eclipse.jst.jsp.tests.encoding FileNotFoundException org.eclipse.wst.xml.tests.encoding-1.0.500-SNAPSHOT.jar!/testfiles.zip","2014-04-10 13:51:13"
431926,"WTP Source Editing","jst.jsp","jst.jsp-inbox","RESOLVED","FIXED","[CBI] org.eclipse.jst.jsp.ui.tests Unable to open structured text editor","2014-05-15 14:29:21"
435089,"WTP Source Editing","jst.jsp","jst.jsp-inbox","RESOLVED","FIXED","[CBI] org.eclipse.jst.jsp.core.tests.JSPCoreTestSuite hangs when run","2014-08-12 15:43:08"
462808,"WTP Source Editing","jst.jsp","jst.jsp-inbox","RESOLVED","WONTFIX","Syntax highlighting for JSP files using Javascript templates like underscore,moustache,ractive,jsrender,etc.","2015-10-28 01:36:14"
464963,"WTP Source Editing","jst.jsp","jst.jsp-inbox","RESOLVED","INVALID","sdas","2015-04-20 10:51:29"
438283,"WTP Source Editing","wst.css","kaloyan","RESOLVED","FIXED","Make CSS3 the default CSS profile","2016-02-19 04:10:32"
443702,"WTP Source Editing","wst.html","kaloyan","RESOLVED","FIXED","Template for adding link to external style sheet","2016-06-30 04:33:18"
374333,"WTP Source Editing","wst.xsd","keith.chong.ca","RESOLVED","FIXED","Temporarily comment out StackOverflowTest","2012-03-14 23:20:22"
376347,"WTP Source Editing","wst.xsd","keith.chong.ca","RESOLVED","FIXED","XSI types not correctly supported in Content Model - XSD component","2012-04-16 16:08:16"
400379,"WTP Source Editing","wst.sse","keith.chong.ca","RESOLVED","FIXED","Add ws-securitypolicy.xsd and ws-securitypolicy-1.2.xsd to the standard schemas plugin","2013-03-19 11:06:41"
402474,"WTP Source Editing","wst.sse","keith.chong.ca","RESOLVED","FIXED","Add ws-securitypolicy.xsd and ws-securitypolicy-1.2.xsd to the standard schemas plugin","2013-04-18 13:48:01"
421694,"WTP Source Editing","wst.xsd","keith.chong.ca","RESOLVED","WORKSFORME","XSD editor F3 open selection not working","2014-01-09 21:07:01"
424276,"WTP Source Editing","wst.xsd","keith.chong.ca","RESOLVED","FIXED","Content-assist in XSD for a simpleType with user defined restriction does not work","2014-01-15 15:04:11"
469273,"WTP Source Editing","wst.xsd","keith.chong.ca","RESOLVED","WORKSFORME","XSD editor fails for second tab with a NPE error","2015-06-26 08:10:03"
476274,"WTP Source Editing","wst.xsd","keith.chong.ca","RESOLVED","WONTFIX","Referenced file ejb-jar_3_1.xsd contains errors","2016-01-26 17:52:44"
480167,"WTP Source Editing","wst.xsd","keith.chong.ca","RESOLVED","FIXED","WTP 3.8: Default preferences are not initialized (dependent on runtime compatibility. layer)","2015-11-05 11:11:36"
482866,"WTP Source Editing","wst.xsd","keith.chong.ca","RESOLVED","FIXED","37x: Failure to check namespace in OpenOnSelectionHelper","2015-11-23 22:02:51"
367856,"WTP Source Editing","wst.html","nsand.dev","RESOLVED","FIXED","[validation] Track javascript dependencies for validation in HTML","2012-02-08 17:53:48"
367874,"WTP Source Editing","wst.html","nsand.dev","RESOLVED","FIXED","org.eclipse.wst.sse.ui.internal.derived.HTML2TextReader hangs when reading file with <head>","2012-02-02 11:19:11"
368063,"WTP Source Editing","wst.sse","nsand.dev","RESOLVED","FIXED","AssertionFailedException after clicking on a tab editor","2012-01-09 14:59:42"
368067,"WTP Source Editing","wst.xml","nsand.dev","RESOLVED","FIXED","Not all schema locations are honored for some WSDLs","2012-02-08 17:52:31"
370379,"WTP Source Editing","wst.xml","nsand.dev","RESOLVED","FIXED","Not all schema locations are honored for some WSDLs","2012-02-08 17:52:40"
370682,"WTP Source Editing","wst.sse","nsand.dev","RESOLVED","FIXED","ClassCastException in SSE Outline handler. Invalid enablement.","2012-02-14 12:36:20"
371019,"WTP Source Editing","wst.html","nsand.dev","RESOLVED","FIXED","Incorrect validation of resource across web projects","2012-02-20 10:36:55"
371021,"WTP Source Editing","wst.html","nsand.dev","RESOLVED","FIXED","Incorrect validation of resource across web projects","2012-02-10 13:59:02"
371292,"WTP Source Editing","wst.xml","nsand.dev","RESOLVED","FIXED","Selecting large ranges of xml/html in a large file freezes XML and HTML editors for a long time","2012-10-12 14:59:44"
372008,"WTP Source Editing","wst.sse","nsand.dev","RESOLVED","FIXED","[content assist] Icon of CompletionProposalCategory does not allow platform:/... syntax","2012-10-17 11:47:21"
372180,"WTP Source Editing","jst.jsp","nsand.dev","RESOLVED","FIXED","[misc] ZipException with external class folders","2012-02-29 16:41:04"
373094,"WTP Source Editing","wst.xml","nsand.dev","RESOLVED","FIXED","Caret position not restored after restart in XML editor","2012-04-27 15:42:24"
373410,"WTP Source Editing","jst.jsp","nsand.dev","RESOLVED","FIXED","[translation] JSP translation never initializes exception field","2012-03-06 13:46:53"
373658,"WTP Source Editing","jst.jsp","nsand.dev","RESOLVED","FIXED","rtexprvalue tag attribute default incorrect","2012-04-04 11:29:09"
373818,"WTP Source Editing","wst.xml","nsand.dev","RESOLVED","FIXED","Cheese on the XML editor in 4.2","2012-03-13 14:23:12"
375605,"WTP Source Editing","wst.html","nsand.dev","RESOLVED","FIXED","""New File (HTML/JSP)"" wizard uses wrong default location","2012-10-12 11:09:40"
376202,"WTP Source Editing","wst.xml","nsand.dev","RESOLVED","FIXED","XSI types not correctly supported in Content Model","2012-04-24 13:44:30"
376262,"WTP Source Editing","wst.xml","nsand.dev","RESOLVED","FIXED","[content assist] XML editor content assist fails when only one element ""implements"" a substitution group","2012-05-21 10:49:21"
376608,"WTP Source Editing","wst.xml","nsand.dev","RESOLVED","FIXED","XSI types not correctly supported in Content Model","2013-01-08 14:25:01"
376926,"WTP Source Editing","jst.jsp","nsand.dev","RESOLVED","FIXED","Wrong Validation Error Message -""pageContext cannot be resolved"" for tag file","2012-11-07 16:29:04"
377677,"WTP Source Editing","wst.xml","nsand.dev","RESOLVED","FIXED","High-contrast mode selected comments cannot be read","2012-10-01 12:56:20"
378613,"WTP Source Editing","wst.dtd","nsand.dev","RESOLVED","FIXED","Parser produces invalid Ecore model","2012-05-17 15:41:49"
379148,"WTP Source Editing","jst.jsp","nsand.dev","RESOLVED","FIXED","StringIndexOutOfBoundsException: String index out of range: -1","2013-01-02 13:17:02"
379476,"WTP Source Editing","wst.sse","nsand.dev","RESOLVED","FIXED","URIResolver shared between new instances of a model","2012-05-16 13:10:36"
379843,"WTP Source Editing","wst.dtd","nsand.dev","RESOLVED","FIXED","Regenerate the DTD Ecore model","2012-10-05 15:07:18"
379984,"WTP Source Editing","wst.xml","nsand.dev","RESOLVED","FIXED","getAttributeNode in ElementImpl should not perform modifications on the document","2012-06-07 14:06:23"
381638,"WTP Source Editing","jst.jsp","nsand.dev","RESOLVED","FIXED","Missing license header on org.eclipse.jst.jsp.core.internal.java.JSPProblemRequestor","2012-08-13 13:49:15"
381694,"WTP Source Editing","jst.jsp","nsand.dev","RESOLVED","FIXED","Wrong source insertion after dnd an element into another with no end tag on JSP page.","2013-07-31 10:27:37"
382747,"WTP Source Editing","jst.jsp","nsand.dev","RESOLVED","FIXED","Exceptions on JSP validation","2012-11-08 11:21:25"
384776,"WTP Source Editing","wst.sse","nsand.dev","RESOLVED","FIXED","[reconciling] DirtyRegionProcessor incorrectly calculates partitioning changes, that results in re-validation of all the document instead of a one or few partitions.","2012-10-31 11:17:01"
386108,"WTP Source Editing","jst.jsp","nsand.dev","RESOLVED","FIXED","JSP formatter shouldn't break EL expression into two lines","2013-01-02 18:09:00"
386452,"WTP Source Editing","jst.jsp","nsand.dev","RESOLVED","FIXED","ConcurrentModificationException in CMNamedNodeMapForBuddySystem","2013-01-01 08:37:04"
386638,"WTP Source Editing","wst.html","nsand.dev","RESOLVED","FIXED","Web Content Settings - CSS profile won't be saved","2013-03-19 01:48:31"
386967,"WTP Source Editing","wst.html","nsand.dev","RESOLVED","FIXED","WSW38 TVT Possible non-externalized strings - Insert single proposals","2012-08-10 16:48:38"
386974,"WTP Source Editing","wst.html","nsand.dev","RESOLVED","FIXED","On completing <script> attributes, source is wrong inserted and re-formatted","2012-10-01 12:56:02"
387242,"WTP Source Editing","wst.html","nsand.dev","RESOLVED","FIXED","Unmanaged HTML models can be leaked because of preference listener","2012-08-14 16:35:24"
387401,"WTP Source Editing","wst.html","nsand.dev","RESOLVED","FIXED","Validator Not Working","2012-08-20 10:38:30"
387855,"WTP Source Editing","wst.sse","nsand.dev","RESOLVED","FIXED","Unknown Option in the Edit Menu","2013-01-08 21:04:30"
388391,"WTP Source Editing","jst.jsp","nsand.dev","RESOLVED","FIXED","constant freezes with 100% cpu","2012-12-31 15:18:05"
388608,"WTP Source Editing","jst.jsp","nsand.dev","RESOLVED","FIXED","'{0}' will be resolved to the literal text: {0}","2012-10-22 11:15:04"
388610,"WTP Source Editing","wst.html","nsand.dev","RESOLVED","FIXED","HTMLCOREPLUGINRESOURCES.PROPERTIES: Found 1 single quote in text handled by Java MessageFormat class","2013-02-20 17:50:16"
388613,"WTP Source Editing","wst.xml","nsand.dev","RESOLVED","FIXED","Duplicate string IDs found","2012-11-07 18:11:59"
388614,"WTP Source Editing","wst.xsl","nsand.dev","RESOLVED","FIXED","[NLS] Duplicate string IDs found","2013-04-03 17:02:32"
388997,"WTP Source Editing","wst.xml","nsand.dev","RESOLVED","FIXED","Improper handling of substitution groups in modelquery","2012-10-01 12:56:39"
389963,"WTP Source Editing","wst.sse","nsand.dev","RESOLVED","FIXED","URIResolver shared between new instances of a model","2012-11-07 18:02:31"
390501,"WTP Source Editing","wst.dtd","nsand.dev","RESOLVED","FIXED","org.eclipse.wst.dtd.ui.internal.style.LineStyleProviderForDTDSubSet never releases its unmanaged model","2012-10-08 17:40:30"
390826,"WTP Source Editing","wst.xml","nsand.dev","RESOLVED","FIXED","ClassCastException: org.apache.xerces.parsers.XIncludeAwareParserConfiguration incompatible with org.apache.xerces.xni.parser.XMLParserConfiguration when using IBM JRE","2012-12-14 16:12:17"
391079,"WTP Source Editing","jst.jsp","nsand.dev","RESOLVED","FIXED","<textarea> tag should not be formatted when I hit Ctrl+Shift+F - jsp formatter","2013-01-07 10:26:27"
392071,"WTP Source Editing","wst.css","nsand.dev","RESOLVED","FIXED","CSS editor unindents next line after copy-paste","2012-11-02 16:23:19"
393894,"WTP Source Editing","jst.jsp","nsand.dev","RESOLVED","FIXED","Tag files' Java content not indexed","2012-11-08 11:28:35"
393935,"WTP Source Editing","wst.xml","nsand.dev","RESOLVED","FIXED","Parsing of <?import PI is wrong","2012-11-08 20:16:44"
393937,"WTP Source Editing","wst.xml","nsand.dev","RESOLVED","FIXED","Hyperlinks not shown on XML_PI_CONTENT","2012-11-09 12:56:32"
394046,"WTP Source Editing","wst.xml","nsand.dev","RESOLVED","FIXED","Formatter fails on feature.xml","2012-11-12 21:24:59"
394123,"WTP Source Editing","wst.sse","nsand.dev","RESOLVED","FIXED","XML_PI_CONTENT doesn't get hover callback","2012-11-13 11:07:56"
394221,"WTP Source Editing","wst.sse","nsand.dev","RESOLVED","FIXED","unnecessary testing of handlers state because activeWhen/enabledWhen/visibleWhen are duplicates","2012-11-27 13:44:55"
397475,"WTP Source Editing","wst.sse","nsand.dev","RESOLVED","FIXED","DirtyRegionProcessor.BackgroundThread unnecessarily creates a lot of DirtyRegion[] objects","2013-01-07 16:48:08"
397764,"WTP Source Editing","wst.xml","nsand.dev","RESOLVED","FIXED","Must mention schemas in about.html files","2013-01-09 13:18:29"
397904,"WTP Source Editing","wst.sse","nsand.dev","RESOLVED","FIXED","Memory leaks in Juno when opening and closing XML Editor","2013-01-16 18:06:40"
398134,"WTP Source Editing","wst.sse","nsand.dev","RESOLVED","FIXED","Memory leaks in Juno when opening and closing XML Editor","2013-01-28 13:12:48"
398345,"WTP Source Editing","wst.xml","nsand.dev","RESOLVED","FIXED","Numerous action handler conflicts when changing editors","2013-01-28 13:13:13"
398691,"WTP Source Editing","wst.sse","nsand.dev","RESOLVED","FIXED","ValidatorGroupListener can leak model references","2013-01-28 13:13:46"
399936,"WTP Source Editing","wst.xml","nsand.dev","RESOLVED","FIXED","Numerous action handler conflicts when changing editors","2013-04-26 15:37:51"
400297,"WTP Source Editing","jst.jsp","nsand.dev","RESOLVED","FIXED","[formatter] JSP formatter breaks tab policy in scriptlet","2013-02-13 10:18:06"
401264,"WTP Source Editing","wst.xml","nsand.dev","RESOLVED","FIXED","xml include preferences incorrect on mac os x","2013-02-20 10:54:54"
401384,"WTP Source Editing","wst.html","nsand.dev","RESOLVED","FIXED","An error occurred after installing Chinese language","2014-01-10 11:24:43"
401749,"WTP Source Editing","wst.xml","nsand.dev","RESOLVED","FIXED","Check only the content model for outline attributes","2013-03-19 11:16:11"
401833,"WTP Source Editing","wst.sse","nsand.dev","RESOLVED","FIXED","Outline creation fails when StructuredTextEditor is embedded in MultiPageEditorPart","2013-05-03 14:20:30"
401838,"WTP Source Editing","wst.sse","nsand.dev","RESOLVED","FIXED","Filter property tester bothers non-StructuredTextEditors","2013-02-26 16:36:32"
402541,"WTP Source Editing","wst.sse","nsand.dev","RESOLVED","FIXED","NullPointerException during ""JSP Index Manager: Processing Resource Events""","2013-10-14 11:47:33"
403943,"WTP Source Editing","jst.jsp","nsand.dev","RESOLVED","FIXED","CategorizedProblems problem in JSP file are disappearing when the annotations processor is turned on.","2013-11-11 14:23:22"
404093,"WTP Source Editing","wst.sse","nsand.dev","RESOLVED","FIXED","Incorrect name for connector xml catalog entries","2013-04-03 17:17:55"
404581,"WTP Source Editing","wst.sse","nsand.dev","RESOLVED","FIXED","Proposals are lost if a legacy processor throws an exception","2013-03-28 15:34:56"
404855,"WTP Source Editing","wst.sse","nsand.dev","RESOLVED","FIXED","Incorrect name for connector xml catalog entries","2013-06-24 11:29:43"
406571,"WTP Source Editing","wst.sse","nsand.dev","RESOLVED","FIXED","Add JPA 2.1 schemas to jst.standard.schemas","2013-04-30 11:13:30"
407513,"WTP Source Editing","jst.jsp","nsand.dev","RESOLVED","FIXED","Deadlock when running 'Taglib validation' job","2013-05-24 05:51:16"
407551,"WTP Source Editing","jst.jsp","nsand.dev","RESOLVED","FIXED","JSP translation incorrect for expressions in script blocks","2013-08-05 10:39:55"
407553,"WTP Source Editing","jst.jsp","nsand.dev","RESOLVED","FIXED","JSP translation incorrect for expressions in script blocks","2013-05-08 13:58:48"
407565,"WTP Source Editing","jst.jsp","nsand.dev","RESOLVED","FIXED","JSP translation incorrect for expressions in script blocks","2013-08-05 10:38:14"
408055,"WTP Source Editing","jst.jsp","nsand.dev","RESOLVED","FIXED","ResourceNotFoundException logged frequently when dragging items from the Palette","2013-06-24 11:28:40"
408058,"WTP Source Editing","jst.jsp","nsand.dev","RESOLVED","FIXED","ResourceNotFoundException logged frequently when dragging items from the Palette","2013-05-15 10:27:49"
408159,"WTP Source Editing","wst.sse","nsand.dev","RESOLVED","FIXED","Incorporate b89 draft of Java EE 7 schemas","2013-05-17 11:08:18"
409562,"WTP Source Editing","jst.jsp","nsand.dev","RESOLVED","FIXED","Incorrect error message being displayed when using Spring forms taglib","2013-08-29 14:21:53"
412350,"WTP Source Editing","wst.css","nsand.dev","RESOLVED","FIXED","editing css font-family result in exceptions","2013-09-27 09:05:49"
412459,"WTP Source Editing","wst.xml","nsand.dev","RESOLVED","FIXED","Typo in feature id for org.eclipse.wst.xml_ui.feature.patch","2013-07-24 11:18:59"
413927,"WTP Source Editing","wst.html","nsand.dev","RESOLVED","FIXED","Model changes during validation trigger errors","2013-07-31 10:28:29"
414162,"WTP Source Editing","wst.html","nsand.dev","RESOLVED","FIXED","Model changes during validation trigger errors","2013-08-15 13:25:54"
414601,"WTP Source Editing","jst.jsp","nsand.dev","RESOLVED","FIXED","CategorizedProblems problem in JSP file are disappearing when the annotations processor is turned on.","2013-11-11 14:25:32"
414713,"WTP Source Editing","wst.sse","nsand.dev","RESOLVED","FIXED","[CBI] webtools.sourceediting patches for building with Maven/Tycho","2013-09-11 17:25:12"
414714,"WTP Source Editing","wst.xpath","nsand.dev","RESOLVED","FIXED","[CBI] webtools.sourceediting.xpath patches for building with Maven/Tycho","2013-09-25 12:02:28"
414715,"WTP Source Editing","wst.xsl","nsand.dev","RESOLVED","FIXED","[CBI] webtools.sourceediting.xsl patches for building with Maven/Tycho","2013-09-25 12:02:06"
414812,"WTP Source Editing","wst.xml","nsand.dev","RESOLVED","FIXED","Accessibility: ""The document is empty. Right mouse click here to insert content"" message is not read","2013-08-13 18:02:47"
415980,"WTP Source Editing","wst.html","nsand.dev","RESOLVED","FIXED","HTML5 attribute validator marks ng-app AngularJS attributes as undefined","2014-01-29 15:39:33"
417570,"WTP Source Editing","wst.xml","nsand.dev","RESOLVED","FIXED","XML auto-complete/content-assist does not work in read-only files.","2013-11-15 11:32:13"
417665,"WTP Source Editing","wst.css","nsand.dev","RESOLVED","FIXED","Allow to pick other color from preview","2013-10-18 11:21:15"
419181,"WTP Source Editing","jst.jsp","nsand.dev","RESOLVED","FIXED","IllegalArgumentException after opening a JSP file.","2013-10-22 16:46:00"
419267,"WTP Source Editing","wst.sse","nsand.dev","RESOLVED","FIXED","Pom version updates webtools.sourceediting","2013-10-18 11:30:34"
419268,"WTP Source Editing","wst.xpath","nsand.dev","RESOLVED","FIXED","Pom version updates xpath","2013-10-18 11:59:23"
419270,"WTP Source Editing","wst.xsl","nsand.dev","RESOLVED","FIXED","Pom version updates xsl","2013-10-18 12:03:00"
420029,"WTP Source Editing","wst.sse","nsand.dev","RESOLVED","FIXED","Quick access lists Filters command with no active editor","2013-10-21 17:13:16"
420102,"WTP Source Editing","jst.jsp","nsand.dev","RESOLVED","FIXED","Parsing problems with nested generics in jsp:useBean","2013-10-22 13:42:54"
420114,"WTP Source Editing","wst.css","nsand.dev","RESOLVED","FIXED","Error-Message while creating css-file","2013-11-08 10:31:49"
420189,"WTP Source Editing","wst.sse","nsand.dev","RESOLVED","FIXED","Quick access lists Filters command with no active editor","2013-10-25 15:14:52"
420455,"WTP Source Editing","wst.html","nsand.dev","RESOLVED","FIXED","HTML attribute not recognized","2013-10-28 15:48:21"
422195,"WTP Source Editing","wst.xml","nsand.dev","RESOLVED","FIXED","Include all Java EE 7 XML Schema files","2014-02-05 15:33:11"
422757,"WTP Source Editing","wst.css","nsand.dev","RESOLVED","FIXED","Kepler: Web Page Editor NPE","2014-01-23 15:58:36"
423019,"WTP Source Editing","wst.sse","nsand.dev","RESOLVED","FIXED","Reopening Outline view fails when only one perspective is open.","2013-12-09 13:09:50"
423080,"WTP Source Editing","wst.sse","nsand.dev","RESOLVED","FIXED","Do not build patch bundles (sourceediting)","2014-01-22 14:49:10"
423182,"WTP Source Editing","wst.xml","nsand.dev","RESOLVED","FIXED","[hotbug request] ConcurrentModificationException in AnnotationUtiltity","2015-01-22 03:04:35"
