"Bug ID","Product","Component","Assignee","Status","Resolution","Summary","Changed"
141850,"WTP Common Tools","wst.common","jsholl","CLOSED","FIXED","[hotbug] java.lang.NoSuchMethodError: org.eclipse.wst.common.frameworks.datamodel.IDataModel.getDefaultOperation()","2006-06-26 16:04:42"
146146,"WTP Common Tools","wst.common","jsholl","CLOSED","FIXED","[modulecore] deadlock in ComponentImplRegirstryReader","2006-09-25 15:07:48"
151902,"WTP Common Tools","wst.common","jsholl","CLOSED","WONTFIX","[modulecore] Need ArtifactEdit support for binary project","2006-09-26 12:15:04"
158813,"WTP Common Tools","wst.common","jsholl","CLOSED","FIXED","[emfWorkbench] Z/OS save of TranslatorResource fails with SAXParseException","2007-02-07 13:06:33"
158879,"WTP Common Tools","wst.common","jsholl","CLOSED","FIXED","[commonArchive] DirectoryLoadStrategyImpl.makeRelative fails with Exception","2007-02-06 14:28:51"
147095,"WTP Common Tools","wst.validation","karasiuk","CLOSED","WORKSFORME","[validation] validation doesn't remove markers when validators are disabled and a revalidate occurs","2008-05-07 10:00:45"
154006,"WTP Common Tools","wst.validation","karasiuk","CLOSED","WORKSFORME","[validation] Validation framework does not display validator jobs in progress view","2008-05-07 10:07:33"
225231,"WTP Common Tools","wst.validation","karasiuk","CLOSED","FIXED","Framework should clear child marker types of its own","2008-11-17 07:55:04"
243377,"WTP Common Tools","wst.validation","karasiuk","CLOSED","FIXED","validationStarting/Finishing not called properly during clean/auto build","2008-09-18 13:45:15"
125745,"WTP Common Tools","wst.common","keith.chong.ca","CLOSED","FIXED","Adapt to the Elipse base provided Tabbed Property Pages","2008-05-15 09:15:49"
244343,"WTP Common Tools","wst.common","keith.chong.ca","CLOSED","FIXED","LINUX: Set Type Dialog is too narrow to show all contents","2008-12-17 18:47:05"
250815,"WTP Common Tools","wst.common","keith.chong.ca","CLOSED","FIXED","Allow for hiding the ""current resource"" search scope","2008-11-10 11:38:09"
116957,"WTP Common Tools","wst.common","konstantin","CLOSED","FIXED","Add facet install wizard page unavailable","2006-06-15 09:05:38"
117377,"WTP Common Tools","wst.common","konstantin","CLOSED","FIXED","Cannot change Java version in project facet UI","2017-10-11 15:55:02"
117488,"WTP Common Tools","wst.common","konstantin","CLOSED","FIXED","Can't create project after renaming runtime","2005-12-13 10:17:28"
117784,"WTP Common Tools","wst.common","konstantin","CLOSED","WONTFIX","Runtime facet cannot specify required facet","2006-09-25 03:04:24"
118825,"WTP Common Tools","wst.common","konstantin","CLOSED","DUPLICATE","NPE thrown on project delete in facet manager","2005-12-14 16:22:34"
119066,"WTP Common Tools","wst.common","konstantin","CLOSED","FIXED","Deadlock on FacetedProject.hasProjectFacet(final IProjectFacet f )","2005-12-14 16:28:16"
119195,"WTP Common Tools","wst.common","konstantin","CLOSED","DUPLICATE","Can't preselect facet when it's required runtime is chosen","2007-07-29 09:18:27"
119416,"WTP Common Tools","wst.common","konstantin","CLOSED","FIXED","Facet loading is slow on wizard startup","2017-10-11 15:55:53"
119589,"WTP Common Tools","wst.common","konstantin","CLOSED","FIXED","Observations on facets meta data project file.","2006-06-15 09:08:18"
120244,"WTP Common Tools","wst.common","konstantin","CLOSED","FIXED","Cannot install other facets from within an install delegate.","2006-09-26 10:09:52"
122667,"WTP Common Tools","wst.common","konstantin","CLOSED","FIXED","WTP project wizards should not change perspective or allow the perspective to be configurable","2006-06-15 09:20:58"
127119,"WTP Common Tools","wst.common","konstantin","CLOSED","FIXED","[hotbug] Facet actions sort does not termination for certain version change actions","2006-06-16 14:16:40"
130246,"WTP Common Tools","wst.common","konstantin","CLOSED","FIXED","Export ear extension silently swallows all attempts to report errors","2006-09-27 09:34:08"
103611,"WTP Common Tools","wst.internet","lmandel","CLOSED","FIXED","internet cache didn't work on Linux","2005-12-13 10:31:43"
103631,"WTP Common Tools","wst.internet","lmandel","CLOSED","DUPLICATE","Proxy Authentication failing with correct settings?","2006-09-25 03:04:47"
103819,"WTP Common Tools","wst.internet","lmandel","CLOSED","FIXED","User can appear ""locked"" in License Loop if they ""decline"".","2005-07-29 20:33:00"
103348,"WTP Common Tools","wst.common","mdelder","CLOSED","DUPLICATE","NullPointerException in TabbedPropertyRegistry","2006-09-26 10:10:19"
146924,"WTP Common Tools","wst.common","mdelder","CLOSED","FIXED","[modulecore] Terrible Performance of ComponentUtilities.getServerContextRoot()","2006-09-26 13:15:20"
147760,"WTP Common Tools","wst.common","mdelder","CLOSED","FIXED","[modulecore] Terrible Performance of VirtualResource.getProjectRelativePath()","2006-09-26 13:15:41"
91563,"WTP Common Tools","wst.validation","nagrawal","CLOSED","FIXED","Add job support to get background Validation","2006-09-26 12:51:48"
99777,"WTP Common Tools","wst.common","nagrawal","CLOSED","FIXED","IValidationSelectionHandler in wst.common.frameworks","2005-09-06 08:26:30"
110431,"WTP Common Tools","wst.validation","nagrawal","CLOSED","WORKSFORME","Cannot cancel Validation without forcibly killing Eclipse","2006-12-14 04:31:33"
119700,"WTP Common Tools","wst.validation","nagrawal","CLOSED","DUPLICATE","Validation extremely slow","2006-05-18 15:51:40"
125929,"WTP Common Tools","wst.validation","nagrawal","CLOSED","FIXED","[hotbug] Invalid reflection errors during EJB validation","2006-09-25 16:10:58"
134987,"WTP Common Tools","wst.validation","nagrawal","CLOSED","FIXED","[validation] EmptySchedulingRule should not be used","2006-09-26 14:38:42"
146063,"WTP Common Tools","wst.validation","nagrawal","CLOSED","FIXED","[hotbug][validation] Fix constructors for EnabledValidatorsOperation to remove asynch flag","2006-09-25 16:16:50"
153227,"WTP Common Tools","wst.common","nagrawal","CLOSED","INVALID","[validate edit] NPE at showing Inconsistent Files messagebox in Linux","2006-08-21 23:16:30"
153977,"WTP Common Tools","wst.validation","nagrawal","CLOSED","WONTFIX","[validation] ValidationRegistryReader causes early plugin starts","2006-08-28 15:37:17"
156569,"WTP Common Tools","wst.validation","nagrawal","CLOSED","FIXED","[hotbug] The validation framework ignore validators with no project nature but has enablement","2006-09-26 14:38:22"
157205,"WTP Common Tools","wst.validation","nagrawal","CLOSED","FIXED","[validation] NPE when validation is called with open editors","2007-05-03 12:21:54"
159274,"WTP Common Tools","wst.common","nagrawal","CLOSED","WORKSFORME","[j2ee] Eclipse WTP 1.5 hang on startup","2007-02-06 17:01:30"
160325,"WTP Common Tools","wst.validation","nagrawal","CLOSED","FIXED","[validation] Facet enablement not working properly","2006-10-20 09:17:28"
160539,"WTP Common Tools","wst.validation","nagrawal","CLOSED","INVALID","[validation] XML Validator Not Run on Save","2006-10-17 10:42:14"
161118,"WTP Common Tools","wst.validation","nagrawal","CLOSED","FIXED","[validation] Incremental  validation doesn't work","2006-10-20 22:00:55"
172527,"WTP Common Tools","wst.validation","nagrawal","CLOSED","FIXED","Validation preference page does not respect imported pref file.","2007-05-03 09:57:23"
151914,"WTP Common Tools","wst.command","pmoogk","CLOSED","FIXED","Ant client generation task fails on command line","2006-09-07 14:17:46"
115327,"WTP Common Tools","wst.common","tbashor","CLOSED","DUPLICATE","Facet/runtime changes don't cascade to child projects","2006-05-18 15:51:02"
80231,"WTP Common Tools","Snippets Framework","thatnitind","CLOSED","FIXED","Drop of snippet uses wrong (extra?) EOL","2008-12-09 00:58:19"
98463,"WTP Common Tools","Snippets Framework","thatnitind","CLOSED","FIXED","[arch] Snippets view in common has dependancy on SSE","2008-12-08 23:10:22"
99754,"WTP Common Tools","wst.common","thatnitind","CLOSED","FIXED","Need URIResolverExtension for Flexible Projects","2005-07-02 23:57:23"
101729,"WTP Common Tools","Snippets Framework","thatnitind","CLOSED","FIXED","undo/redo menu items are misleading in outline, properties, snippets views","2008-12-09 00:57:44"
112044,"WTP Common Tools","Snippets Framework","thatnitind","CLOSED","FIXED","[arch] Should snippet classe provide variables for classes?","2008-12-09 01:26:07"
126224,"WTP Common Tools","wst.common","thatnitind","CLOSED","FIXED","[performance] Component resolver takes significant time to run","2007-04-03 11:34:49"
135245,"WTP Common Tools","Snippets Framework","thatnitind","CLOSED","FIXED","snippets containing ""]]&gt;"" not saved and loaded properly","2008-12-09 01:24:49"
102315,"WTP Common Tools","wst.common","valentinbaciu","CLOSED","WORKSFORME","URI Exception in tests logs","2007-11-20 09:35:27"
180560,"WTP Common Tools","wst.common","valentinbaciu","CLOSED","FIXED","Common Core plugin does not specify component.xml file","2010-03-25 14:35:49"
95765,"WTP Common Tools","wst.validation","vbhadrir","CLOSED","FIXED","[internal API] Clean up 1 API violations in org.eclipse.wst.validation","2006-01-24 11:42:41"
101733,"WTP Common Tools","wst.common","vbhadrir","CLOSED","FIXED","IllegalArgumentException: Path must include project and resource name: /foo","2005-12-13 13:05:31"
104016,"WTP Common Tools","wst.validation","vbhadrir","CLOSED","FIXED","Validation Framework should ignore validation of files in .deployables folder","2005-07-28 11:35:25"
104610,"WTP Common Tools","wst.common","vbhadrir","CLOSED","FIXED","Cache component type Id in VirtualComponent to improve performance","2005-07-28 11:35:51"
139516,"WTP Common Tools","wst.validation","vbhadrir","CLOSED","FIXED","[validation] Exception logged when project closed","2006-09-28 14:03:58"
144262,"WTP Common Tools","wst.validation","vbhadrir","CLOSED","FIXED","[validation] ext. p org.eclipse.wst.validation.validator does not work - WTP 1.5","2006-09-26 10:11:40"
90900,"WTP Common Tools","wst.common","agarwasa","CLOSED","WORKSFORME","Can't build flexible projects in wtp I-I20050408-200504082033 : NullPointerException","2005-07-26 14:03:14"
91898,"WTP Common Tools","wst.common","agarwasa","CLOSED","INVALID","Navigator Project/Worrking group toggle button","2005-06-15 01:32:50"
91907,"WTP Common Tools","wst.common","agarwasa","CLOSED","FIXED","Project Explore Close Project Filter","2005-06-15 01:32:56"
91911,"WTP Common Tools","wst.common","agarwasa","CLOSED","WONTFIX","Project Explorer Linking & Filters","2005-06-15 01:33:15"
91913,"WTP Common Tools","wst.common","agarwasa","CLOSED","FIXED","Project Explorer Non Java Filter","2005-06-15 01:32:20"
91915,"WTP Common Tools","wst.common","agarwasa","CLOSED","FIXED","Project Explorer Shared Resource Filter","2005-06-15 01:31:59"
91918,"WTP Common Tools","wst.common","agarwasa","CLOSED","FIXED","Project Explorer Filters","2005-06-15 01:33:09"
91919,"WTP Common Tools","wst.common","agarwasa","CLOSED","FIXED","Project Explorer filters Workign Sets","2005-06-15 01:31:59"
91928,"WTP Common Tools","wst.common","agarwasa","CLOSED","INVALID","Project Explorer configure working Sets","2005-06-15 01:32:21"
91942,"WTP Common Tools","wst.common","agarwasa","CLOSED","WORKSFORME","Run on Server for Servlet should determing correct Servlet mapping","2005-07-14 22:45:52"
91978,"WTP Common Tools","wst.common","agarwasa","CLOSED","FIXED","Servlet mapping section  not  created in  Web DD","2005-07-26 14:03:13"
92268,"WTP Common Tools","wst.common","agarwasa","CLOSED","FIXED","NoSuchMethod running on latest Eclipse SDK I-build","2005-07-26 14:11:13"
96703,"WTP Common Tools","wst.common","agarwasa","CLOSED","FIXED","Widget is disposed errors on tree node expansion","2005-07-26 14:11:15"
108369,"WTP Common Tools","wst.common","ahunter.eclipse","CLOSED","FIXED","Common UI Properties needs an object count applicability functionality for property sections","2006-06-26 16:35:23"
108375,"WTP Common Tools","wst.common","ahunter.eclipse","CLOSED","FIXED","Common UI Properties enhancement for Project Explorer","2005-09-09 15:10:54"
119519,"WTP Common Tools","wst.common","ahunter.eclipse","CLOSED","FIXED","Tabbed Properties View: Long Tab Names Not Displayed Correctly","2006-01-26 15:05:45"
131856,"WTP Common Tools","wst.common","ahunter.eclipse","CLOSED","FIXED","Remove wst common ui properties - mark deprecated","2006-06-26 16:34:45"
180500,"WTP Common Tools","wst.internet","arvera","CLOSED","WONTFIX","TCP/IP Monitor not able to capture/relay HTTPS/SSL messages on Linux","2008-01-08 11:38:28"
80488,"WTP Common Tools","wst.internet","cbrealey","CLOSED","FIXED","Fix various compilation warnings in org.eclipse.wst.internet.proxy","2006-03-08 09:33:32"
83832,"WTP Common Tools","wst.command","cbrealey","CLOSED","FIXED","Clean up compilation warnings in wst.command plugins","2005-06-08 14:52:49"
85791,"WTP Common Tools","wst.internet","cbrealey","CLOSED","FIXED","Clean up compilation warnings in org.eclipse.wst.internet plugins","2005-11-12 00:30:38"
89906,"WTP Common Tools","wst.common","cbrealey","CLOSED","FIXED","Add dependencychecker plugin to component.xml","2005-03-31 20:38:27"
91483,"WTP Common Tools","wst.command","cbrealey","CLOSED","FIXED","Refactor package names in org.eclipse.wst.command.env.core","2005-04-17 09:25:03"
91484,"WTP Common Tools","wst.command","cbrealey","CLOSED","FIXED","Refactor package names in org.eclipse.wst.command.env","2005-04-17 00:27:56"
91485,"WTP Common Tools","wst.command","cbrealey","CLOSED","FIXED","Refactor package names in org.eclipse.wst.command.env.ui","2005-04-16 21:35:21"
95753,"WTP Common Tools","wst.command","cbrealey","CLOSED","FIXED","env.common.FileResourceOutputStream is using Eclipse internal API","2005-06-21 09:07:51"
97248,"WTP Common Tools","wst.command","cbrealey","CLOSED","FIXED","[internal API] Clean up 1 API violations in org.eclipse.wst.command","2005-06-21 09:01:53"
99549,"WTP Common Tools","wst.command","cbrealey","CLOSED","FIXED","org.eclipse.wst.command.env.ui has non-source java files?","2005-06-15 23:08:26"
100087,"WTP Common Tools","wst.common","cbrealey","CLOSED","FIXED","can we remove o.e.wst.common.dependencychecker?","2005-06-15 23:08:28"
100167,"WTP Common Tools","wst.internet","cbrealey","CLOSED","FIXED","Duplicate source for org.eclipse.wst.internet.proxy in SDK","2005-06-29 18:27:38"
100170,"WTP Common Tools","wst.command","cbrealey","CLOSED","FIXED","Duplicate source for org.eclipse.wst.command.* in SDK","2005-06-29 18:27:38"
113752,"WTP Common Tools","wst.internet","cbrealey","CLOSED","FIXED","Incorrect copyright statements in o.e.wst.internet.*","2006-01-24 14:05:08"
116077,"WTP Common Tools","wst.command","cbrealey","CLOSED","FIXED","anttasks.jar should be automatically built","2005-11-14 11:36:12"
178800,"WTP Common Tools","wst.internet","cbrealey","CLOSED","DUPLICATE","Time to remove our proxy settings?","2007-04-03 11:52:08"
86833,"WTP Common Tools","wst.common","cbridgha","CLOSED","WONTFIX","[emfworkbench] Optimize use of IsLoadingAdapter - in ExtendedEcoreUtil","2007-02-09 10:13:10"
88010,"WTP Common Tools","wst.common","cbridgha","CLOSED","WONTFIX","[arch] should EditModel be WTP API?","2007-01-17 21:09:22"
88664,"WTP Common Tools","wst.common","cbridgha","CLOSED","FIXED","org.eclipse.wst.common.frameworks has misspelled packages","2005-07-02 23:48:57"
94613,"WTP Common Tools","wst.common","cbridgha","CLOSED","WONTFIX","[function groups] integrate facets with function groups","2007-02-09 10:14:20"
94890,"WTP Common Tools","wst.common","cbridgha","CLOSED","WONTFIX","[arch] Request for API Review for M5: common.componentcore","2007-01-17 21:09:21"
95325,"WTP Common Tools","wst.common","cbridgha","CLOSED","FIXED","Performance: MigrationUI early startup is taking roughly 50% of the total plugin startup time","2005-07-26 14:01:07"
97250,"WTP Common Tools","wst.common","cbridgha","CLOSED","FIXED","[internal API] Clean up 8 API violations in org.eclipse.wst.common.componentcore","2006-05-03 11:07:01"
97251,"WTP Common Tools","wst.common","cbridgha","CLOSED","FIXED","[internal API] Clean up 13 API violations in org.eclipse.wst.common.emf","2006-05-03 11:07:24"
97252,"WTP Common Tools","wst.common","cbridgha","CLOSED","FIXED","[internal API] Clean up 10 API violations in org.eclipse.wst.common.frameworks","2006-05-03 11:07:45"
97254,"WTP Common Tools","wst.common","cbridgha","CLOSED","INVALID","[internal API] Clean up 5 API violations in org.eclipse.wst.common.migration","2006-05-03 11:07:58"
99755,"WTP Common Tools","wst.common","cbridgha","CLOSED","DUPLICATE","[arch] org.eclipse.wst.common.frameworks should not depend on JEM","2005-07-26 14:01:05"
103385,"WTP Common Tools","wst.common","cbridgha","CLOSED","FIXED","calling setVersionID() on WebAppResource to J2EEVersionConstants.J2EE_1_4_ID causes NullPointerException","2006-09-25 02:43:07"
103807,"WTP Common Tools","wst.common","cbridgha","CLOSED","FIXED","Build failed during JUnit tests","2005-07-26 14:11:13"
106781,"WTP Common Tools","wst.common","cbridgha","CLOSED","DUPLICATE","Request for component type id based component creation operation","2006-06-15 13:25:07"
106785,"WTP Common Tools","wst.common","cbridgha","CLOSED","INVALID","Request for labels to be associated with component type ids","2006-06-15 13:25:07"
107209,"WTP Common Tools","wst.common","cbridgha","CLOSED","WONTFIX","Failing JUnit testcases in the 0.7 maintenance stream","2006-01-10 10:01:06"
107657,"WTP Common Tools","wst.common","cbridgha","CLOSED","WONTFIX","Organize and drop Project Interchange feature","2006-01-25 11:03:20"
107848,"WTP Common Tools","wst.common","cbridgha","CLOSED","FIXED","Incorrect copyrights in wst.frameworks.ui","2006-01-24 11:57:31"
108638,"WTP Common Tools","wst.common","cbridgha","CLOSED","FIXED","org.eclipse.wst.common.frameworks.internal.SaveFailedException during component creation","2006-09-22 21:07:36"
108681,"WTP Common Tools","wst.common","cbridgha","CLOSED","FIXED","Stabilize API for flexible project support","2005-11-23 09:50:47"
111515,"WTP Common Tools","wst.common","cbridgha","CLOSED","INVALID","component returned by ComponentUtilites.findComponent(IResource) has null componentTypeID","2006-06-15 13:25:06"
111734,"WTP Common Tools","wst.common","cbridgha","CLOSED","DUPLICATE","NPE during build","2006-09-26 10:09:43"
111982,"WTP Common Tools","wst.common","cbridgha","CLOSED","FIXED","org.eclipse.wst.common.emfworkbench.integration drags in UI","2006-09-22 21:07:33"
112763,"WTP Common Tools","wst.common","cbridgha","CLOSED","FIXED","emfworkbench.integration can not fit in architecture","2006-06-15 13:25:04"
113123,"WTP Common Tools","wst.common","cbridgha","CLOSED","FIXED","[single jar] Single jar the o.e.wst.common.* plugins to improve performance","2006-01-24 09:54:44"
113125,"WTP Common Tools","wst.validation","cbridgha","CLOSED","FIXED","[single jar] Single jar the o.e.wst.validation plugin to improve performance","2006-01-24 09:56:04"
113251,"WTP Common Tools","wst.common","cbridgha","CLOSED","WONTFIX","NullPointerException in BasicNotifierImpl","2007-07-30 11:19:08"
113289,"WTP Common Tools","wst.common","cbridgha","CLOSED","FIXED","Compilation errors when building WTP 1.0 code on Eclipse 3.2 I-builds","2006-01-24 09:40:13"
114594,"WTP Common Tools","wst.common","cbridgha","CLOSED","FIXED","Deadlock from ModuleStructuralModel when Initializing Java Tooling","2005-12-13 18:46:00"
114795,"WTP Common Tools","wst.common","cbridgha","CLOSED","DUPLICATE","I20051028 workspace locked during validator during clean+build","2006-09-26 14:50:36"
115094,"WTP Common Tools","wst.common","cbridgha","CLOSED","FIXED","Changing facet version doesn't change spec level","2005-12-28 10:29:36"
115344,"WTP Common Tools","wst.common","cbridgha","CLOSED","FIXED","Export Ant file","2006-09-26 10:09:36"
115900,"WTP Common Tools","wst.common","cbridgha","CLOSED","DUPLICATE","NPE due to project rename received by FlexibleProjectContainer","2006-09-25 03:04:35"
116604,"WTP Common Tools","wst.common","cbridgha","CLOSED","WONTFIX","ComponentCore#createResources throws ArrayStoreException","2007-07-30 11:19:08"
117203,"WTP Common Tools","wst.common","cbridgha","CLOSED","FIXED","minor fix now for compatibility with 3.2 EMF","2006-06-15 13:25:07"
117372,"WTP Common Tools","wst.common","cbridgha","CLOSED","FIXED","Should not set project specific compiler level to JDK 5.0 when targetting Tomcat 5.5","2005-11-23 16:29:30"
117897,"WTP Common Tools","wst.common","cbridgha","CLOSED","WONTFIX","Workspace upgraded to M9, project type incorrectly detection due to .runtime existance","2007-07-30 11:19:09"
118127,"WTP Common Tools","wst.common","cbridgha","CLOSED","WORKSFORME","[migration] ""Build path contains duplicate entry"" although there is no duplication","2006-09-26 10:09:44"
118278,"WTP Common Tools","wst.common","cbridgha","CLOSED","FIXED","org.eclipse.wst.common.modulecore.artifactedit extension point does not have description schema","2006-06-22 19:05:18"
118449,"WTP Common Tools","wst.common","cbridgha","CLOSED","WONTFIX","WTP - internal API","2007-07-19 10:48:27"
118522,"WTP Common Tools","wst.common","cbridgha","CLOSED","DUPLICATE","NPE in ModelStructuralModel.resNeedsMigrating():128","2005-12-14 12:43:28"
118863,"WTP Common Tools","wst.common","cbridgha","CLOSED","FIXED","Migration defaults Java 5 projects to Java 1.4","2006-09-22 21:07:47"
119446,"WTP Common Tools","wst.common","cbridgha","CLOSED","WONTFIX","[annotations] hard coded classpath in hidden .JETEmitters project","2010-02-16 17:13:16"
120164,"WTP Common Tools","wst.common","cbridgha","CLOSED","WONTFIX","[frameworks] org.eclipse.wst.common.frameworks.ui.wtpuiAction ext point examples required update","2010-02-16 17:12:10"
121289,"WTP Common Tools","wst.common","cbridgha","CLOSED","WONTFIX","[emfworkbench] IllegalStateException thrown during republish of a close project","2010-02-16 17:10:49"
121918,"WTP Common Tools","wst.common","cbridgha","CLOSED","WONTFIX","[modulecore] Incorrect VirtualResource#equals implementation","2010-02-16 17:06:06"
122020,"WTP Common Tools","wst.common","cbridgha","CLOSED","WONTFIX","[modulecore] Provide visitor interface for virtual resources","2010-02-16 17:02:49"
122531,"WTP Common Tools","wst.common","cbridgha","CLOSED","WONTFIX","[modulecore] Reconcile .component with .classpath","2010-02-16 17:01:31"
124291,"WTP Common Tools","wst.common","cbridgha","CLOSED","FIXED","[emfworkbench] Take advantage of ""isLoading()"" api in EMF Resource","2006-06-15 12:47:24"
133359,"WTP Common Tools","wst.common","cbridgha","CLOSED","DUPLICATE","[modulecore] Add UI for .component file","2010-03-19 11:08:19"
134480,"WTP Common Tools","wst.common","cbridgha","CLOSED","WONTFIX","[modulecore] Eclipse hangs when saving file","2007-07-30 11:19:08"
136427,"WTP Common Tools","wst.common","cbridgha","CLOSED","FIXED","NPE at at org.eclipse.emf.common.notify.impl.BasicNotifierImpl.eNotify(BasicNotifierImpl.java:229)","2006-09-26 10:09:39"
136490,"WTP Common Tools","wst.common","cbridgha","CLOSED","FIXED","EMF Utility not setting proxy before unload","2006-08-28 15:56:34"
136732,"WTP Common Tools","wst.common","cbridgha","CLOSED","FIXED","Deadlock during autobuild","2006-09-22 21:03:15"
137002,"WTP Common Tools","wst.common","cbridgha","CLOSED","FIXED","UITester method invalid during startup","2006-06-15 12:47:24"
138932,"WTP Common Tools","wst.common","cbridgha","CLOSED","DUPLICATE","[emfworkbench] SaveFailedException while extracting J2EE projects from SCM","2006-09-26 12:59:29"
139200,"WTP Common Tools","wst.common","cbridgha","CLOSED","FIXED","[modulecore] ModuleStructuralModel.getPrimaryRootObject() returning null causing invalid VirtualComponent.exists()","2006-09-26 14:50:44"
145906,"WTP Common Tools","wst.common","cbridgha","CLOSED","FIXED","[api request] Need api constant containing module core nature","2010-02-17 15:26:30"
150673,"WTP Common Tools","wst.common","cbridgha","CLOSED","WONTFIX","[modulecore] Add visitor API to virtual component layer","2010-02-16 18:15:32"
152378,"WTP Common Tools","wst.common","cbridgha","CLOSED","WONTFIX","[emfWorkbench] Creating exception in ClientAccessRegistry may be slowing things down","2010-02-18 14:06:51"
152659,"WTP Common Tools","wst.validation","cbridgha","CLOSED","FIXED","[validation] Validation error in log error about Some......Validator in the log","2007-04-03 11:25:18"
154188,"WTP Common Tools","wst.common","cbridgha","CLOSED","DUPLICATE","[modulecore] JavaArtifactEditModel leaks every time you open and close web.xml editor","2006-09-26 14:50:43"
160471,"WTP Common Tools","wst.common","cbridgha","CLOSED","WONTFIX","[emfWorkbench] Redesign translator extension mechanism so it works in non-OSGI","2008-01-03 14:18:36"
168538,"WTP Common Tools","wst.common","cbridgha","CLOSED","DUPLICATE","""Convert to a Dynamic Web Project"" should work for Java projects","2010-01-19 13:35:56"
197476,"WTP Common Tools","wst.common","cbridgha","CLOSED","WORKSFORME","NPE in Pkg Explorer","2010-02-12 14:26:42"
205425,"WTP Common Tools","wst.common","cbridgha","CLOSED","WONTFIX","An Error 'This Project needs to migrate WTP metadata' is reported on projects without WTP metadata","2010-02-15 10:56:06"
207876,"WTP Common Tools","wst.common","cbridgha","CLOSED","FIXED","ResourceSetWorkbenchEditSynchronizer does not unload resources that are not instances of ReferencedResoure","2008-05-01 13:52:27"
209093,"WTP Common Tools","wst.common","cbridgha","CLOSED","WONTFIX","ArtifactEditModel shouldn't be altering platform resource URI's in getResource(URI)","2011-04-28 14:56:30"
209626,"WTP Common Tools","wst.common","cbridgha","CLOSED","FIXED","Cannot create project added to an EAR","2008-05-29 12:54:31"
212646,"WTP Common Tools","wst.common","cbridgha","CLOSED","WORKSFORME","NPE in VirtualComponet","2010-02-15 10:58:16"
