"Bug ID","Product","Component","Assignee","Status","Resolution","Summary","Changed"
445858,"WTP Common Tools","wst.common","error-reports-inbox","UNCONFIRMED"," ---","Function group org.eclipse.jst.j2ee contains no pattern bindings (err_grp: ab0cc3de)","2014-11-13 09:11:18"
445589,"WTP Common Tools","wst.common","marcel.bruch","UNCONFIRMED"," ---","Failed while invoking preset factory ""org.eclipse.wst.common.project.facet.co... (err_grp: e334585c)","2014-10-03 06:02:50"
289667,"WTP Common Tools","wst.common","ccc","NEW"," ---","Need to create new common jst ui feature","2010-03-16 15:35:24"
216924,"WTP Common Tools","wst.common","dimitar.giormov","NEW"," ---","Data models of contributed wizard pages are not loaded if the wizard is finished on the first page","2011-05-20 09:19:24"
115892,"WTP Common Tools","Faceted Project Framework","fproj-inbox","NEW"," ---","[UI] Need Auto-selection of facet dependencies","2012-01-03 14:32:18"
207974,"WTP Common Tools","wst.common","jmmunoz","NEW"," ---","AppConfigValidator doesn't release preexisting models","2012-05-01 15:17:32"
335251,"WTP Common Tools","wst.common","shr31223","NEW"," ---","InterruptedException being logged by WorkbenchResourceHelper","2012-05-01 15:59:20"
301969,"WTP Common Tools","wst.common","stryker","NEW"," ---","Module Assembly page entries not editable with keyboard","2013-03-21 11:15:48"
147788,"WTP Common Tools","Snippets Framework","wst.common-inbox","NEW"," ---","[snippets] Parameterized snippets does not insert in SUSE Linux","2013-07-18 14:26:33"
149772,"WTP Common Tools","Snippets Framework","wst.common-inbox","NEW"," ---","[snippets] Parameterized snippets does not insert in Redhat Linux","2013-07-18 14:26:35"
243104,"WTP Common Tools","wst.validation","wst.validation-inbox","NEW"," ---","Need a way to add additional dependencies to existing validators","2009-04-30 11:47:34"
288953,"WTP Common Tools","wst.validation","wst.validation-inbox","NEW"," ---","Deprecate the old validation framework","2010-03-26 19:29:27"
100340,"WTP Common Tools","wst.common","cbridgha","NEW"," ---","[arch] common.ui should be combined with frameworks.ui","2010-03-26 20:33:33"
105111,"WTP Common Tools","wst.common","cbridgha","NEW"," ---","[emfworkbench] ClassCastException in URIConverterImpl","2010-03-26 20:32:12"
106869,"WTP Common Tools","wst.common","cbridgha","NEW"," ---","[project explorer] Add missing module depencies to project explorer like JDT classpath","2006-11-03 14:19:07"
118230,"WTP Common Tools","wst.common","cbridgha","NEW"," ---","[modulecore] Internal class usage suggested by deprecation comment","2010-03-26 20:32:35"
152002,"WTP Common Tools","wst.common","cbridgha","NEW"," ---","[emfWorkbench] org.eclipse.wst.common.internal.emfworkbench.edit.ClientAccessRegistryException: IWAE0011E Key already used to access Resource :","2011-05-20 09:15:11"
152369,"WTP Common Tools","wst.common","cbridgha","NEW"," ---","[modulecore] ModuleCoreNature swallowing exceptions","2006-11-02 11:45:28"
153565,"WTP Common Tools","wst.common","cbridgha","NEW"," ---","[modulecore] NullPointerException being thrown and caught in ComponentImplRegistryReader.createComponent() during normal execution.","2006-11-02 11:45:36"
157041,"WTP Common Tools","wst.common","cbridgha","NEW"," ---","[emfWorkbench] Request interface for Translator","2007-11-29 14:07:56"
157051,"WTP Common Tools","wst.common","cbridgha","NEW"," ---","[modulecore] Client Access Exception of type INVALID_ACCESS_KEY","2006-11-02 11:45:05"
157800,"WTP Common Tools","wst.common","cbridgha","NEW"," ---","[modulecore] NPE in VirtualResource","2009-12-10 23:00:36"
159436,"WTP Common Tools","wst.common","cbridgha","NEW"," ---","[modulecore] ComponentResolver fails to resolve 'platform:' or 'file:' URIs","2006-11-02 11:45:06"
160092,"WTP Common Tools","wst.common","cbridgha","NEW"," ---","[emfWorkbench] EnablementManager/EnablementIdentifier have  weakhashmaps with values strongly ? referring to the keys","2006-10-26 04:51:12"
161634,"WTP Common Tools","wst.common","cbridgha","NEW"," ---","[Internal API] [emfWorkbench] Is that possible to externalize RendererFactory class","2006-10-20 09:13:51"
161721,"WTP Common Tools","wst.common","cbridgha","NEW"," ---","[Internal API] [modulecore] Externalize ComponentUtilities","2006-10-20 11:20:28"
162472,"WTP Common Tools","wst.common","cbridgha","NEW"," ---","[modulecore] Write reference count error on startup","2006-10-26 16:05:33"
163221,"WTP Common Tools","wst.common","cbridgha","NEW"," ---","[modulecore] Support exclusion/inclusion filtering for virtual component wb-resource mappings","2012-05-01 15:10:36"
200983,"WTP Common Tools","wst.common","cbridgha","NEW"," ---","NPE at IDTranslator.setMOFValue","2008-04-04 15:16:11"
201482,"WTP Common Tools","wst.common","cbridgha","NEW"," ---","org.eclipse.wst.common.internal.emf.utilities.AssertionFailedException","2008-04-01 10:56:39"
202943,"WTP Common Tools","wst.common","cbridgha","NEW"," ---","(module core) Request utility to determine deploy path for an IFile","2008-04-01 10:57:55"
210043,"WTP Common Tools","wst.common","cbridgha","NEW"," ---","Exception occurs after discarding changes in a JPA XML file and re-editing","2008-04-01 10:59:04"
212402,"WTP Common Tools","wst.common","cbridgha","NEW"," ---","NPE during Initializing Java Tooling","2008-04-01 11:00:05"
212951,"WTP Common Tools","wst.common","cbridgha","NEW"," ---","Possible deadlock in ResourceSetWorkbenchEditSynchronizer","2009-02-12 11:04:46"
220804,"WTP Common Tools","wst.common","cbridgha","NEW"," ---","ProjectUtilities can't handle EResource not in ResourceSet","2008-02-28 13:54:50"
236949,"WTP Common Tools","wst.common","cbridgha","NEW"," ---","org.eclipse.wst.common.component modified on project open","2008-07-24 09:26:48"
242730,"WTP Common Tools","wst.common","cbridgha","NEW"," ---","Calling IJavaProject.setRawClasspath from within a JUnit can lead to deadlock","2008-09-05 12:00:06"
260111,"WTP Common Tools","wst.common","cbridgha","NEW"," ---","NPE in J2EEElementChangedListener","2009-01-06 18:36:50"
268140,"WTP Common Tools","wst.common","cbridgha","NEW"," ---","ext point org.eclipse.wst.common.modulecore.componentimpl","2009-10-07 09:13:54"
282487,"WTP Common Tools","wst.common","cbridgha","NEW"," ---","some methods in ModuleCore's ArtifactEdit belong in EnterpriseArtifactEdit","2010-05-28 11:57:21"
328562,"WTP Common Tools","wst.common","cbridgha","NEW"," ---","WTPResourceFactoryRegistryKey used as a key in a HashMap but does not implement hashCode/equals","2010-10-25 13:30:29"
160567,"WTP Common Tools","wst.common","ccc","NEW"," ---","[emfWorkbench] Translator framework does not support namespace prefixes","2009-07-14 09:26:52"
160569,"WTP Common Tools","wst.common","ccc","NEW"," ---","[emfWorkbench] Translator framework does not support dependency objects with dom attributes","2010-05-27 10:32:44"
171768,"WTP Common Tools","wst.common","ccc","NEW"," ---","An Internal error occured during: ""Initializing Java Tooling""","2008-11-12 12:37:17"
176393,"WTP Common Tools","wst.common","ccc","NEW"," ---","[emfWorkbench] Translator framework does not support dependency objects in collections","2008-11-12 12:38:08"
176852,"WTP Common Tools","wst.common","ccc","NEW"," ---","Translator frameworkd does not support mixed content","2008-11-12 12:38:45"
179568,"WTP Common Tools","wst.common","ccc","NEW"," ---","Translator framework does not reload model when changing the root node of XML file","2008-11-12 12:39:20"
200681,"WTP Common Tools","wst.common","ccc","NEW"," ---","An NPE occurred during: ""Initializing Java Tooling"".","2008-11-12 12:47:56"
240419,"WTP Common Tools","wst.common","ccc","NEW"," ---","ProjectResourceSetImpl does not use content type in createResource(URI, String)","2010-05-27 11:44:16"
351599,"WTP Common Tools","wst.common","ccc","NEW"," ---","ConcurrentModificationException on faceted project creation","2011-07-08 13:06:37"
371693,"WTP Common Tools","wst.common","ccc","NEW"," ---","Features in WTP Common Tools should require other features instead of include","2012-03-23 11:26:47"
373666,"WTP Common Tools","Faceted Project Framework","ccc","NEW"," ---","Adopter-only patch for allowing Static web project facets to coexist with Java facet","2012-03-08 18:09:10"
379727,"WTP Common Tools","wst.common","chavezjc","NEW"," ---","Image leak in SelectSingleFileView","2014-05-22 13:50:54"
439362,"WTP Common Tools","Faceted Project Framework","chavezjc","NEW"," ---","Installed faceted same project name version problem","2014-07-24 12:44:30"
216081,"WTP Common Tools","wst.common","david_williams","NEW"," ---","remove cacheresource from wst.internet.cache","2008-01-22 03:00:56"
97255,"WTP Common Tools","wst.internet","deboer","NEW"," ---","[internal API] Use internal non-API to do BrowserManager ... to do SwitchBrowserWorkbenchAction","2009-09-23 17:33:13"
250027,"WTP Common Tools","wst.internet","deboer","NEW"," ---","Add support for parsing JSON to monitor","2008-10-07 17:41:51"
206777,"WTP Common Tools","wst.common","diegosr","NEW"," ---","DataModelPausibleOperationImpl doesn't allow null SchedulingRule from AbstractDataModelOperation","2012-05-01 15:16:41"
312469,"WTP Common Tools","wst.common","diegosr","NEW"," ---","ResourceTreeRoot isn't thread safe","2012-05-01 15:45:50"
133833,"WTP Common Tools","wst.command","ericdp","NEW"," ---","[Internal APIs] command environment","2007-09-27 13:50:48"
135950,"WTP Common Tools","Faceted Project Framework","fproj-inbox","NEW"," ---","Support dynamic help for individual facets.","2012-01-03 14:32:20"
136008,"WTP Common Tools","Faceted Project Framework","fproj-inbox","NEW"," ---","[UI] Facets selection panel should filter out unselectable facet versions.","2012-01-03 14:32:19"
154718,"WTP Common Tools","Faceted Project Framework","fproj-inbox","NEW"," ---","Allow dynamic page sets to be associated with facet actions","2012-01-03 14:32:16"
158083,"WTP Common Tools","Faceted Project Framework","fproj-inbox","NEW"," ---","Remove unnecessary throws clauses from various FPF methods","2012-01-03 14:32:21"
160245,"WTP Common Tools","Faceted Project Framework","fproj-inbox","NEW"," ---","Make Faceted Project Framework available outside of WTP","2012-01-03 14:32:14"
163379,"WTP Common Tools","Faceted Project Framework","fproj-inbox","NEW"," ---","Creating projects should not create project level compiler settings","2012-01-03 14:32:17"
163401,"WTP Common Tools","Faceted Project Framework","fproj-inbox","NEW"," ---","Facet repair action needed","2012-01-03 14:32:17"
165994,"WTP Common Tools","Faceted Project Framework","fproj-inbox","NEW"," ---","Improve the story around the no runtime case","2012-01-03 14:32:20"
169846,"WTP Common Tools","Faceted Project Framework","fproj-inbox","NEW"," ---","Facet bridge called 1034 times when opening dialog","2013-12-16 02:28:50"
186171,"WTP Common Tools","Faceted Project Framework","fproj-inbox","NEW"," ---","[UI] Add filter field to the facets selection panel","2012-01-03 14:32:16"
191715,"WTP Common Tools","Faceted Project Framework","fproj-inbox","NEW"," ---","[UI] Editor for facet configurations","2012-01-03 14:32:17"
191716,"WTP Common Tools","Faceted Project Framework","fproj-inbox","NEW"," ---","[UI] No context sensitive infopop help for facets page","2012-01-03 14:32:15"
198165,"WTP Common Tools","Faceted Project Framework","fproj-inbox","NEW"," ---","Need PROJECT_INITIALIZED event","2012-01-03 14:32:17"
200962,"WTP Common Tools","Faceted Project Framework","fproj-inbox","NEW"," ---","Allow filtering by facets on org.eclipse.wst.common.project.facet.core.listeners  ext-pt","2014-10-15 19:48:46"
210541,"WTP Common Tools","Faceted Project Framework","fproj-inbox","NEW"," ---","Need an action to make an existing project faceted","2012-01-03 14:32:15"
221202,"WTP Common Tools","Faceted Project Framework","fproj-inbox","NEW"," ---","Enable capabilities when facets are installed","2012-01-03 14:32:16"
234892,"WTP Common Tools","Faceted Project Framework","fproj-inbox","NEW"," ---","[ui] Consider removing filtering of runtimes in facets selection panel","2012-01-03 14:32:21"
255038,"WTP Common Tools","Faceted Project Framework","fproj-inbox","NEW"," ---","Add the ability to deprecate a facet","2012-01-03 14:32:19"
259757,"WTP Common Tools","Faceted Project Framework","fproj-inbox","NEW"," ---","Rationalize framework interaction with ActionConfig.validate()","2012-01-03 14:32:21"
274897,"WTP Common Tools","Faceted Project Framework","fproj-inbox","NEW"," ---","Need support for custom variables in downloadable libraries evaluation context","2012-01-03 14:32:16"
279272,"WTP Common Tools","Faceted Project Framework","fproj-inbox","NEW"," ---","OSGi library provider should allow source attachments to jars","2012-01-03 14:32:19"
279274,"WTP Common Tools","Faceted Project Framework","fproj-inbox","NEW"," ---","OSGi library provider should automatically associate bundle source jars","2012-01-03 14:32:18"
279705,"WTP Common Tools","Faceted Project Framework","fproj-inbox","NEW"," ---","Facets tutorial should better cover ActionConfig","2012-01-03 14:32:18"
279795,"WTP Common Tools","Faceted Project Framework","fproj-inbox","NEW"," ---","Exception message should be indicative when no InstallDelegate is provided","2012-01-03 14:32:17"
281975,"WTP Common Tools","Faceted Project Framework","fproj-inbox","NEW"," ---","Consider more explicit content overwrite prompt in download libraries wizard","2012-01-03 14:32:13"
296872,"WTP Common Tools","Faceted Project Framework","fproj-inbox","NEW"," ---","Need an faceted project action event to signal faceted project is completely initialized","2012-01-03 14:32:19"
303585,"WTP Common Tools","Faceted Project Framework","fproj-inbox","NEW"," ---","Make Facet details description linkable","2012-01-03 14:32:15"
306647,"WTP Common Tools","Faceted Project Framework","fproj-inbox","NEW"," ---","Allow background library downloads","2012-01-03 14:32:21"
316033,"WTP Common Tools","Faceted Project Framework","fproj-inbox","NEW"," ---","Prompt to apply changes on Project Facets properties page","2012-01-03 14:32:16"
135958,"WTP Common Tools","wst.common","jmockler","NEW"," ---","[UI] Improve rendering of primary runtime in facets selection panel","2006-09-18 17:24:08"
214612,"WTP Common Tools","wst.common","kaloyan","NEW"," ---","Component model does not handle special chars in project names","2011-05-20 09:17:34"
266448,"WTP Common Tools","wst.common","kaloyan","NEW"," ---","Separate feature for Data Model Wizard Framework","2011-05-20 09:18:25"
266462,"WTP Common Tools","wst.common","kaloyan","NEW"," ---","Reduce plugin dependencies of Data Model Wizard Framework plugins","2011-05-20 09:17:28"
168784,"WTP Common Tools","wst.command","kathy","NEW"," ---","web service generating error from a simple java class","2009-02-24 05:03:28"
324851,"WTP Common Tools","wst.common","keith.chong.ca","NEW"," ---","[api] URIResolverExtension Interface is Internal","2011-03-17 13:33:01"
281261,"WTP Common Tools","Faceted Project Framework","konstantin","NEW"," ---","Documentation needed for Library Provider Framework","2012-01-03 14:32:20"
298483,"WTP Common Tools","Faceted Project Framework","konstantin","NEW"," ---","Improve discoverability of facets in WTP wizards","2011-05-20 09:18:48"
333757,"WTP Common Tools","Faceted Project Framework","konstantin","NEW"," ---","NPE thrown when clicking 'Delete' button in the 'Project Facets' property page","2012-01-24 12:21:20"
341510,"WTP Common Tools","Faceted Project Framework","konstantin","NEW"," ---","Support optional facet references in the supports extension point","2011-04-01 02:23:35"
347113,"WTP Common Tools","Faceted Project Framework","konstantin","NEW"," ---","""convert to faceted form ..."":  conversion starts too soon!","2015-09-28 13:00:01"
352384,"WTP Common Tools","Faceted Project Framework","konstantin","NEW"," ---","Add ignore-problems to facet.core.runtimes supported extension point","2012-02-04 10:36:42"
416191,"WTP Common Tools","Faceted Project Framework","konstantin","NEW"," ---","UserLibraryProviderInstallPanel enablement of download library based on non-empty library list","2014-02-13 13:36:38"
445590,"WTP Common Tools","Faceted Project Framework","marcel.bruch","NEW"," ---","Failed while invoking preset factory ""org.eclipse.jpt.jpa.core"". (err_grp: 6ed063d0)","2015-04-16 15:05:41"
259175,"WTP Common Tools","Snippets Framework","nsand.dev","NEW"," ---","Notify user of variable name collisions when modifying a template","2009-01-13 23:12:01"
264454,"WTP Common Tools","wst.validation","rosendo","NEW"," ---","ValidationFramework issues with V1 validators","2012-09-13 14:03:16"
322141,"WTP Common Tools","wst.common","rosendo","NEW"," ---","NPE in VirtualComponent#create() for validation","2012-05-01 15:50:10"
347322,"WTP Common Tools","wst.validation","rosendo","NEW"," ---","Project level validator settings get overwritten by global","2011-05-26 15:38:52"
358465,"WTP Common Tools","wst.validation","rosendo","NEW"," ---","Problems view shows 13 errors, but doesn't show a Description, Path, or Location","2012-09-13 14:04:19"
388891,"WTP Common Tools","wst.validation","rosendo","NEW"," ---","Can't Configure Validation to Run Only When a File is Updated","2013-03-07 14:29:16"
414225,"WTP Common Tools","wst.common","rosendo","NEW"," ---","Using relative path to include a XML file leads to a XML Definition validation error","2013-08-13 13:03:25"
414917,"WTP Common Tools","wst.common","rosendo","NEW"," ---","Using relative path to include a XML file leads to a XML Definition validation error","2013-08-12 19:24:25"
127003,"WTP Common Tools","wst.common","shr31223","NEW"," ---","[project creation] Odd default button behavior on project wizard","2011-01-19 14:35:48"
161034,"WTP Common Tools","wst.common","shr31223","NEW"," ---","[project creation] Problem when create project with specific project’s name","2011-01-19 16:00:45"
195074,"WTP Common Tools","wst.common","shr31223","NEW"," ---","DataModelWizard#performFinish() not handling exceptions correctly","2011-05-23 14:24:39"
216695,"WTP Common Tools","wst.common","shr31223","NEW"," ---","a datamodel test, testBasicValidation, fails frequently","2011-05-23 14:58:22"
252900,"WTP Common Tools","wst.common","shr31223","NEW"," ---","Inject IExtensionRegistry in DataModelWizard, PageGroupManager and PageExtensionManager","2011-05-24 00:14:18"
301586,"WTP Common Tools","wst.common","shr31223","NEW"," ---","FlatVirtualComponent needs support to filter directories","2011-01-20 10:39:48"
366870,"WTP Common Tools","wst.common","shr31223","NEW"," ---","Do not hide entries in the deployment assembly page (or provide option to display all entries)","2012-01-11 15:25:24"
472937,"WTP Common Tools","Faceted Project Framework","shr31223","NEW"," ---","Corrupted texts in ""Project Facets"" window","2015-08-05 11:22:51"
303730,"WTP Common Tools","wst.common","stryker","NEW"," ---","Interest in fileset component?","2010-04-21 10:50:34"
405169,"WTP Common Tools","wst.command","wst.command-inbox","NEW"," ---","Do not pack jars bundled inside a packed jar","2013-04-09 09:30:45"
88011,"WTP Common Tools","wst.common","wst.common-inbox","NEW"," ---","[arch] How/When to move to base new common Undo","2013-07-18 14:26:50"
88014,"WTP Common Tools","wst.common","wst.common-inbox","NEW"," ---","[URI resolver][arch] Should URI Resolver be WTP API","2010-03-26 20:31:41"
88694,"WTP Common Tools","Snippets Framework","wst.common-inbox","NEW"," ---","Snippet insertion does not maintaine current indentation level","2013-07-18 14:26:53"
97728,"WTP Common Tools","Snippets Framework","wst.common-inbox","NEW"," ---","snippets view title is not read by window eyes","2013-07-18 14:26:35"
104404,"WTP Common Tools","wst.common","wst.common-inbox","NEW"," ---","[URI resolver] URI resolver should not chain resolution results/remove pre/post normalization phases","2010-03-26 20:42:45"
104587,"WTP Common Tools","wst.common","wst.common-inbox","NEW"," ---","export  ANT build file support","2016-03-22 16:26:01"
107714,"WTP Common Tools","Snippets Framework","wst.common-inbox","NEW"," ---","[ui] Avoid context menu pollution","2013-07-18 14:26:50"
118451,"WTP Common Tools","wst.common","wst.common-inbox","NEW"," ---","[URI resolver] Support restriction based on facets","2010-03-26 20:42:49"
122459,"WTP Common Tools","Snippets Framework","wst.common-inbox","NEW"," ---","[doc] Snippets UI is Inconsistent with Online Help","2013-07-18 14:26:40"
122463,"WTP Common Tools","Snippets Framework","wst.common-inbox","NEW"," ---","[snippets] Unify Templates and Snippets","2013-07-18 14:26:36"
123718,"WTP Common Tools","Snippets Framework","wst.common-inbox","NEW"," ---","out-of-the-box snippets should use content types","2013-07-18 14:26:42"
126207,"WTP Common Tools","wst.common","wst.common-inbox","NEW"," ---","[Search] Feedback on common search pattern and entry classes","2010-03-26 20:42:44"
126615,"WTP Common Tools","wst.common","wst.common-inbox","NEW"," ---","[Search] Add properties to search match","2010-03-26 20:42:47"
126841,"WTP Common Tools","wst.common","wst.common-inbox","NEW"," ---","[Search] Add more type safety to search match classes","2010-03-26 20:42:46"
128374,"WTP Common Tools","Snippets Framework","wst.common-inbox","NEW"," ---","snippets-view: inconsistent handling","2013-07-18 14:26:42"
134758,"WTP Common Tools","Snippets Framework","wst.common-inbox","NEW"," ---","Snippets edit view too big on multiple monitors","2013-07-18 14:26:37"
147723,"WTP Common Tools","Snippets Framework","wst.common-inbox","NEW"," ---","[snippets] Support mandatory variables for Snippets","2013-07-18 14:26:33"
157029,"WTP Common Tools","wst.common","wst.common-inbox","NEW"," ---","[Search] ComponentSearchListDialog should be able to update the handle variable. Its presently declared as final.","2010-03-26 20:42:50"
160388,"WTP Common Tools","wst.common","wst.common-inbox","NEW"," ---","[Search] SearchScope needs overhauling","2010-03-26 20:42:49"
163177,"WTP Common Tools","wst.common","wst.common-inbox","NEW"," ---","[Search] SearchResultsPage in common.ui needs to be revisted to react to changes in 3.3 base","2010-03-26 20:42:45"
173906,"WTP Common Tools","wst.common","wst.common-inbox","NEW"," ---","org.eclipse.wst.xml.core.catalogContributions schema extensions containing imports with schemaLocation attributes break the WST ExtensibleURIResolver.","2010-03-26 20:30:56"
183692,"WTP Common Tools","Snippets Framework","wst.common-inbox","NEW"," ---","[Snippets] The width of the Customize Palette dialog extends very much if a new item is create.","2013-07-18 14:26:54"
186593,"WTP Common Tools","Snippets Framework","wst.common-inbox","NEW"," ---","DnD a snippet from Snippets view causes SWT exception in log","2013-07-18 14:26:34"
187188,"WTP Common Tools","Snippets Framework","wst.common-inbox","NEW"," ---","[dnd] InvocationTargetException when drag and drop from problems view to editor","2010-11-12 13:37:37"
187479,"WTP Common Tools","Snippets Framework","wst.common-inbox","NEW"," ---","[snippets] ""Ignored reentrant call.."" message when customizing snippets view","2013-07-18 14:26:53"
188094,"WTP Common Tools","Snippets Framework","wst.common-inbox","NEW"," ---","Snippets font doesn't display when restarting","2013-07-18 14:26:36"
189151,"WTP Common Tools","wst.common","wst.common-inbox","NEW"," ---","Conflect for AUTOGEN for UpdateHeaderCommentsAction","2010-03-11 13:53:05"
194113,"WTP Common Tools","wst.common","wst.common-inbox","NEW"," ---","Integrate With PDE","2009-05-06 12:53:10"
195388,"WTP Common Tools","wst.common","wst.common-inbox","NEW"," ---","Mylyn Bridge","2010-03-26 19:23:19"
196353,"WTP Common Tools","wst.common","wst.common-inbox","NEW"," ---","[URI resolver] Schema Not loaded for XML file if long relative path used","2011-03-14 11:26:03"
198243,"WTP Common Tools","Snippets Framework","wst.common-inbox","NEW"," ---","SWTException: Data does not have correct format for type if cancel drop","2015-12-04 03:56:39"
209533,"WTP Common Tools","wst.common","wst.common-inbox","NEW"," ---","Investigate removing dependency on runtime.compatibility plugin from common_ui feature","2009-09-25 17:09:31"
220074,"WTP Common Tools","Snippets Framework","wst.common-inbox","NEW"," ---","[snippets] Accelerator for ""Insert Variable Placeholder"" when editing does not work on Mac","2013-07-18 14:26:41"
238832,"WTP Common Tools","wst.common","wst.common-inbox","NEW"," ---","[URI resolver] ExtensibleURIResolver does not decode URL for IFile filenames","2010-03-26 20:30:11"
240113,"WTP Common Tools","wst.common","wst.common-inbox","NEW"," ---","[URI resolver] The URI resolver framework needs JUnit tests","2010-05-31 15:25:34"
243544,"WTP Common Tools","wst.common","wst.common-inbox","NEW"," ---","[API] promote DataModelFramework UI to public API","2011-05-20 09:16:00"
248553,"WTP Common Tools","wst.common","wst.common-inbox","NEW"," ---","plug in default values in Data Models","2008-11-11 22:01:55"
249528,"WTP Common Tools","wst.common","wst.common-inbox","NEW"," ---","[Search] Allow for customized search scopes","2010-03-26 20:42:48"
259857,"WTP Common Tools","wst.common","wst.common-inbox","NEW"," ---","Change perspective dialog box gets hidden","2009-01-02 14:29:45"
264541,"WTP Common Tools","wst.common","wst.common-inbox","NEW"," ---","ComponentCore.createComponent(project) returned null","2012-09-28 17:19:34"
288246,"WTP Common Tools","Snippets Framework","wst.common-inbox","NEW"," ---","Hidden items in snippets view became visible.","2013-07-18 14:26:50"
288423,"WTP Common Tools","wst.common","wst.common-inbox","NEW"," ---","[doc] Need SDK Documentation for wst.common plugins","2009-09-02 22:18:00"
292331,"WTP Common Tools","Snippets Framework","wst.common-inbox","NEW"," ---","[snippets] Variable insertion dialog appears twice when dragging snippet to text editor","2013-07-18 14:26:47"
