"Bug ID","Product","Component","Assignee","Status","Resolution","Summary","Changed"
226165,"WTP Common Tools","wst.validation","karasiuk","CLOSED","FIXED","Apply Changes for Validation Locks dialogs until validation complete","2008-12-05 09:48:05"
226192,"WTP Common Tools","wst.validation","karasiuk","CLOSED","FIXED","dependencies not being cleared properly","2008-11-17 07:54:44"
226283,"WTP Common Tools","wst.validation","karasiuk","CLOSED","FIXED","NPE when adding dependency entry","2008-11-17 07:54:53"
226372,"WTP Common Tools","wst.validation","karasiuk","CLOSED","FIXED","NPE when initializing build paths","2008-11-17 07:54:45"
226541,"WTP Common Tools","wst.validation","karasiuk","CLOSED","FIXED","manual validation does not work unless validation builder is added to any project","2008-04-24 06:35:44"
226544,"WTP Common Tools","wst.validation","karasiuk","CLOSED","FIXED","Some traces during testing of the latest validation framework","2008-11-17 07:55:02"
226597,"WTP Common Tools","wst.validation","karasiuk","CLOSED","FIXED","What about subdirectories in validation exclude/include rules?","2008-04-19 17:00:48"
227019,"WTP Common Tools","wst.validation","karasiuk","CLOSED","WORKSFORME","Adding rule to WSDL Preferences in different language does not resize window","2008-05-07 10:16:42"
227120,"WTP Common Tools","wst.validation","karasiuk","CLOSED","FIXED","No validation errors (or inconsistent results) are reported when injecting errors to WAR & EJB3.","2008-11-17 07:54:43"
227206,"WTP Common Tools","wst.validation","karasiuk","CLOSED","FIXED","Optimize getting content types","2008-04-23 08:58:25"
227210,"WTP Common Tools","wst.validation","karasiuk","CLOSED","WORKSFORME","Exclude rule should apply to all folders in a project","2008-05-07 09:53:42"
227300,"WTP Common Tools","wst.validation","karasiuk","CLOSED","FIXED","Validation needs better progress reporting","2008-11-17 07:55:25"
227452,"WTP Common Tools","wst.validation","karasiuk","CLOSED","FIXED","[API Request] Allow for validator groupings","2008-11-17 07:55:26"
227834,"WTP Common Tools","wst.validation","karasiuk","CLOSED","FIXED","[API] Need to have a way, to turn off validators for a certain kind of projects","2008-12-08 23:04:20"
228099,"WTP Common Tools","wst.validation","karasiuk","CLOSED","FIXED","Group listeners might not be notified to finish if progress monitor is canceled","2008-11-17 07:55:33"
228382,"WTP Common Tools","wst.validation","karasiuk","CLOSED","FIXED","Add junit tests to catch early activation","2008-11-17 07:54:58"
228396,"WTP Common Tools","wst.validation","karasiuk","CLOSED","FIXED","Javadoc and code cleanup","2008-11-17 07:55:29"
228656,"WTP Common Tools","wst.validation","karasiuk","CLOSED","FIXED","Validators not called on import","2008-11-17 07:55:35"
228704,"WTP Common Tools","wst.validation","karasiuk","CLOSED","FIXED","Questionable use of Workspace Root rule in ManualValidationRunner /ValidationRunner","2008-11-17 08:05:39"
228719,"WTP Common Tools","wst.validation","karasiuk","CLOSED","FIXED","Validation preferences page has a table that grows very tall and wide","2008-11-17 07:55:36"
228941,"WTP Common Tools","wst.validation","karasiuk","CLOSED","FIXED","Validation project properties issues","2008-11-17 08:15:34"
230407,"WTP Common Tools","wst.validation","karasiuk","CLOSED","FIXED","The new validation framework does not persist the IMessage group name","2008-05-22 13:49:31"
230994,"WTP Common Tools","wst.validation","karasiuk","CLOSED","FIXED","Log the resource name if validator throws an Exception","2008-05-12 10:41:36"
231174,"WTP Common Tools","wst.validation","karasiuk","CLOSED","DUPLICATE","Excessive amount of validation monitors running","2009-01-05 06:29:33"
231207,"WTP Common Tools","wst.validation","karasiuk","CLOSED","FIXED","[PII] File filters not working correctly","2008-05-23 14:27:51"
231685,"WTP Common Tools","wst.validation","karasiuk","CLOSED","FIXED","Validator disabled under false pretenses","2008-06-02 06:36:06"
232550,"WTP Common Tools","wst.validation","karasiuk","CLOSED","FIXED","Validation not thread safe","2009-03-12 02:47:46"
232769,"WTP Common Tools","wst.validation","karasiuk","CLOSED","FIXED","Javadoc improvements","2008-05-23 14:21:07"
232890,"WTP Common Tools","wst.validation","karasiuk","CLOSED","FIXED","TVT34:TCT418: PLK: truncation in ""Validation filters for"" window","2008-06-03 15:51:10"
233015,"WTP Common Tools","wst.validation","karasiuk","CLOSED","FIXED","User doc improvements","2008-11-17 08:05:38"
233746,"WTP Common Tools","wst.validation","karasiuk","CLOSED","FIXED","NPE in dependency index","2008-06-04 11:07:52"
234264,"WTP Common Tools","wst.validation","karasiuk","CLOSED","FIXED","TVT34:TCT420: PLK: dropdown list filed too narrow in ""New filter rule wizard""","2008-06-13 10:48:47"
234381,"WTP Common Tools","wst.validation","karasiuk","CLOSED","FIXED","Add the new validation tuning page into our info pops","2008-06-05 10:26:34"
235214,"WTP Common Tools","wst.validation","karasiuk","CLOSED","FIXED","Add support method to isolate a single validator","2008-10-22 07:24:12"
235388,"WTP Common Tools","wst.validation","karasiuk","CLOSED","FIXED","Use classloader when looking up messages","2008-06-09 14:15:24"
235695,"WTP Common Tools","wst.validation","karasiuk","CLOSED","FIXED","extension point definitions should specify ""translatable""","2008-09-11 07:35:14"
236656,"WTP Common Tools","wst.validation","karasiuk","CLOSED","FIXED","Classes missing copyright","2008-08-10 07:32:34"
237349,"WTP Common Tools","wst.validation","karasiuk","CLOSED","DUPLICATE","Validators need to be filtered on the properties page","2008-08-10 07:36:25"
237631,"WTP Common Tools","wst.validation","karasiuk","CLOSED","FIXED","Validation Framework Extension Point Ref refers to WTP 3.4","2008-12-17 16:19:40"
240536,"WTP Common Tools","wst.validation","karasiuk","CLOSED","DUPLICATE","Validation: After editing validation filters long UI hang","2009-01-05 06:27:23"
240955,"WTP Common Tools","wst.validation","karasiuk","CLOSED","FIXED","DVT34: broken link in documentation","2008-11-10 10:32:52"
241396,"WTP Common Tools","wst.validation","karasiuk","CLOSED","FIXED","Manual Validation not cleaning up; leading to file locks","2008-08-10 07:35:19"
241527,"WTP Common Tools","wst.validation","karasiuk","CLOSED","FIXED","Intermittent validation error encountered when publishing free form projects","2008-08-10 07:34:49"
241701,"WTP Common Tools","wst.validation","karasiuk","CLOSED","FIXED","Bump plug-in version","2008-08-10 07:31:31"
242492,"WTP Common Tools","wst.validation","karasiuk","CLOSED","FIXED","Error: Marker id 4 not found...","2008-11-10 10:33:45"
243211,"WTP Common Tools","wst.validation","karasiuk","CLOSED","FIXED","Occurs during project clean+build","2008-11-10 10:33:17"
243679,"WTP Common Tools","wst.validation","karasiuk","CLOSED","FIXED","NPE in ValidationRegistryReader","2008-09-29 08:43:03"
243749,"WTP Common Tools","wst.validation","karasiuk","CLOSED","FIXED","Validation error in .log","2008-10-17 09:18:26"
243955,"WTP Common Tools","wst.validation","karasiuk","CLOSED","FIXED","disabled validators dont show up in project specific validation properties","2008-10-18 07:02:22"
244071,"WTP Common Tools","wst.validation","karasiuk","CLOSED","FIXED","restore defaults in project's validation properties does not restore all defaults","2008-10-18 07:01:54"
244074,"WTP Common Tools","wst.validation","karasiuk","CLOSED","FIXED","inconsistency when switching from project specific preferences to global preferences","2008-11-03 11:30:34"
244076,"WTP Common Tools","wst.validation","karasiuk","CLOSED","FIXED","validation.prefs file is always created when user hits ok in validation properties","2009-02-05 03:40:52"
245383,"WTP Common Tools","wst.validation","karasiuk","CLOSED","FIXED","Suspended validators are called in error","2008-09-11 07:29:26"
246093,"WTP Common Tools","wst.validation","karasiuk","CLOSED","FIXED","Add non-project-relative (or wildcarded) paths toV2 Validation Framework exclusion rules","2008-10-18 16:18:41"
246287,"WTP Common Tools","wst.validation","karasiuk","CLOSED","FIXED","memory leak in DependencyIndex","2008-09-21 14:49:56"
246342,"WTP Common Tools","wst.validation","karasiuk","CLOSED","WORKSFORME","Bump plug-in version","2008-09-11 06:50:24"
246993,"WTP Common Tools","wst.validation","karasiuk","CLOSED","FIXED","Re-release the validation framework","2008-09-18 14:12:43"
247447,"WTP Common Tools","wst.validation","karasiuk","CLOSED","FIXED","Duplicated warnings from validation","2008-11-03 12:25:37"
247859,"WTP Common Tools","wst.validation","karasiuk","CLOSED","FIXED","Order of the validationStarting/Finishing(null) calls is still","2009-01-27 04:14:32"
248240,"WTP Common Tools","wst.validation","karasiuk","CLOSED","DUPLICATE","NPE in isConfiguredOnProject","2009-01-14 05:23:22"
248538,"WTP Common Tools","wst.validation","karasiuk","CLOSED","FIXED","WST Validation: Marker id xxx not found","2008-12-16 08:15:56"
249095,"WTP Common Tools","wst.common","karasiuk","CLOSED","FIXED","Update service level in features for 3.0.3","2008-10-01 07:35:15"
249322,"WTP Common Tools","wst.validation","karasiuk","CLOSED","FIXED","Add facet version to the filter rules","2008-10-17 08:42:59"
249872,"WTP Common Tools","wst.validation","karasiuk","CLOSED","FIXED","Create a performance test case","2008-10-17 08:44:28"
250209,"WTP Common Tools","wst.validation","karasiuk","CLOSED","FIXED","Provide public methods to enable/disable validators","2008-11-03 11:02:06"
250848,"WTP Common Tools","wst.validation","karasiuk","CLOSED","FIXED","Handle invalid exclude extensions","2008-10-22 07:25:23"
251031,"WTP Common Tools","wst.validation","karasiuk","CLOSED","FIXED","Frequent NPEs in DependencyIndex.getOrCreateDepends()","2008-11-10 10:32:13"
251105,"WTP Common Tools","wst.validation","karasiuk","CLOSED","FIXED","V1 Validators are not reenabled when the suspend checkbox is cleared","2008-11-03 11:03:48"
251157,"WTP Common Tools","wst.validation","karasiuk","CLOSED","FIXED","o.e.w.common.tests.validation needs pre-req widening","2008-11-03 13:08:23"
251383,"WTP Common Tools","wst.validation","karasiuk","CLOSED","FIXED","Bump the validation.doc.isv plug-in version","2008-10-22 07:22:57"
251385,"WTP Common Tools","wst.validation","karasiuk","CLOSED","FIXED","Add a version qualifier to the validation test plug-ins","2008-11-03 11:10:53"
251529,"WTP Common Tools","wst.validation","karasiuk","CLOSED","FIXED","ValidationFramework getDefault() not thread safe","2008-10-22 07:22:28"
251542,"WTP Common Tools","wst.validation","karasiuk","CLOSED","FIXED","Closing a project causes errors in the log","2009-01-27 04:14:07"
251672,"WTP Common Tools","wst.validation","karasiuk","CLOSED","FIXED","Fix multi threading issues","2008-11-03 11:09:39"
251749,"WTP Common Tools","wst.validation","karasiuk","CLOSED","FIXED","Better IWAE0102E error reporting","2008-11-10 10:34:12"
252170,"WTP Common Tools","wst.validation","karasiuk","CLOSED","FIXED","JSP unit test failed","2008-11-03 11:14:33"
252217,"WTP Common Tools","wst.validation","karasiuk","CLOSED","FIXED","Deadlock during validation and rebuild","2008-11-25 06:19:57"
253700,"WTP Common Tools","wst.validation","karasiuk","CLOSED","FIXED","Validation project preferences ignored from WTP 1.5.5 project","2009-01-14 05:20:39"
254521,"WTP Common Tools","wst.validation","karasiuk","CLOSED","FIXED","Suspend validation function not working","2008-11-25 06:21:01"
254586,"WTP Common Tools","wst.validation","karasiuk","CLOSED","DUPLICATE","Too many validation monitor jobs","2009-01-21 13:36:54"
254944,"WTP Common Tools","wst.validation","karasiuk","CLOSED","FIXED","ValidationPreferencePage.ValidatorListPage.performOk() blocks UI while revalidating","2008-12-15 09:20:08"
255850,"WTP Common Tools","wst.validation","karasiuk","CLOSED","FIXED","ArrayIndexOutOfBoundsException when applying new validation exclude rules","2008-12-15 09:19:36"
256439,"WTP Common Tools","wst.validation","karasiuk","CLOSED","FIXED","Improve the Javadoc for adding Markers","2008-11-27 06:18:40"
256783,"WTP Common Tools","wst.validation","karasiuk","CLOSED","FIXED","Don't log error messages for deleted markers","2008-12-05 06:55:55"
257411,"WTP Common Tools","wst.validation","karasiuk","CLOSED","FIXED","Bump version numbers for 3.0.4","2008-12-05 06:58:08"
257603,"WTP Common Tools","wst.validation","karasiuk","CLOSED","FIXED","IProject not included in the validation set","2008-12-15 09:21:21"
258000,"WTP Common Tools","wst.validation","karasiuk","CLOSED","FIXED","Not getting notified when resource in setDependsOn is removed","2008-12-15 10:26:24"
258180,"WTP Common Tools","wst.validation","karasiuk","CLOSED","FIXED","Provide public methods to interact with the validation framework","2009-04-06 11:09:08"
258258,"WTP Common Tools","wst.validation","karasiuk","CLOSED","FIXED","java.io.EOFException in org.eclipse.wst.validation.internal.DependencyIndex","2008-12-27 06:39:21"
258841,"WTP Common Tools","wst.validation","karasiuk","CLOSED","FIXED","V2 framework always clears markers for dependent resource","2009-01-14 05:21:31"
258968,"WTP Common Tools","wst.validation","karasiuk","CLOSED","FIXED","ValidationOperation straining Eclipse Jobs infrastructure","2009-01-14 08:22:18"
260902,"WTP Common Tools","wst.validation","karasiuk","CLOSED","FIXED","Adding a File Rule causes NPE in VF preference page","2009-01-20 05:17:51"
260956,"WTP Common Tools","wst.validation","karasiuk","CLOSED","FIXED","Make FilterRules Immutable","2009-01-19 15:35:24"
261032,"WTP Common Tools","wst.validation","karasiuk","CLOSED","FIXED","Make more model objects immutable","2009-01-19 15:36:01"
261275,"WTP Common Tools","wst.validation","karasiuk","CLOSED","FIXED","Add a way to add the validation builder to a project","2009-01-19 15:45:48"
261393,"WTP Common Tools","wst.validation","karasiuk","CLOSED","FIXED","Validation framework should allow clients to programmatically validate a file...","2009-02-05 03:43:16"
261526,"WTP Common Tools","wst.validation","karasiuk","CLOSED","FIXED","More multi-threaded cleanup","2009-01-27 04:12:28"
262360,"WTP Common Tools","wst.validation","karasiuk","CLOSED","FIXED","Provide a public method, to determine if a validator has already been activated","2009-02-01 07:11:11"
262526,"WTP Common Tools","wst.validation","karasiuk","CLOSED","FIXED","NLS and remove some more warning","2009-02-01 07:12:19"
262823,"WTP Common Tools","wst.validation","karasiuk","CLOSED","FIXED","Bump plug-in version","2009-02-01 07:12:49"
264468,"WTP Common Tools","wst.validation","karasiuk","CLOSED","WORKSFORME","ValidationFramework applyChanges() - persist doesn't work as described","2009-04-03 08:18:35"
264471,"WTP Common Tools","wst.validation","karasiuk","CLOSED","FIXED","Changes to validator's filter settings don't get persisted","2009-04-18 10:34:10"
267724,"WTP Common Tools","wst.validation","karasiuk","CLOSED","FIXED","Validation Framework doesn't honor product customization preferences","2009-04-03 08:15:30"
270288,"WTP Common Tools","wst.validation","karasiuk","CLOSED","FIXED","Mapping validator doesn't seem to be running at all","2009-04-03 08:14:55"
270665,"WTP Common Tools","wst.validation","karasiuk","CLOSED","FIXED","Manual validation not calling IValidator.cleanup(IReporter)","2009-04-21 17:47:06"
276264,"WTP Common Tools","wst.validation","karasiuk","CLOSED","FIXED","Add back the changes for bug 270665","2009-08-10 12:29:30"
287177,"WTP Common Tools","wst.validation","karasiuk","CLOSED","FIXED","test case manifest does not need such specfic dependencies","2009-09-08 09:47:32"
334022,"WTP Common Tools","wst.validation","karasiuk","CLOSED","FIXED","NPE in org.eclipse.wst.validation.internal.DependencyIndex","2011-01-13 08:21:46"
350084,"WTP Common Tools","wst.validation","karasiuk","CLOSED","FIXED","A join should be provided for just the validation jobs","2011-06-24 15:11:40"
350121,"WTP Common Tools","wst.validation","karasiuk","CLOSED","FIXED","Fix warnings from the build page (for WTP 3.2.5)","2011-06-27 06:22:37"
113701,"WTP Common Tools","wst.common","kathy","CLOSED","FIXED","Rename interfaces in wst.common.environment plugin to follow Eclipse convention","2005-10-31 11:35:09"
114508,"WTP Common Tools","wst.command","kathy","CLOSED","FIXED","EclipseEnvironment required lower in plug-in stack","2006-02-17 13:17:12"
115855,"WTP Common Tools","wst.command","kathy","CLOSED","FIXED","Ant task JAR (anttasks.jar) corrupted in build","2005-11-15 10:06:12"
117310,"WTP Common Tools","wst.command","kathy","CLOSED","WORKSFORME","performace problem for  Ant tasks at command line","2008-06-11 14:36:16"
159231,"WTP Common Tools","wst.command","kathy","CLOSED","FIXED","Build Breaker: org.eclipse.wst.command.env.ui","2006-10-24 10:43:21"
189280,"WTP Common Tools","wst.command","kathy","CLOSED","FIXED","org.eclipse.wst.command.env has overly narrow ranges","2008-06-11 16:25:04"
137074,"WTP Common Tools","wst.common","keith.chong.ca","CLOSED","FIXED","Support doubleClick for ComponentSelectionDialog","2006-10-08 14:27:32"
272893,"WTP Common Tools","wst.common","keith.chong.ca","CLOSED","FIXED","Typo in org.eclipse.wst.common.environment bundle name","2010-02-21 17:14:10"
113309,"WTP Common Tools","wst.common","konstantin","CLOSED","FIXED","ExceptionInInitializerError with Add/Remove project facet","2005-10-31 11:34:33"
113538,"WTP Common Tools","wst.common","konstantin","CLOSED","FIXED","Facet runtimes needs hardening","2005-11-23 11:17:45"
113542,"WTP Common Tools","wst.common","konstantin","CLOSED","FIXED","[UI] Investigate other ways to present facet description","2007-06-11 11:49:06"
113547,"WTP Common Tools","wst.common","konstantin","CLOSED","FIXED","Need better runtime bridge api","2005-11-23 11:17:46"
113551,"WTP Common Tools","wst.common","konstantin","CLOSED","FIXED","Schema missing from facets.core plugin","2017-10-11 15:52:04"
113566,"WTP Common Tools","wst.common","konstantin","CLOSED","FIXED","[UI] Icons should not be specified in core extension points","2005-11-23 11:19:36"
113589,"WTP Common Tools","wst.common","konstantin","CLOSED","FIXED","Request for a utility method to get a set of IRuntime's given a set of IProjectFacetVersion's","2006-06-15 09:02:05"
113693,"WTP Common Tools","wst.common","konstantin","CLOSED","FIXED","Support facet version expressions in various extension points","2006-09-25 02:43:03"
113793,"WTP Common Tools","wst.common","konstantin","CLOSED","FIXED","org.eclipse.wst.common.project.facet.core should be jarred","2005-12-14 15:03:12"
113936,"WTP Common Tools","wst.common","konstantin","CLOSED","FIXED","project.facet.core requires org.eclipse.jdt.core","2005-12-20 17:36:06"
113975,"WTP Common Tools","wst.common","konstantin","CLOSED","FIXED","No runtime displayed in ""Add/Remove Project Facet""","2005-10-31 11:36:16"
114006,"WTP Common Tools","wst.common","konstantin","CLOSED","FIXED","Facet runtime extension point too verbose","2005-12-13 10:17:28"
114051,"WTP Common Tools","wst.common","konstantin","CLOSED","FIXED","Runtimes not initialized on startup","2006-06-15 09:02:26"
114095,"WTP Common Tools","wst.common","konstantin","CLOSED","FIXED","Facet icons abnormally small","2005-11-23 11:17:47"
114392,"WTP Common Tools","wst.common","konstantin","CLOSED","INVALID","RuntimeManager.getRuntimes(Set) returning empty set  for jst.java 1.3 facet","2006-06-15 09:03:22"
114586,"WTP Common Tools","wst.common","konstantin","CLOSED","FIXED","Internal error in facet support","2005-11-23 11:17:47"
114918,"WTP Common Tools","wst.common","konstantin","CLOSED","WONTFIX","Facet Install Delegates need optional ""final persective"" tag","2006-06-15 09:03:49"
115068,"WTP Common Tools","wst.common","konstantin","CLOSED","FIXED","Facet classpath uses wrong (global) adapter","2005-11-23 11:17:47"
115328,"WTP Common Tools","wst.common","konstantin","CLOSED","FIXED","[UI] Facet runtime filtering/binding unclear","2005-12-13 10:17:29"
115329,"WTP Common Tools","wst.common","konstantin","CLOSED","WONTFIX","Facet UI issues","2005-11-23 11:20:57"
115336,"WTP Common Tools","wst.common","konstantin","CLOSED","WONTFIX","Facet extension point consistency/length","2005-12-13 10:17:29"
115349,"WTP Common Tools","wst.common","konstantin","CLOSED","FIXED","[UI] Improve rendering of facet version selection","2007-03-21 16:23:15"
115351,"WTP Common Tools","wst.common","konstantin","CLOSED","FIXED","[UI] Need wizard banner for the Add/Remove Facets Wizard","2006-09-27 09:07:53"
115425,"WTP Common Tools","wst.common","konstantin","CLOSED","FIXED","Need to support restricted version change delegates.","2006-06-15 11:46:57"
115536,"WTP Common Tools","wst.common","konstantin","CLOSED","FIXED","Cannot get IRuntime from RuntimeManager until RuntimeManager::bridge() is called","2006-06-15 09:04:19"
115890,"WTP Common Tools","wst.common","konstantin","CLOSED","FIXED","Facets should provide extension points for life-cycle events","2006-09-26 13:05:39"
115899,"WTP Common Tools","wst.common","konstantin","CLOSED","FIXED","Facet constraints need improved error message","2006-09-26 13:04:57"
115908,"WTP Common Tools","wst.common","konstantin","CLOSED","FIXED","[UI] Runtimes that don't support facets should be grayed instead of not visible","2005-12-13 13:09:49"
115909,"WTP Common Tools","wst.common","konstantin","CLOSED","FIXED","[UI] Runtime selection should be hideable","2005-12-13 13:10:52"
115910,"WTP Common Tools","wst.common","konstantin","CLOSED","FIXED","RuntimeManagerImpl unable to find runtime","2006-06-15 09:05:09"
116056,"WTP Common Tools","wst.common","konstantin","CLOSED","FIXED","FacetedProject should report original exceptions from delegate","2006-09-25 02:43:05"
116059,"WTP Common Tools","wst.common","konstantin","CLOSED","FIXED","PII: Clean up single quote characters in facet.ui's and facet.core's property files","2006-01-24 14:09:46"
116093,"WTP Common Tools","wst.common","konstantin","CLOSED","FIXED","Facet JUnit tests","2006-09-07 11:23:01"
116469,"WTP Common Tools","wst.common","konstantin","CLOSED","FIXED","[UI] Java facet needs install page for source and output dir config","2008-10-07 20:36:28"
116500,"WTP Common Tools","wst.common","konstantin","CLOSED","FIXED","Facet icon extension non-standard","2005-12-13 10:17:29"
116724,"WTP Common Tools","wst.common","konstantin","CLOSED","FIXED","NPE when selecting runtime facet on the Add and remote facet wizard","2006-09-22 09:03:51"
117019,"WTP Common Tools","wst.common","konstantin","CLOSED","FIXED","Facet presets can cause ArrayIndexOufBounds exception if runtime filters out a facet","2006-09-26 10:10:07"
117099,"WTP Common Tools","wst.common","konstantin","CLOSED","FIXED","Need better term for ""preset""","2006-11-28 15:59:11"
117102,"WTP Common Tools","wst.common","konstantin","CLOSED","WONTFIX","Facet ""preset"" choice should be sticky","2007-04-03 11:47:16"
117348,"WTP Common Tools","wst.common","konstantin","CLOSED","DUPLICATE","Facets UI isn't accessible","2005-12-13 10:17:29"
117354,"WTP Common Tools","wst.common","konstantin","CLOSED","DUPLICATE","Consistency for fixed facets","2005-12-13 10:17:30"
117356,"WTP Common Tools","wst.common","konstantin","CLOSED","FIXED","Facets flash when selected","2005-12-13 10:17:30"
117780,"WTP Common Tools","wst.common","konstantin","CLOSED","FIXED","Java 1.4 facet cannot be switched to Java 5.0 facet","2006-09-26 13:01:54"
117788,"WTP Common Tools","wst.common","konstantin","CLOSED","DUPLICATE","Selecting a project facet does not automatically select the required facets","2006-09-25 03:04:31"
117845,"WTP Common Tools","wst.common","konstantin","CLOSED","FIXED","FACET error can't fix from dialogue","2006-09-26 10:10:02"
118285,"WTP Common Tools","wst.common","konstantin","CLOSED","FIXED","IllegalArgumentException when creating new runtime","2007-07-29 09:18:25"
118538,"WTP Common Tools","wst.common","konstantin","CLOSED","FIXED","Use something other than &gt;= in extension point","2006-06-13 11:44:30"
118566,"WTP Common Tools","wst.common","konstantin","CLOSED","WONTFIX","Project Facet API does not support Facet bookkeeping","2006-09-25 03:04:26"
118568,"WTP Common Tools","wst.common","konstantin","CLOSED","DUPLICATE","Project Facet API should support installing an entire dependency chain","2006-09-25 03:04:31"
118625,"WTP Common Tools","wst.common","konstantin","CLOSED","FIXED","Fail to create project.facet.core.xml, if server runtimeType contains non ascii char.","2006-06-15 09:06:04"
118655,"WTP Common Tools","wst.common","konstantin","CLOSED","FIXED","Facet Add/Remove Dialog UI on Linux-GTK feedback","2006-09-26 10:09:57"
118783,"WTP Common Tools","wst.common","konstantin","CLOSED","FIXED","Hundreds of NPE's in recent JUnit tests logs","2006-06-15 09:06:42"
118905,"WTP Common Tools","wst.common","konstantin","CLOSED","FIXED","Facet constraints not satisfied when creating Web project","2005-12-12 11:05:13"
118951,"WTP Common Tools","wst.common","konstantin","CLOSED","FIXED","Facet plugins missing plugin provider","2005-12-13 10:17:31"
119095,"WTP Common Tools","wst.common","konstantin","CLOSED","DUPLICATE","Invalid group-member constraint combination hangs Eclipse on wizard launch","2005-12-14 12:55:16"
119125,"WTP Common Tools","wst.common","konstantin","CLOSED","FIXED","dispose() is not called on facet wizard pages","2006-06-15 09:07:15"
119262,"WTP Common Tools","wst.common","konstantin","CLOSED","FIXED","CPU lock while selecting facets","2005-12-13 10:17:31"
119336,"WTP Common Tools","wst.common","konstantin","CLOSED","FIXED","Facet categories break preset selection","2006-09-22 21:07:48"
119360,"WTP Common Tools","wst.common","konstantin","CLOSED","FIXED","can't programmatically reset selections on the FacetsSelectionPanel","2006-09-22 21:07:57"
119733,"WTP Common Tools","wst.common","konstantin","CLOSED","FIXED","Project facet plugins do not belong to any component.xml files","2006-01-24 13:58:31"
