"Bug ID","Product","Component","Assignee","Status","Resolution","Summary","Changed"
253369,"EPP","Installer","epp.installer-inbox","RESOLVED","FIXED","Communicate","2009-03-10 08:09:17"
253394,"EPP","Installer","epp.installer-inbox","RESOLVED","FIXED","Intent","2009-03-10 08:09:03"
253421,"EPP","Installer","epp.installer-inbox","RESOLVED","FIXED","Attendance","2009-03-10 08:10:33"
253445,"EPP","Installer","epp.installer-inbox","RESOLVED","FIXED","Ramp Down Policy","2009-05-06 05:20:27"
253470,"EPP","Usage Data Collector","epp.installer-inbox","RESOLVED","FIXED","IP","2009-05-06 07:05:43"
253494,"EPP","Usage Data Collector","epp.installer-inbox","RESOLVED","FIXED","APIs","2009-05-05 11:41:50"
253544,"EPP","Installer","epp.installer-inbox","RESOLVED","FIXED","Version Numbering","2009-05-05 11:31:31"
253570,"EPP","Installer","epp.installer-inbox","RESOLVED","FIXED","Leverage OSGi","2009-05-05 11:30:47"
253596,"EPP","Usage Data Collector","epp.installer-inbox","RESOLVED","FIXED","Execution Environment","2009-05-04 15:00:13"
253621,"EPP","Installer","epp.installer-inbox","RESOLVED","FIXED","Signing","2009-03-10 08:07:37"
253847,"EPP","Installer","epp.installer-inbox","RESOLVED","FIXED","Use Jars","2009-03-10 08:12:50"
254011,"EPP","Installer","epp.installer-inbox","RESOLVED","FIXED","Builds","2009-03-10 08:09:31"
254039,"EPP","Installer","epp.installer-inbox","RESOLVED","FIXED","Orbit","2009-03-10 08:08:19"
254066,"EPP","Installer","epp.installer-inbox","RESOLVED","FIXED","Optimization","2009-03-10 08:08:36"
254091,"EPP","Installer","epp.installer-inbox","RESOLVED","FIXED","New & Noteworthy","2009-05-20 14:43:37"
254118,"EPP","Installer","epp.installer-inbox","RESOLVED","FIXED","Work Together","2009-05-20 14:45:14"
254144,"EPP","Usage Data Collector","epp.installer-inbox","RESOLVED","WONTFIX","Capabilities","2009-06-10 11:36:58"
254170,"EPP","Installer","epp.installer-inbox","RESOLVED","FIXED","Localization - Babel","2009-05-06 05:09:11"
254303,"EPP","Installer","epp.installer-inbox","RESOLVED","FIXED","Branding","2009-05-20 13:23:04"
275558,"EPP","java-package","mknauer","RESOLVED","FIXED","[Galileo M7] welcome view is not displayed on first startup","2009-06-17 18:02:29"
442121,"EPP","Automated Error Reporting Client (AERI)","recommenders-inbox","RESOLVED","FIXED","Handle multistatus properly","2015-03-06 14:46:50"
443009,"EPP","Automated Error Reporting Client (AERI)","recommenders-inbox","RESOLVED","FIXED","RootExceptions lost during DTO creation","2015-03-06 14:46:43"
442435,"EPP","Automated Error Reporting Client (AERI)","simon.laffoy","RESOLVED","FIXED","Support ignore lists for error reports","2015-03-06 14:46:31"
457585,"EPP","Automated Error Reporting Client (AERI)","simon.laffoy","RESOLVED","FIXED","Error Reporting Tooltip Issues","2015-03-06 14:46:41"
275521,"EPP","java-package","steffen.pingel","RESOLVED","FIXED","Improve branding for Galileo java package","2009-06-19 19:42:40"
350079,"EPP","java-package","steffen.pingel","RESOLVED","FIXED","EGit should be by included in Java package","2012-08-14 04:40:45"
253518,"EPP","Usage Data Collector","wayne.beaton","RESOLVED","DUPLICATE","Message Bundles","2009-05-06 10:29:29"
254196,"EPP","Usage Data Collector","wayne.beaton","RESOLVED","FIXED","Localization - ICU4J","2009-05-06 13:54:45"
278857,"EPP","Usage Data Collector","wayne.beaton","RESOLVED","FIXED","StackOverflowError during ""Generate Usage Data Upload Preview""","2009-06-10 10:10:31"
254225,"EPP","Usage Data Collector","epp.installer-inbox","RESOLVED","FIXED","Usability","2009-05-05 11:40:16"
254252,"EPP","Installer","epp.installer-inbox","RESOLVED","WONTFIX","Accessibility","2009-06-16 00:48:23"
254279,"EPP","Installer","epp.installer-inbox","RESOLVED","FIXED","Performance","2009-05-20 12:40:51"
254329,"EPP","Installer","epp.installer-inbox","RESOLVED","WONTFIX","Localization - Babel PTT","2009-06-16 00:48:53"
254357,"EPP","Usage Data Collector","epp.installer-inbox","RESOLVED","FIXED","Localization - UI freeze","2009-05-05 11:39:21"
254383,"EPP","Installer","epp.installer-inbox","RESOLVED","WONTFIX","Localization - bidi","2009-06-16 00:49:15"
280566,"EPP","jee-package","epp.packager-inbox","RESOLVED","FIXED","add capabilities (and preferences)","2010-11-11 21:06:37"
301952,"EPP","javascript-package","epp.packager-inbox","RESOLVED","FIXED","JavaScript Package needs a default perspective specified","2010-11-11 21:08:24"
408213,"EPP","Packager","epp.packager-inbox","RESOLVED","FIXED","EPP picked up wrong version of Platform M7 bundles","2013-05-24 05:39:18"
474204,"EPP","java-package","epp.packager-inbox","RESOLVED","FIXED","Include Buildship as part of Java package","2015-09-02 04:36:53"
474207,"EPP","committers-package","epp.packager-inbox","RESOLVED","FIXED","Include Buildship as part of 'Eclipse Committers' package","2015-08-25 13:25:37"
514257,"EPP","committers-package","epp.packager-inbox","RESOLVED","WORKSFORME","Marketplace client is missing in commiters-oxygen-M6 package due to uses constraint violation","2020-05-19 13:27:23"
454848,"EPP","Automated Error Reporting Client (AERI)","haftsteind","RESOLVED","FIXED","[stacktraces] Dependency to xbase is outdated for Mars","2015-03-06 14:46:47"
279203,"EPP","java-package","mknauer","RESOLVED","FIXED","Add and enable Mylyn update site by default","2009-06-18 03:00:48"
305098,"EPP","javascript-package","mknauer","RESOLVED","FIXED","provide icon(s) for JavaScript package","2011-05-12 11:20:52"
194805,"EPP","java-package","steffen.pingel","RESOLVED","FIXED","add Error Log view to Java EPP distribution","2009-05-27 12:37:39"
225470,"EPP","package content","steffen.pingel","RESOLVED","FIXED","maintain the Java package","2011-05-20 05:15:37"
460559,"EPP","committers-package","alex.blewitt","RESOLVED","FIXED","Add SWT Tools/Sleak to standard Eclipse Committers package","2020-10-28 15:25:09"
415953,"EPP","scout-package","Andreas.Hoegger","RESOLVED","INVALID","Update News URL to for Scout 3.10","2014-06-05 09:26:14"
361421,"EPP","parallel-package","beth","RESOLVED","FIXED","Please update plugin_cusomization.ini","2011-10-19 13:34:19"
222086,"EPP","Installer","Birt-Build-inbox","RESOLVED","FIXED","Rename EPP Ganymede Package","2008-04-12 11:47:40"
238106,"EPP","reporting-package","bluesoldier","RESOLVED","FIXED","Need a proper icon for Reporting package","2008-06-26 13:49:51"
490045,"EPP","committers-package","bsd","RESOLVED","FIXED","[Welcome] Adopt Solstice theme for Committers package","2016-05-19 10:39:00"
490351,"EPP","javascript-package","bsd","RESOLVED","FIXED","[Welcome] Adopt Solstice theme for JS package","2016-05-16 07:54:58"
350150,"EPP","jee-package","cbridgha","RESOLVED","FIXED","Include m2e as part of this package","2013-06-08 11:21:27"
413545,"EPP","jee-package","cbridgha","RESOLVED","FIXED","Kepler Java EE package missing key m2e bundles","2013-08-22 09:53:22"
492028,"EPP","jee-package","cbridgha","RESOLVED","FIXED","Add optional chromium Debugger feature to JEE EPP for Neon","2019-08-29 08:59:24"
516675,"EPP","cpp-package","cdtdoug","RESOLVED","FIXED","Add Terminal to CPP Package","2017-05-16 12:24:32"
430256,"EPP","modeling-package","cedric.brun","RESOLVED","FIXED","""About"" action in the top-level menu","2014-06-10 03:53:46"
491066,"EPP","modeling-package","cedric.brun","RESOLVED","FIXED","Inclusion of EMF Parsley into Modeling package","2016-05-18 03:32:18"
382264,"EPP","cpp-package","chris.guindon","RESOLVED","FIXED","The ""Eclipse IDE for C/C++ Developers"" builds are missing from the developer downloads page","2012-06-11 12:58:11"
409804,"EPP","website","chris.guindon","RESOLVED","FIXED","Eclipse Standard EPP package uses old icon on the website","2014-02-10 16:51:45"
348157,"EPP","java-package","clayberg","RESOLVED","FIXED","intrusive ""preview?"" dialog on startup, from WindowBuilder","2011-06-03 18:03:49"
231078,"EPP","jee-package","david_williams","RESOLVED","FIXED","JEE package update to Ganymede M7","2008-05-08 10:10:04"
233009,"EPP","jee-package","david_williams","RESOLVED","FIXED","JEE package configuration updates","2008-06-23 12:56:32"
235089,"EPP","jee-package","david_williams","RESOLVED","FIXED","Package is missing ""capabilities""","2009-06-19 11:03:44"
238280,"EPP","jee-package","david_williams","RESOLVED","FIXED","Missing DTP features in initial JEE 3.4 release","2008-09-15 23:07:54"
272947,"EPP","jee-package","david_williams","RESOLVED","FIXED","Addition of EclipseLink Galileo bundles to the Java EE package","2009-05-21 12:30:29"
276609,"EPP","jee-package","david_williams","RESOLVED","FIXED","jst and wst features should be expanded","2009-05-21 12:31:19"
277394,"EPP","jee-package","david_williams","RESOLVED","FIXED","remove pde from jee package or default ""on"" capabilties.","2010-04-12 02:18:23"
277863,"EPP","jee-package","david_williams","RESOLVED","FIXED","Missing Eclipse Icon under Linux","2009-06-08 06:46:35"
278274,"EPP","jee-package","david_williams","RESOLVED","FIXED","improved about box graphic","2009-06-05 02:26:47"
280786,"EPP","package content","david_williams","RESOLVED","FIXED","wrong Galileo p2 repo in all EPP packages (/staging instead of /galileo)","2009-06-19 12:04:24"
312527,"EPP","jee-package","david_williams","RESOLVED","FIXED","eclipse-jee-helios-M7-win32 doesn't include the JAX-WS tool","2010-05-17 10:14:06"
357528,"EPP","Packager","david_williams","RESOLVED","FIXED","package build fails to sign","2011-09-13 21:50:39"
466203,"EPP","Packager","david_williams","RESOLVED","FIXED","JEE and Reporting need 'tcf.te' replaced with 'tm'","2015-05-06 16:10:11"
493473,"EPP","Packager","david_williams","RESOLVED","FIXED","react to change in staging location","2016-05-18 15:49:09"
494159,"EPP","Packager","david_williams","RESOLVED","FIXED","the EPP packages and SimRel jobs should have an automatic ""make visible"" job","2016-06-01 17:34:53"
446566,"EPP","committers-package","eclipse.sprigogin","RESOLVED","FIXED","Activate UI delay monitoring for EPP Committers","2014-11-12 15:27:13"
245129,"EPP","Dynamic Package Delivery","epp.dpd-inbox","RESOLVED","FIXED","EPP wizard displays wrong message on download page.","2009-03-13 09:57:52"
245212,"EPP","Dynamic Package Delivery","epp.dpd-inbox","RESOLVED","FIXED","Ability to specifiy standard/base IUs in EPP wizard configuration","2008-08-29 04:07:53"
245213,"EPP","Dynamic Package Delivery","epp.dpd-inbox","RESOLVED","WONTFIX","Collection of statistics in EPP Wizard","2012-06-05 09:38:24"
245214,"EPP","Dynamic Package Delivery","epp.dpd-inbox","RESOLVED","FIXED","Legal requirements/Terms of Service/Privacy Statement for EPP wizard","2008-10-07 11:26:28"
247613,"EPP","Dynamic Package Delivery","epp.dpd-inbox","RESOLVED","WONTFIX","Add feedback form to EPP Wizard","2012-06-05 09:40:13"
247660,"EPP","Dynamic Package Delivery","epp.dpd-inbox","RESOLVED","FIXED","Manual OS Selection in EPP Wizard","2009-03-13 09:59:46"
249393,"EPP","Dynamic Package Delivery","epp.dpd-inbox","RESOLVED","WONTFIX","Dynamic Package Delivery component (EPP Download Wizard)","2012-06-05 09:37:48"
259520,"EPP","Dynamic Package Delivery","epp.dpd-inbox","RESOLVED","WONTFIX","Need a way to easily identify what the user is running","2012-06-05 09:45:16"
268322,"EPP","Dynamic Package Delivery","epp.dpd-inbox","RESOLVED","FIXED","Please add a component category to the bugzilla: php-package","2009-05-27 06:35:09"
277290,"EPP","Packager","epp.dpd-inbox","RESOLVED","FIXED","Hudson integration for EPP package build","2010-05-29 04:40:07"
277293,"EPP","Packager","epp.dpd-inbox","RESOLVED","FIXED","Hudson integration for EPP repository build","2009-05-26 06:02:21"
279381,"EPP","Dynamic Package Delivery","epp.dpd-inbox","RESOLVED","FIXED","EPP Wizard updates for the Galileo Release","2009-06-18 14:09:17"
279650,"EPP","Dynamic Package Delivery","epp.dpd-inbox","RESOLVED","WONTFIX","[EPP Wizard] Operating System combo should be read-only","2012-06-05 09:43:07"
279651,"EPP","Dynamic Package Delivery","epp.dpd-inbox","RESOLVED","WONTFIX","[EPP Wizard] Expand icon too subtle","2012-06-05 09:44:12"
280701,"EPP","Dynamic Package Delivery","epp.dpd-inbox","RESOLVED","WONTFIX","[EPP Wizard] Fails to install and ends silently","2012-06-05 09:43:57"
282119,"EPP","Dynamic Package Delivery","epp.dpd-inbox","RESOLVED","WONTFIX","[EPP Wizard] Wrong description for mylyn","2012-06-05 09:42:22"
282813,"EPP","Dynamic Package Delivery","epp.dpd-inbox","RESOLVED","WONTFIX","[EPP Wizard] Branding Enhancement","2012-06-05 09:44:25"
282814,"EPP","Dynamic Package Delivery","epp.dpd-inbox","RESOLVED","WONTFIX","[EPP Wizard] New layout for the Download page of the EPP Wizard","2012-06-05 09:43:41"
282816,"EPP","Dynamic Package Delivery","epp.dpd-inbox","RESOLVED","WONTFIX","[EPP Wizard] No download possible with Internet Explorer 6 and older versions","2012-06-05 09:43:21"
282819,"EPP","Dynamic Package Delivery","epp.dpd-inbox","RESOLVED","WONTFIX","[EPP Wizard] Update for the external service providers of the EPP Wizard","2012-06-05 09:42:53"
282824,"EPP","Dynamic Package Delivery","epp.dpd-inbox","RESOLVED","WONTFIX","[EPP Wizard] Update for the metadata repository of the EPP Wizard","2012-06-05 09:42:35"
287975,"EPP","Dynamic Package Delivery","epp.dpd-inbox","RESOLVED","WONTFIX","EPP Wizard configuration friendlier to inclusion in a servlet container","2012-06-05 09:45:46"
177892,"EPP","Installer","epp.installer-inbox","RESOLVED","FIXED","use XP Theme on Windowns XP","2007-06-07 12:23:06"
177893,"EPP","Installer","epp.installer-inbox","RESOLVED","FIXED","delete temp files after install","2007-06-07 12:25:06"
177901,"EPP","Installer","epp.installer-inbox","RESOLVED","WONTFIX","alternate windows installer technology","2012-06-05 09:53:33"
183612,"EPP","Installer","epp.installer-inbox","RESOLVED","WONTFIX","Welcome screen should describe package content","2011-05-20 05:44:41"
191378,"EPP","package content","epp.installer-inbox","RESOLVED","FIXED","Packages should define a product","2010-05-20 04:08:44"
191381,"EPP","Installer","epp.installer-inbox","RESOLVED","FIXED","A ""package"" component","2007-06-07 05:47:57"
194959,"EPP","package content","epp.installer-inbox","RESOLVED","FIXED","Pieces missing from Eclipse IDE for Java EE Developers distribution","2008-01-02 10:32:30"
204288,"EPP","Packager","epp.installer-inbox","RESOLVED","FIXED","ConfigurationParser should accept relative paths","2008-02-19 05:22:32"
242385,"EPP","Installer","epp.installer-inbox","RESOLVED","WONTFIX","org.eclipse.epp.wizard.installerbuilder Web Start installer fails with error:  JAR resources in JNLP file are not signed by same certificate","2012-06-05 09:49:49"
253310,"EPP","Installer","epp.installer-inbox","RESOLVED","INVALID","Confirm Intent","2008-11-03 17:25:24"
277518,"EPP","Installer","epp.installer-inbox","RESOLVED","FIXED","EPP Update Manager cannot Install New Software","2009-06-04 12:12:56"
290481,"EPP","Installer","epp.installer-inbox","RESOLVED","WONTFIX","Pathname too long","2012-06-05 09:49:30"
518859,"EPP","Installer","epp.installer-inbox","RESOLVED","WORKSFORME","ERROR: org.eclipse.equinox.p2.metadata.repository code=1002","2019-07-23 23:01:17"
168439,"EPP","package content","epp.packager-inbox","RESOLVED","WONTFIX","Hardware requirements hard (impossible?) to find","2017-04-10 10:22:33"
187568,"EPP","package content","epp.packager-inbox","RESOLVED","FIXED","Initially display the Java perspective","2007-06-28 13:50:30"
187583,"EPP","package content","epp.packager-inbox","RESOLVED","FIXED","XML Editing doesn't work in Eclipse Tools for Java Development","2007-06-14 10:38:13"
191154,"EPP","package content","epp.packager-inbox","RESOLVED","FIXED","[preferences] Change Defaults (Print Margin and Line Numbers)","2013-12-11 04:46:50"
191449,"EPP","package content","epp.packager-inbox","RESOLVED","FIXED","Package filenames","2007-06-28 14:26:42"
191563,"EPP","package content","epp.packager-inbox","RESOLVED","FIXED","Eclipse Tools for Java Enterprise Development needs more memory","2007-06-28 05:13:39"
191812,"EPP","Packager","epp.packager-inbox","RESOLVED","FIXED","create a product export definition for the packager application","2007-09-27 18:07:56"
191813,"EPP","Packager","epp.packager-inbox","RESOLVED","FIXED","documentation: create a how-to build packages document","2008-04-02 16:39:43"
191816,"EPP","Packager","epp.packager-inbox","RESOLVED","FIXED","reminder: check inclusion of eclipsec.exe","2007-06-28 14:23:43"
195647,"EPP","package content","epp.packager-inbox","RESOLVED","DUPLICATE","Include Error Log in 'Eclipse IDE...' packages","2008-04-03 14:31:19"
198600,"EPP","package content","epp.packager-inbox","RESOLVED","DUPLICATE","New and Noteworthy link for WTP points nowhere","2007-08-16 16:03:35"
204980,"EPP","package content","epp.packager-inbox","RESOLVED","FIXED","Java requirements on the download page","2013-12-18 09:01:40"
212169,"EPP","Usage Data Collector","epp.packager-inbox","RESOLVED","FIXED","Usage Data Collector contribution","2008-07-15 15:11:15"
216452,"EPP","package content","epp.packager-inbox","RESOLVED","INVALID","Multiple Versions of Plugins","2008-01-25 14:13:39"
216851,"EPP","package content","epp.packager-inbox","RESOLVED","FIXED","Web site description of package contents mention Mylar instead of Mylyn","2008-01-28 22:09:28"
217716,"EPP","package content","epp.packager-inbox","RESOLVED","FIXED","Need to (re) define JEE Content","2008-06-24 17:57:23"
217784,"EPP","package content","epp.packager-inbox","RESOLVED","FIXED","Modeling package","2009-05-19 10:30:23"
217791,"EPP","package content","epp.packager-inbox","RESOLVED","FIXED","propose a package: Eclipse IDE for Java and Report Developers","2009-05-19 14:12:57"
219093,"EPP","package content","epp.packager-inbox","RESOLVED","FIXED","org.eclipse.gmf.sdk depends on org.eclipse.sdk feature","2008-05-14 03:41:24"
220272,"EPP","package content","epp.packager-inbox","RESOLVED","FIXED","Publish package contents/versions in EPP download page","2008-04-12 12:43:55"
225954,"EPP","package content","epp.packager-inbox","RESOLVED","FIXED","eppconfig.xsd contains errors","2008-04-08 16:07:38"
227711,"EPP","jee-package","epp.packager-inbox","RESOLVED","DUPLICATE","missing program icon","2008-04-18 05:34:02"
227870,"EPP","jee-package","epp.packager-inbox","RESOLVED","DUPLICATE","icu4j jar packaged in the JavaEE install is different from the M6/M6a","2008-04-19 00:03:25"
229017,"EPP","Packager","epp.packager-inbox","RESOLVED","FIXED","Milestone link on epp website broken","2008-04-28 10:46:16"
231974,"EPP","jee-package","epp.packager-inbox","RESOLVED","FIXED","Ganymede M7 first startup takes several minuts and bundled plugins are not detected","2008-05-18 22:37:02"
231979,"EPP","rcp-package","epp.packager-inbox","RESOLVED","DUPLICATE","Ganymede M7 RCP IDE package fails with ""No application id has been found"" error on clean install","2008-05-14 08:41:11"
232101,"EPP","modeling-package","epp.packager-inbox","RESOLVED","DUPLICATE","Eclipse only loads a basic workbench","2008-05-14 12:02:58"
232124,"EPP","rcp-package","epp.packager-inbox","RESOLVED","FIXED","M7 packages fail to start if 'eclipse' directory has been renamed before first start","2008-05-29 04:44:07"
232269,"EPP","jee-package","epp.packager-inbox","RESOLVED","WONTFIX","Pre-installed packages are not installed. And cannot be either","2009-05-15 02:30:53"
233101,"EPP","modeling-package","epp.packager-inbox","RESOLVED","FIXED","windows xp m7 packages missing functionality","2008-05-29 04:43:33"
233140,"EPP","rcp-package","epp.packager-inbox","RESOLVED","DUPLICATE","3.3M7 Fails to Start","2008-05-21 14:08:50"
233195,"EPP","rcp-package","epp.packager-inbox","RESOLVED","DUPLICATE","Fails to get beyond splash screen after installing","2008-05-21 07:53:56"
234533,"EPP","jee-package","epp.packager-inbox","RESOLVED","FIXED","added forgotten feature, EclipseLink Support to JEE","2008-05-29 03:19:44"
234881,"EPP","package content","epp.packager-inbox","RESOLVED","WONTFIX","Need an Everything package","2008-06-02 04:53:14"
235039,"EPP","package content","epp.packager-inbox","RESOLVED","FIXED","EPP Packages should provide capabilities","2009-06-19 00:29:39"
235338,"EPP","jee-package","epp.packager-inbox","RESOLVED","NOT_ECLIPSE","Weird Small Window","2008-06-05 07:08:37"
237058,"EPP","modeling-package","epp.packager-inbox","RESOLVED","DUPLICATE","filename too long","2008-06-13 14:47:00"
237423,"EPP","jee-package","epp.packager-inbox","RESOLVED","WORKSFORME","64 bit package opens to Java Perspective","2008-06-17 02:30:12"
237424,"EPP","jee-package","epp.packager-inbox","RESOLVED","FIXED","datatools doc error in JEE package","2008-09-26 18:28:38"
237652,"EPP","jee-package","epp.packager-inbox","RESOLVED","DUPLICATE","Crashes on startup","2008-09-26 19:13:03"
238193,"EPP","modeling-package","epp.packager-inbox","RESOLVED","WONTFIX","include Mylyn source in modeling package","2008-06-24 15:27:35"
238201,"EPP","cpp-package","epp.packager-inbox","RESOLVED","INVALID","sometimes can't start package on Linux 32","2008-06-24 02:35:42"
239171,"EPP","modeling-package","epp.packager-inbox","RESOLVED","WONTFIX","Missing AIX package","2008-08-15 00:06:03"
239275,"EPP","jee-package","epp.packager-inbox","RESOLVED","DUPLICATE","packages should enable all their primary update sites (by default)","2008-09-25 08:30:51"
239332,"EPP","Packager","epp.packager-inbox","RESOLVED","FIXED","Convert EPP ip log to automated ip log","2009-06-03 05:58:43"
239412,"EPP","rcp-package","epp.packager-inbox","RESOLVED","WONTFIX","Include EMF plugins in RCP download package","2009-05-19 15:20:45"
239611,"EPP","Packager","epp.packager-inbox","RESOLVED","FIXED","Build proper p2 enabled packages","2009-05-12 08:56:07"
240141,"EPP","modeling-package","epp.packager-inbox","RESOLVED","FIXED","Create practitioners package for modeling","2008-11-10 18:56:40"
240632,"EPP","modeling-package","epp.packager-inbox","RESOLVED","FIXED","Gratuitously long file names","2009-08-12 07:43:22"
241596,"EPP","jee-package","epp.packager-inbox","RESOLVED","WONTFIX","Equinox p2 installer failed to install eclipse-java-ganymede-win32.zip","2009-05-15 02:09:43"
241652,"EPP","rcp-package","epp.packager-inbox","RESOLVED","WORKSFORME","Cannot install features from Mylyn Extras update site","2008-09-26 14:11:30"
242191,"EPP","jee-package","epp.packager-inbox","RESOLVED","INVALID","Ganymede JEE Package dist for MacOSX has old ""Software Updates"" component","2008-09-26 19:27:09"
246466,"EPP","java-package","epp.packager-inbox","RESOLVED","DUPLICATE","Missing/extra update sites when installing in either C:\program file or C:\","2008-09-24 14:29:10"
247389,"EPP","jee-package","epp.packager-inbox","RESOLVED","FIXED","Why are not all JEE Project upate sites enabled?","2009-06-19 00:06:17"
247423,"EPP","reporting-package","epp.packager-inbox","RESOLVED","FIXED","[Smoke] [epp]report can not be preview using reporting package 20080915-0610 build","2008-09-26 04:26:06"
248051,"EPP","jee-package","epp.packager-inbox","RESOLVED","WORKSFORME","Perspective Tab","2009-02-25 10:36:01"
248494,"EPP","jee-package","epp.packager-inbox","RESOLVED","WONTFIX","IDE for Java EE Developers won't start on 64-bit Vista","2009-12-04 09:12:54"
248976,"EPP","java-package","epp.packager-inbox","RESOLVED","INVALID","""IDE for Java Developers"" package is too restrictive by specifying Java 1.5 as required","2008-09-30 15:29:08"
249885,"EPP","jee-package","epp.packager-inbox","RESOLVED","WONTFIX","Package fails after update because there is no metadata for the launcher.library","2010-02-06 02:57:44"
250368,"EPP","cpp-package","epp.packager-inbox","RESOLVED","WONTFIX","the Format is wrong","2008-10-22 07:23:18"
250523,"EPP","jee-package","epp.packager-inbox","RESOLVED","WORKSFORME","Ganymede hangs when clicking View Error Log","2009-05-15 02:01:46"
251315,"EPP","cpp-package","epp.packager-inbox","RESOLVED","INVALID","Eclipse C++ Error  /mingw/lib/libmingw32.a(main.o):main.c: undefined reference to `WinMain@16'","2009-06-10 09:12:38"
254783,"EPP","Packager","epp.packager-inbox","RESOLVED","FIXED","Add a BPMN modeler package","2008-11-11 04:36:04"
257684,"EPP","modeling-package","epp.packager-inbox","RESOLVED","INVALID","Mouse cursor does not change for horizontal (move:up/down) panel divider resize.","2009-06-24 17:09:55"
258581,"EPP","jee-package","epp.packager-inbox","RESOLVED","FIXED","X86_64 release can not be unzip & untar with X86_64 linux","2009-03-10 09:06:49"
259686,"EPP","jee-package","epp.packager-inbox","RESOLVED","WONTFIX","Automatic updates fail.","2009-05-15 02:34:36"
259813,"EPP","jee-package","epp.packager-inbox","RESOLVED","WONTFIX","Default Eclipse distro cannot upgrade","2009-05-15 02:06:49"
260616,"EPP","jee-package","epp.packager-inbox","RESOLVED","WONTFIX","PROBLEM with Eclipse Ganymede  UPDATE","2010-06-10 01:13:54"
261138,"EPP","cpp-package","epp.packager-inbox","RESOLVED","WONTFIX","Installation of XML editor fails on eclipse linux 64 Bit c++ edition","2010-01-31 09:04:24"
264465,"EPP","jee-package","epp.packager-inbox","RESOLVED","WORKSFORME","org.eclipse.pde.p2 feature should be in eclipse-jee-ganymede","2009-05-15 01:49:57"
269915,"EPP","jee-package","epp.packager-inbox","RESOLVED","FIXED","New&Noteworthy for DSDP-TM missing on JEE EPP Ganymede SR2 page","2009-08-12 07:50:47"
270227,"EPP","package content","epp.packager-inbox","RESOLVED","WONTFIX","CDT epp package bundles.info doesn't contain org.eclipse.cdt.* plugins => confuses PDE API baseline","2009-05-28 08:20:04"
271285,"EPP","Packager","epp.packager-inbox","RESOLVED","WONTFIX","Distribute the packager as an installable plug-in on an update site","2009-05-12 09:01:51"
271286,"EPP","Packager","epp.packager-inbox","RESOLVED","WONTFIX","Introspect feature.xml files to add update-sites whan necessery","2011-11-14 10:45:57"
271748,"EPP","jee-package","epp.packager-inbox","RESOLVED","FIXED","There is no xsd and xsd.edit feature in the jee Galileo M6 package","2009-05-15 01:44:40"
