"Bug ID","Product","Component","Assignee","Status","Resolution","Summary","Changed"
462691,"EPP","Packager","epp.packager-inbox","RESOLVED","FIXED","Prevent (automatic) update to new Mac layout","2015-05-16 00:52:28"
464242,"EPP","modeling-package","epp.packager-inbox","RESOLVED","FIXED","Add e4 tools to the Modeling Package","2015-05-06 12:49:10"
466206,"EPP","Packager","epp.packager-inbox","RESOLVED","FIXED","Change level of maven required for EPP builds","2015-05-07 04:18:22"
468598,"EPP","java-package","epp.packager-inbox","RESOLVED","FIXED","Mars RC1 Mac packages are damaged","2015-06-01 11:50:26"
469665,"EPP","jee-package","epp.packager-inbox","RESOLVED","INVALID","erro oracle pack","2019-03-19 10:17:09"
470906,"EPP","php-package","epp.packager-inbox","RESOLVED","FIXED","Mars package haven't mirrors","2015-07-25 05:40:07"
477914,"EPP","jee-package","epp.packager-inbox","RESOLVED","NOT_ECLIPSE","Mars can't connect to Websphere v 8.5.x","2015-09-21 10:21:06"
478181,"EPP","jee-package","epp.packager-inbox","RESOLVED","FIXED","Include Buildship as part of JavaEE Package","2017-03-01 15:19:40"
478463,"EPP","cpp-package","epp.packager-inbox","RESOLVED","WONTFIX","Add multi-core visualizer and hardware debugging features","2015-10-19 13:34:16"
480145,"EPP","scout-package","epp.packager-inbox","RESOLVED","FIXED","Scout package should include the XML editor","2016-05-10 09:52:54"
480536,"EPP","cpp-package","epp.packager-inbox","RESOLVED","WORKSFORME","Eclipse IDE for C++ fails to launch. Cannot find shared libraries.","2017-01-30 10:30:07"
481475,"EPP","java-package","epp.packager-inbox","RESOLVED","INVALID","Scroll lock button being disabled","2016-01-13 05:08:56"
482600,"EPP","dsl-package","epp.packager-inbox","RESOLVED","FIXED","Maven Console broken in Eclipse for DSL Developers","2015-12-02 08:09:49"
483374,"EPP","scout-package","epp.packager-inbox","RESOLVED","FIXED","Scout Package should not start with the Resource Perspective","2016-05-10 09:52:01"
484765,"EPP","package content","epp.packager-inbox","RESOLVED","FIXED","splash screen should show release month/year","2017-05-10 11:32:00"
485310,"EPP","Packager","epp.packager-inbox","RESOLVED","FIXED","Add (disabled) reference to ""latest"" repository","2017-07-25 18:44:02"
485788,"EPP","jee-package","epp.packager-inbox","RESOLVED","FIXED","Include Eclipse Tools for Cloud Foundry (CFT) as part of the JEE Package","2020-02-25 16:58:09"
486388,"EPP","package content","epp.packager-inbox","RESOLVED","WORKSFORME","Configure Neon Linux packages to use GTK2 by default","2016-01-27 15:04:40"
487215,"EPP","automotive-package","epp.packager-inbox","RESOLVED","FIXED","Unable to build Automotive Mars.2 RC2 package: org.eclipse.xtext.ui.junit missing","2016-02-05 17:02:05"
487397,"EPP","jee-package","epp.packager-inbox","RESOLVED","WONTFIX","Chrome V8 debugger is crashing on console output","2016-04-19 12:58:39"
487722,"EPP","java-package","epp.packager-inbox","RESOLVED","FIXED","Dead link for ""Remote Help"": Topic not found","2020-06-03 07:25:01"
487835,"EPP","committers-package","epp.packager-inbox","RESOLVED","FIXED","Add News feed plugin to committers package","2016-03-21 09:57:17"
488781,"EPP","javascript-package","epp.packager-inbox","RESOLVED","FIXED","Revive ""JavaScript and Web developers"" package","2016-03-31 04:00:47"
490046,"EPP","cpp-package","epp.packager-inbox","RESOLVED","FIXED","[Welcome] Adopt Solstice theme for CPP package","2016-05-15 22:27:52"
490260,"EPP","modeling-package","epp.packager-inbox","RESOLVED","FIXED","[Welcome] Adopt Solstice theme for Modeling Package","2016-05-17 03:24:00"
490614,"EPP","scout-package","epp.packager-inbox","RESOLVED","FIXED","[Welcome] Adopt Solstice theme for Scout package","2016-05-24 03:36:32"
490754,"EPP","package content","epp.packager-inbox","RESOLVED","FIXED","Adopt editor discovery","2017-12-15 04:50:13"
492163,"EPP","java-package","epp.packager-inbox","RESOLVED","WORKSFORME","Add Maven to java package","2017-01-17 05:20:23"
492876,"EPP","php-package","epp.packager-inbox","RESOLVED","FIXED","Make the Lucene indexer default for the PHP EPP","2016-05-05 17:04:36"
492936,"EPP","php-package","epp.packager-inbox","RESOLVED","FIXED","Add Smart Import feature to PHP EPP","2016-05-05 17:04:11"
493190,"EPP","package content","epp.packager-inbox","RESOLVED","NOT_ECLIPSE","Brightscript export error","2018-05-09 01:29:44"
493509,"EPP","committers-package","epp.packager-inbox","RESOLVED","WONTFIX","Disable MPC strategy for unassociated editors for Neon","2016-05-18 10:51:07"
493596,"EPP","jee-package","epp.packager-inbox","RESOLVED","FIXED","[Welcome] Adopt Solstice theme for JEE package","2019-10-18 12:16:46"
493646,"EPP","dsl-package","epp.packager-inbox","RESOLVED","FIXED","[Welcome] Adopt Solstice theme for DSL package","2016-05-17 03:15:50"
493735,"EPP","php-package","epp.packager-inbox","RESOLVED","FIXED","Add link to PHP Executables to PHP package Welcome screen","2016-05-28 07:57:53"
493861,"EPP","cpp-package","epp.packager-inbox","RESOLVED","WORKSFORME","Never ever run in Dell Inspiron","2017-01-30 10:28:15"
494586,"EPP","jee-package","epp.packager-inbox","RESOLVED","FIXED","Update New JEE Welcome Quicklinks to create JavaEE Web project and JSDT Project","2020-05-16 00:12:00"
496365,"EPP","jee-package","epp.packager-inbox","RESOLVED","WORKSFORME","Not able to download set up eclipse jee juno SR1","2018-05-22 15:12:25"
497296,"EPP","php-package","epp.packager-inbox","RESOLVED","FIXED","Add 'Capabilities' preference page","2017-03-22 09:05:58"
499406,"EPP","package content","epp.packager-inbox","RESOLVED","WONTFIX","Teiid Designer Package","2016-08-09 15:46:43"
500188,"EPP","jee-package","epp.packager-inbox","RESOLVED","WORKSFORME","Virtual Machine Issue","2018-09-20 16:16:29"
502195,"EPP","Releng","epp.packager-inbox","RESOLVED","FIXED","create ""makeVisible"" script in EPP repository","2016-09-26 16:44:06"
502203,"EPP","javascript-package","epp.packager-inbox","RESOLVED","FIXED","JS package should mention Cordova/hybrid mobile development","2016-11-07 09:56:28"
502432,"EPP","Releng","epp.packager-inbox","RESOLVED","WORKSFORME","bugs in EPP ""makevisible"" script","2016-12-16 13:04:53"
503321,"EPP","jee-package","epp.packager-inbox","RESOLVED","NOT_ECLIPSE","Update does not work","2016-10-04 12:32:10"
506244,"EPP","cpp-package","epp.packager-inbox","RESOLVED","FIXED","Include a runtime (OpenJDK 11+) in some EPPs","2020-08-10 21:54:55"
507509,"EPP","jee-package","epp.packager-inbox","RESOLVED","WORKSFORME","Adding new CFT feature to JEE package for Neon.2 and Oxygen","2020-04-20 18:20:20"
509799,"EPP","java-package","epp.packager-inbox","RESOLVED","FIXED","Symantec reports a Trojan SONAR.AM.C!g24 in eclipse","2020-10-02 11:53:29"
510435,"EPP","rcp-package","epp.packager-inbox","RESOLVED","WONTFIX","Add CSS editor from WTP to RCP / RAP package","2019-05-08 08:39:41"
510460,"EPP","package content","epp.packager-inbox","RESOLVED","FIXED","EPP should use dedicated splash (not reuse Platform one)","2017-03-16 14:47:33"
511467,"EPP","php-package","epp.packager-inbox","RESOLVED","FIXED","Add Composer Support feature to PHP EPP","2017-02-01 11:41:36"
512009,"EPP","jee-package","epp.packager-inbox","RESOLVED","WONTFIX","Add angularJS tools","2019-08-29 09:32:40"
512010,"EPP","javascript-package","epp.packager-inbox","RESOLVED","FIXED","Add angularJS tools","2019-11-21 02:45:19"
512887,"EPP","php-package","epp.packager-inbox","RESOLVED","FIXED","Invert Terminal colors in PHP package","2017-03-02 10:36:20"
513809,"EPP","java-package","epp.packager-inbox","RESOLVED","FIXED","[wiring] HttpComponents wiring issue","2020-06-03 07:29:49"
513864,"EPP","jee-package","epp.packager-inbox","RESOLVED","INVALID","Something wrong with Eclipse Neon.2 (4.6.2)  when it uses in  fedora ( dell xps 15 HD 3840x2160 )","2020-04-20 18:47:03"
514183,"EPP","Releng","epp.packager-inbox","RESOLVED","FIXED","Create Bugzilla milestones for 4.7.0M7, 4.7.0R1, etc.","2017-03-27 03:05:55"
514206,"EPP","jee-package","epp.packager-inbox","RESOLVED","FIXED","Include EclEmma in JavaEE package","2017-05-12 15:44:45"
514502,"EPP","Packager","epp.packager-inbox","RESOLVED","FIXED","Make default workspace name be ""eclipse-workspace""","2017-05-03 07:56:57"
516845,"EPP","php-package","epp.packager-inbox","RESOLVED","FIXED","JavaScript autocompletion not possible","2020-05-19 13:20:32"
516858,"EPP","php-package","epp.packager-inbox","RESOLVED","FIXED","Add PHPUnit and Profiler features in PHP EPP","2017-05-19 05:34:21"
517658,"EPP","java-package","epp.packager-inbox","RESOLVED","NOT_ECLIPSE","Unexpected runtime error while computing a text hover","2020-06-03 07:20:55"
519160,"EPP","php-package","epp.packager-inbox","RESOLVED","FIXED","Add PDT update site to PHP EPP package","2017-08-24 08:45:41"
520285,"EPP","cpp-package","epp.packager-inbox","RESOLVED","WORKSFORME","lots of errors","2017-07-27 20:05:20"
520600,"EPP","jee-package","epp.packager-inbox","RESOLVED","WORKSFORME","Exit 13","2019-08-29 09:23:21"
521348,"EPP","php-package","epp.packager-inbox","RESOLVED","FIXED","Add Synchronized PHP Projects feature to PHP EPP","2017-08-31 11:39:19"
521587,"EPP","php-package","epp.packager-inbox","RESOLVED","FIXED","Override file filtering prefs for Synchronized Projects","2017-08-31 11:38:39"
522677,"EPP","committers-package","epp.packager-inbox","RESOLVED","WORKSFORME","Eclipse fails to run on OSX with java 9","2017-09-23 12:41:55"
526611,"EPP","java-package","epp.packager-inbox","RESOLVED","FIXED","win64 version missing","2020-06-03 07:16:49"
527795,"EPP","Packager","epp.packager-inbox","RESOLVED","FIXED","Drop 32-bits EPP package","2020-03-25 15:40:35"
527832,"EPP","modeling-package","epp.packager-inbox","RESOLVED","FIXED","Modeling updates link unaccessible: could not find http://www.eclipse.org/modeling/amalgam/downloads/package/modeling/oxygen/","2017-11-28 10:39:49"
528755,"EPP","javascript-package","epp.packager-inbox","RESOLVED","WORKSFORME","not show Task icon with //TODO comment in javascript source","2019-06-24 08:53:23"
386686,"EPP","java-package","ericc","RESOLVED","FIXED","the Mobile package should include the Mylyn Bugzilla connector","2012-08-23 16:27:17"
463377,"EPP","Automated Error Reporting Client (AERI)","error-reports-inbox","RESOLVED","FIXED","Set logging component's default assignee to error-reports-inbox@eclipse.org","2015-03-30 03:06:44"
468881,"EPP","Automated Error Reporting Client (AERI)","error-reports-inbox","RESOLVED","FIXED","The AERI ""Visit Submission"" link in the pop-up fails with an exception when no Web Browser is installed","2015-06-05 06:13:03"
471778,"EPP","Automated Error Reporting Client (AERI)","error-reports-inbox","RESOLVED","FIXED","[client] Problems index downloaded even if Error Reporting disabled","2016-11-01 06:26:51"
477595,"EPP","Automated Error Reporting Client (AERI)","error-reports-inbox","RESOLVED","WORKSFORME","Bugzilla product not selected by default when creating bug report","2015-09-16 23:58:04"
487019,"EPP","Automated Error Reporting Client (AERI)","error-reports-inbox","RESOLVED","FIXED","Review Dialog preference link should not grab vertical space","2016-02-03 04:00:51"
487021,"EPP","Automated Error Reporting Client (AERI)","error-reports-inbox","RESOLVED","FIXED","Create personal information group","2016-02-03 04:00:31"
487071,"EPP","Automated Error Reporting Client (AERI)","error-reports-inbox","RESOLVED","WORKSFORME","Contact information text box message not visible on Windows 10","2016-02-03 09:30:50"
487122,"EPP","Automated Error Reporting Client (AERI)","error-reports-inbox","RESOLVED","INVALID","Project appearing twice in the Servers option page","2016-02-03 10:21:10"
487402,"EPP","Automated Error Reporting Client (AERI)","error-reports-inbox","RESOLVED","WONTFIX","internal error occurred during ""sending error log entry to ...""","2016-02-07 07:03:34"
497851,"EPP","Automated Error Reporting Client (AERI)","error-reports-inbox","RESOLVED","WORKSFORME","Oomph installer results in not working setup","2020-06-24 08:06:55"
499348,"EPP","Automated Error Reporting Client (AERI)","error-reports-inbox","RESOLVED","DUPLICATE","NullPointerException in OCLConsolePage$EcoreOCLFactory.createOCL","2016-08-08 08:36:22"
500269,"EPP","Automated Error Reporting Client (AERI)","error-reports-inbox","RESOLVED","FIXED","Updating the index from remote failed.","2016-09-14 03:54:04"
500271,"EPP","Automated Error Reporting Client (AERI)","error-reports-inbox","RESOLVED","FIXED","Failed to determine ETAG for remote problems database.","2016-09-14 03:54:56"
500717,"EPP","Automated Error Reporting Client (AERI)","error-reports-inbox","RESOLVED","FIXED","[ui] Open edit dialog when activating editable needinfo processors","2016-09-14 03:31:32"
507305,"EPP","Automated Error Reporting Client (AERI)","error-reports-inbox","RESOLVED","FIXED","Empty or invalid zip unpacked as problem index","2016-11-16 04:46:14"
507307,"EPP","Automated Error Reporting Client (AERI)","error-reports-inbox","RESOLVED","FIXED","[client] Cancel problems database download probably broken","2016-11-16 02:45:57"
513549,"EPP","Automated Error Reporting Client (AERI)","error-reports-inbox","RESOLVED","FIXED","email hyperlinks now go to home page","2017-04-03 05:32:46"
519813,"EPP","Automated Error Reporting Client (AERI)","error-reports-inbox","RESOLVED","FIXED","IllegalArgumentException in ProblemStatusDialog.createTitle","2017-07-28 09:49:44"
521657,"EPP","Automated Error Reporting Client (AERI)","error-reports-inbox","RESOLVED","FIXED","[client] ClassNotFoundException if contributing clients don't have dependency on AERI","2017-09-05 05:51:50"
527647,"EPP","Automated Error Reporting Client (AERI)","error-reports-inbox","RESOLVED","INVALID","eclipse bug wizard doesn't allow ""eclipse""","2017-11-24 03:52:49"
408958,"EPP","committers-package","gunnar","RESOLVED","WONTFIX","Standard: Cosmetic: The progress bar in the splash is thicker in Standard/SDK than in a Runtime Eclipse","2014-04-29 12:14:36"
410722,"EPP","committers-package","gunnar","RESOLVED","FIXED","Changes to the Standard package description","2014-04-29 15:46:50"
432716,"EPP","java-package","gunnar","RESOLVED","FIXED","Consider org.eclipse.recommenders.mylyn.rcp.feature for inclusion into Java package","2015-02-16 07:44:00"
433769,"EPP","committers-package","gunnar","RESOLVED","FIXED","Add Mylyn with Bugzilla connector and Gerrit+Hudson integration to committers package","2015-04-01 10:43:55"
434131,"EPP","committers-package","gunnar","RESOLVED","WONTFIX","Add M2E to Eclipse for Committers package","2016-02-04 11:39:36"
434132,"EPP","committers-package","gunnar","RESOLVED","FIXED","Add Recommenders to Standard package","2015-03-18 15:26:09"
435861,"EPP","committers-package","gunnar","RESOLVED","FIXED","Future of the Standard package","2014-09-04 06:55:39"
441957,"EPP","committers-package","gunnar","RESOLVED","FIXED","Rename ""Standard Package"" to ""Eclipse IDE for Eclipse Committers""","2014-10-21 02:00:21"
444322,"EPP","committers-package","gunnar","RESOLVED","FIXED","Add Error Reporting to EPP Committers","2014-09-18 05:56:13"
494654,"EPP","committers-package","gunnar","RESOLVED","FIXED","Consider including m2e in Eclipse IDE for Eclipse Committers","2017-01-18 11:53:52"
463993,"EPP","Automated Error Reporting Client (AERI)","haftsteind","RESOLVED","FIXED","Progress view entries not removed when complete","2015-05-13 02:10:47"
497223,"EPP","Automated Error Reporting Client (AERI)","haftsteind","RESOLVED","FIXED","IllegalStateException in NewEventNotification.getActions","2016-11-16 02:50:05"
501635,"EPP","Automated Error Reporting Client (AERI)","haftsteind","RESOLVED","FIXED","[client] Provide description of notifications","2016-11-16 02:55:49"
507041,"EPP","Automated Error Reporting Client (AERI)","haftsteind","RESOLVED","FIXED","Freeze in PlatformDetailsSectionProcessor.canContribute","2016-11-16 04:02:11"
507300,"EPP","Automated Error Reporting Client (AERI)","haftsteind","RESOLVED","FIXED","EOFException when downloading problems database","2016-11-16 04:45:24"
340312,"EPP","java-package","igor","RESOLVED","FIXED","Indigo Java package logs lots of output","2011-06-07 09:43:51"
349029,"EPP","Dynamic Package Delivery","igor","RESOLVED","FIXED","fix provider name for o.e.m2e.logback.appender","2011-06-28 23:39:48"
205379,"EPP","Installer","ilya.seleznev","RESOLVED","FIXED","Pause in -debug on installer.exe needs to be before the eclipse cleans up.","2007-10-04 06:00:06"
433827,"EPP","php-package","jacek.pospychala","RESOLVED","FIXED","PDT Mylyn integeration is not available","2015-03-07 09:01:23"
227351,"EPP","jee-package","jcayne","RESOLVED","WONTFIX","Need to filter out TPTP features from Mac. distributions.","2008-04-24 10:08:11"
460560,"EPP","committers-package","jhelming","RESOLVED","FIXED","Add E4 tools to committers package","2015-07-16 03:16:10"
457821,"EPP","Automated Error Reporting Client (AERI)","johannes.dorn","RESOLVED","FIXED","Wizard banner image is missing transparency","2015-03-06 14:46:48"
497216,"EPP","Automated Error Reporting Client (AERI)","johannes.dorn","RESOLVED","FIXED","Projects at Fault UI not fit for purpose","2016-11-28 02:43:38"
501913,"EPP","Automated Error Reporting Client (AERI)","johannes.dorn","RESOLVED","FIXED","[ui] Clean up icons folder","2016-09-21 11:46:42"
502063,"EPP","Automated Error Reporting Client (AERI)","johannes.dorn","RESOLVED","FIXED","[ui][hidpi] Provide HiDPI icons for review dialog","2016-09-26 10:34:15"
512416,"EPP","Automated Error Reporting Client (AERI)","johannes.dorn","RESOLVED","FIXED","Spurious/inadequate failed to create Bugzilla handling","2017-02-27 05:21:49"
514996,"EPP","Automated Error Reporting Client (AERI)","johannes.dorn","RESOLVED","FIXED","[server] [charts] Sort status, severity etc. by sort key","2017-04-18 07:23:02"
515357,"EPP","Automated Error Reporting Client (AERI)","johannes.dorn","RESOLVED","FIXED","Wrong Automated Project Assignments","2017-04-20 08:32:33"
518037,"EPP","Automated Error Reporting Client (AERI)","johannes.dorn","RESOLVED","FIXED","mixed content (https loads from http) on https://dev.eclipse.org/recommenders/community/aeri/","2017-06-19 04:00:41"
236647,"EPP","reporting-package","lzhu","RESOLVED","INVALID","Cannot get Ganymede RC3 going right- Data explorer","2008-06-20 01:21:05"
490552,"EPP","cpp-package","malaperle","RESOLVED","FIXED","Some features are not at the top-level in the new layout","2016-04-02 10:51:17"
514212,"EPP","committers-package","mandrikov","RESOLVED","FIXED","Include EclEmma in Eclipse Committers Package","2017-05-25 17:02:26"
445615,"EPP","Automated Error Reporting Client (AERI)","marcel.bruch","RESOLVED","FIXED","Literal comment included in feature copyright","2015-04-20 12:31:17"
518965,"EPP","Releng","mistria","RESOLVED","FIXED","Skip assemble-repository step","2019-03-08 11:13:38"
528429,"EPP","java-package","mistria","RESOLVED","FIXED","m2e to download sources by default","2018-03-02 15:30:51"
528430,"EPP","jee-package","mistria","RESOLVED","FIXED","m2e to download sources by default","2018-03-02 15:30:36"
177900,"EPP","Installer","mknauer","RESOLVED","FIXED","fix installer wizard icon  (lower left)","2007-05-15 22:02:24"
183611,"EPP","package content","mknauer","RESOLVED","FIXED","Naming of the packages","2007-06-28 14:25:28"
218821,"EPP","Usage Data Collector","mknauer","RESOLVED","WONTFIX","create update manager policy file to enable test from the update site","2012-06-05 11:03:40"
219096,"EPP","Packager","mknauer","RESOLVED","FIXED","pull package configuration data from different CVS repository locations in the nightly build","2008-04-03 14:42:16"
219402,"EPP","Packager","mknauer","RESOLVED","WONTFIX","Automatically include the EPP UDC feature in the builds","2009-05-12 08:53:00"
219403,"EPP","Packager","mknauer","RESOLVED","WONTFIX","Create schema definition for EPP configuration file format","2009-05-12 08:54:42"
226705,"EPP","Usage Data Collector","mknauer","RESOLVED","FIXED","update UDC version from 0.5 to 1.0","2008-04-11 12:04:54"
230318,"EPP","cpp-package","mknauer","RESOLVED","FIXED","Add Mylyn support to C/C++ IDE","2008-05-14 03:15:06"
232033,"EPP","Packager","mknauer","RESOLVED","FIXED","do not create extra package config files in the release script","2009-05-19 09:33:00"
236893,"EPP","Usage Data Collector","mknauer","RESOLVED","FIXED","map files update to new Orbit R-build","2008-06-12 11:14:51"
237437,"EPP","Usage Data Collector","mknauer","RESOLVED","FIXED","use latest Orbit R-build to avoid bundle duplicates","2008-07-15 15:01:40"
238194,"EPP","rcp-package","mknauer","RESOLVED","WONTFIX","include Mylyn source in rcp package","2010-06-14 16:32:14"
248569,"EPP","Dynamic Package Delivery","mknauer","RESOLVED","WONTFIX","EPP UDC and the EPP Dynamic Package Delivery Wizard (Download Wizard)","2012-06-05 09:46:09"
265912,"EPP","jee-package","mknauer","RESOLVED","FIXED","md5 files are ""hard to read""","2009-06-04 19:12:05"
275375,"EPP","jee-package","mknauer","RESOLVED","FIXED","Unusual exception logged on startup","2009-09-28 12:49:31"
275596,"EPP","jee-package","mknauer","RESOLVED","FIXED","default workspace is wrong directory","2009-05-21 12:37:28"
275817,"EPP","jee-package","mknauer","RESOLVED","FIXED","Eclipse says 'Java EE IDE Package' as application name","2009-06-23 15:07:03"
276043,"EPP","modeling-package","mknauer","RESOLVED","FIXED","Add missing features to Modeling EPP","2009-06-15 04:54:47"
276415,"EPP","jee-package","mknauer","RESOLVED","FIXED","Another rev of feature","2009-05-21 02:52:22"
276606,"EPP","jee-package","mknauer","RESOLVED","FIXED","DTP features should not include source, to save size","2009-05-27 05:20:46"
278048,"EPP","javame-package","mknauer","RESOLVED","FIXED","Improve branding","2009-05-27 10:12:34"
278152,"EPP","jee-package","mknauer","RESOLVED","FIXED","should not jar up product plugin","2009-05-28 02:34:18"
278158,"EPP","jee-package","mknauer","RESOLVED","FIXED","need build to handle about.mappings?","2009-06-11 12:43:17"
278469,"EPP","jee-package","mknauer","RESOLVED","FIXED","Runtime-only features should not be installed in an IDE","2010-03-15 16:42:31"
279282,"EPP","javame-package","mknauer","RESOLVED","FIXED","about files","2009-06-10 08:01:02"
280710,"EPP","jee-package","mknauer","RESOLVED","FIXED","progress message steps on image text","2009-06-19 00:15:28"
281501,"EPP","package content","mknauer","RESOLVED","FIXED","64 bit Cocoa EPP packages should be available","2009-09-25 10:52:56"
300913,"EPP","jee-package","mknauer","RESOLVED","FIXED","remove references to uncertain capabilities bundles","2010-11-11 21:04:46"
304436,"EPP","website","mknauer","RESOLVED","INVALID","The update site : Access Forbidden","2013-02-05 15:59:30"
306586,"EPP","website","mknauer","RESOLVED","FIXED","Helios M6 page does not have a direct link to the Windows 64-bit build of Eclipse Classic","2010-05-19 14:43:02"
313894,"EPP","package content","mknauer","RESOLVED","FIXED","remove EPP package repository from all packages","2010-05-22 06:20:03"
313898,"EPP","Packager","mknauer","RESOLVED","FIXED","[BUILD_SCRIPT] EPP package build depends on EPP repository build","2010-05-22 09:56:36"
324433,"EPP","javascript-package","mknauer","RESOLVED","FIXED","No welcome screen for JavaScript IDE","2010-11-11 21:09:09"
343869,"EPP","java-package","mknauer","RESOLVED","FIXED","Add WindowBuilder Core and Swing to the Java package","2020-06-18 07:28:24"
345113,"EPP","website","mknauer","RESOLVED","FIXED","Wrong stats on Developer Builds download site","2011-05-09 09:55:42"
346616,"EPP","Packager","mknauer","RESOLVED","FIXED","move EPP from CVS to git","2012-06-05 09:35:07"
350621,"EPP","rcp-package","mknauer","RESOLVED","FIXED","Include ""EGit Mylyn"" bridge in packages","2011-09-03 03:40:08"
366658,"EPP","website","mknauer","RESOLVED","FIXED","Juno download buttons should be added to epp home page","2011-12-14 03:44:25"
376853,"EPP","website","mknauer","RESOLVED","DUPLICATE","Composite Repository contains absolute URL","2012-06-05 11:22:55"
401229,"EPP","website","mknauer","RESOLVED","FIXED","http://www.eclipse.org/epp/download.php shows old information, dead links","2013-03-18 05:51:31"
403586,"EPP","website","mknauer","RESOLVED","FIXED","The ""Nightly Build"" button on the EPP homepage should point to Kepler","2013-03-18 05:52:31"
421816,"EPP","Packager","mknauer","RESOLVED","FIXED","Unable to start Luna M3 EPP packages on Mac OSX Mavericks","2013-12-19 03:43:28"
431904,"EPP","website","mknauer","RESOLVED","WONTFIX","Add ""Includes Maven and Git"" to description of EPP packages","2014-12-19 17:19:33"
437553,"EPP","website","mknauer","RESOLVED","FIXED","suggest download links be made current","2014-06-16 18:20:49"
439176,"EPP","website","mknauer","RESOLVED","WORKSFORME","Resources not found on updating Luna 4.4 with reporting on windows 7","2014-07-14 08:45:52"
443296,"EPP","website","mknauer","RESOLVED","FIXED","Rename ""Standard Package"" to ""Eclipse IDE for Eclipse Committers"" on the Eclipse download page","2014-09-05 11:35:38"
455800,"EPP","website","mknauer","RESOLVED","FIXED","Eclipse IDE for committers is not listed in list of packages for download (Mars Milestones)","2015-05-29 15:43:05"
458974,"EPP","website","mknauer","RESOLVED","FIXED","Build a aggregated New and Noteworthy for Mars","2015-10-08 16:37:34"
466084,"EPP","website","mknauer","RESOLVED","FIXED","Luna SR2 New and Noteworthy for Platform link has changed","2017-04-10 10:36:51"
237425,"EPP","jee-package","mober.at+eclipse","RESOLVED","FIXED","Warning logged about undefined tm.terminal command","2008-09-16 14:55:32"
375292,"EPP","committers-package","mober.at+eclipse","RESOLVED","FIXED","Provide marketplace client for classic download","2013-03-23 15:52:54"
397896,"EPP","committers-package","mober.at+eclipse","RESOLVED","FIXED","Replace Platform Classic/SDK with EPP Classic/SDK including EGit","2013-05-23 14:38:04"
