"Bug ID","Product","Component","Assignee","Status","Resolution","Summary","Changed"
512416,"EPP","Automated Error Reporting Client (AERI)","johannes.dorn","RESOLVED","FIXED","Spurious/inadequate failed to create Bugzilla handling","2017-02-27 05:21:49"
514996,"EPP","Automated Error Reporting Client (AERI)","johannes.dorn","RESOLVED","FIXED","[server] [charts] Sort status, severity etc. by sort key","2017-04-18 07:23:02"
515357,"EPP","Automated Error Reporting Client (AERI)","johannes.dorn","RESOLVED","FIXED","Wrong Automated Project Assignments","2017-04-20 08:32:33"
518037,"EPP","Automated Error Reporting Client (AERI)","johannes.dorn","RESOLVED","FIXED","mixed content (https loads from http) on https://dev.eclipse.org/recommenders/community/aeri/","2017-06-19 04:00:41"
532095,"EPP","Automated Error Reporting Client (AERI)","johannes.dorn","RESOLVED","FIXED","AERI is down","2018-03-09 02:32:38"
533265,"EPP","Automated Error Reporting Client (AERI)","johannes.dorn","RESOLVED","FIXED","AERI server issue: this IndexWriter is closed","2018-04-05 16:55:28"
549433,"EPP","cpp-package","jonah","RESOLVED","FIXED","Launchbar cannot be updated with Check for Updates","2019-08-03 13:03:48"
559766,"EPP","Releng","jonah","RESOLVED","FIXED","Nightly package builds","2020-02-06 10:20:07"
562032,"EPP","cpp-package","jonah","RESOLVED","FIXED","EPP cannot resolve dependencies","2020-04-11 20:01:48"
564214,"EPP","Releng","jonah","RESOLVED","FIXED","Include correct incubating information for EPP packages","2020-12-04 11:34:07"
565231,"EPP","modeling-package","jonah","RESOLVED","FIXED","EMF Parsley's removal causes modelling EPP to be broken","2020-10-12 12:28:41"
566651,"EPP","Releng","jonah","RESOLVED","FIXED","Simplify p2 repo handling on release day","2020-09-16 09:50:28"
567074,"EPP","Releng","jonah","RESOLVED","FIXED","dmg packages have full path in checksum files","2020-09-17 10:13:37"
567817,"EPP","modeling-package","jonah","RESOLVED","FIXED","EMF Parsley's removal causes modelling EPP to be broken","2020-11-30 10:09:07"
567877,"EPP","Releng","jonah","RESOLVED","FIXED","Scripts in EPP assume names of packages can't be substrings of each other","2020-10-15 18:55:47"
567892,"EPP","Releng","jonah","RESOLVED","FIXED","Publish Aarch64 Linux Builds for EPP","2020-11-05 20:29:52"
567912,"EPP","Releng","jonah","RESOLVED","FIXED","Mac OSX Notarization failing for 2020-12 M1","2020-10-16 09:54:59"
568003,"EPP","Automated Error Reporting Client (AERI)","jonah","RESOLVED","FIXED","Remove AERI from SimRel","2020-10-19 12:51:01"
568052,"EPP","Releng","jonah","RESOLVED","FIXED","Supply sun.java.command for JPS support","2020-10-24 12:55:42"
568566,"EPP","Releng","jonah","RESOLVED","FIXED","Include the .tar.gz version of macos on download server","2020-11-05 20:34:51"
569087,"EPP","Releng","jonah","RESOLVED","FIXED","Workaround JAXB installation problems","2020-12-09 20:41:50"
566897,"EPP","java-package","Lars.Vogel","RESOLVED","FIXED","Include JVM in the Java package","2020-11-16 05:51:45"
567063,"EPP","jee-package","Lars.Vogel","RESOLVED","FIXED","Include JVM in the Java EE package","2020-10-09 10:27:00"
536469,"EPP","java-package","ma.becker","RESOLVED","FIXED","Use png with transparent icon in the about dialog of Java EPP (and others if applicable)","2020-06-15 16:45:38"
490552,"EPP","cpp-package","malaperle","RESOLVED","FIXED","Some features are not at the top-level in the new layout","2016-04-02 10:51:17"
514212,"EPP","committers-package","mandrikov","RESOLVED","FIXED","Include EclEmma in Eclipse Committers Package","2017-05-25 17:02:26"
546425,"EPP","Automated Error Reporting Client (AERI)","mat.booth","RESOLVED","FIXED","Update EPP Logging to Lucene 8.0","2019-05-02 10:34:00"
518965,"EPP","Releng","mistria","RESOLVED","FIXED","Skip assemble-repository step","2019-03-08 11:13:38"
528429,"EPP","java-package","mistria","RESOLVED","FIXED","m2e to download sources by default","2018-03-02 15:30:51"
528430,"EPP","jee-package","mistria","RESOLVED","FIXED","m2e to download sources by default","2018-03-02 15:30:36"
536249,"EPP","Releng","mistria","RESOLVED","FIXED","The Rust product's description is a copy of the PHP product description","2018-07-02 02:59:39"
544355,"EPP","javascript-package","mistria","RESOLVED","FIXED","Replace Webtools editors by Wild Web Developer","2019-08-29 04:24:46"
559699,"EPP","Releng","mistria","RESOLVED","FIXED","Splash screen says Eclipse IDE 2019-12 not 2020-03","2020-02-04 07:33:07"
559701,"EPP","jee-package","mistria","RESOLVED","FIXED","Eclipse JEE package has excessively long paths causing problems on Windows","2020-08-04 04:20:17"
561089,"EPP","Releng","mistria","RESOLVED","FIXED","Remove org.eclipse.epp.logging.aeri.feature feature from common feature","2020-10-19 12:01:27"
561651,"EPP","Releng","mistria","RESOLVED","FIXED","Missing p2 stats for 2020-03","2020-04-02 07:06:55"
562981,"EPP","modeling-package","mistria","RESOLVED","FIXED","org.eclipse.m2e.lemminx.feature.feature.group no longer part of simrel - means EPP does not buld","2020-05-08 19:57:45"
564390,"EPP","rust-package","mistria","RESOLVED","FIXED","Consume Corrosion release site directly as Corrosion drops from SimRel","2020-08-21 03:55:58"
565997,"EPP","javascript-package","mistria","RESOLVED","FIXED","Platform-specific node embedder fragments are not in the packages","2020-08-18 10:40:30"
516641,"EPP","package content","reckord","RESOLVED","FIXED","Update MPC entry subline","2017-05-15 07:10:16"
490044,"EPP","java-package","sewe","RESOLVED","FIXED","[Welcome] Adopt Solstice theme for Java package","2016-05-19 09:54:55"
507104,"EPP","java-package","sewe","RESOLVED","FIXED","Include EclEmma in Java Package","2017-03-16 04:18:41"
508320,"EPP","Automated Error Reporting Client (AERI)","sewe","RESOLVED","FIXED","Use REST API to query server's ""interest"" in an error report","2016-11-29 03:21:31"
514182,"EPP","Automated Error Reporting Client (AERI)","sewe","RESOLVED","FIXED","Do not download problems database anymore","2017-03-27 03:06:18"
521549,"EPP","committers-package","sewe","RESOLVED","FIXED","Configure RSS feeds directly in org.eclipse.epp.package.committers","2017-10-04 04:31:22"
521594,"EPP","Releng","sewe","RESOLVED","FIXED","Change detection heuristic gets confused on OXYGEN branch","2017-08-31 07:18:31"
525315,"EPP","committers-package","sewe","RESOLVED","FIXED","Broken localization for News feeds","2018-01-04 06:01:43"
529012,"EPP","Releng","sewe","RESOLVED","FIXED","feature.xml is invalid according to its DTD","2018-05-24 03:48:36"
526349,"EPP","Releng","stephanie.swart","RESOLVED","FIXED","[Branding] Have splash say Eclipse *IDE* or *SDK*","2018-03-01 16:03:12"
534617,"EPP","java-package","wim.jongman","RESOLVED","FIXED","[Photon] [java] Add Tip of the Day to the Java Package","2018-06-05 11:48:11"
534999,"EPP","javascript-package","wim.jongman","RESOLVED","FIXED","[Tips] [Photon] [Webtools] Include Tip of the Day feature","2018-05-24 09:25:25"
535002,"EPP","modeling-package","wim.jongman","RESOLVED","FIXED","[Tips] [Photon] [modeling] Include tips in modeling package","2018-05-24 10:18:44"
562344,"EPP","php-package","zulus","RESOLVED","FIXED","Replace JSDT by Wild Web Developer","2020-04-27 09:42:00"
518583,"EPP","jee-package","epp.packager-inbox","CLOSED","INVALID","There was an eclipse platform Oxygen RC4a build, but the latest EPP is RC3.","2017-06-21 15:54:19"
549570,"EPP","javascript-package","epp.packager-inbox","CLOSED","INVALID","Eclipse IDE for Web and JavaScript  4.12 2019-06 missing all the key JavaScript dev related features","2019-08-08 10:07:47"
486131,"EPP","jee-package","epp.packager-inbox","CLOSED","WORKSFORME","can't extract eclipse","2016-01-20 10:55:59"
490341,"EPP","committers-package","epp.packager-inbox","CLOSED","FIXED","Consider adding -XX:+UseStringDeduplication to standard packages","2016-10-11 02:30:43"
490515,"EPP","package content","epp.packager-inbox","CLOSED","FIXED","Prevent upgrade from old to new EPP package layout","2016-03-29 12:47:45"
490753,"EPP","javascript-package","epp.packager-inbox","CLOSED","WONTFIX","Include debugger feature","2019-03-08 06:16:18"
491227,"EPP","java-package","epp.packager-inbox","CLOSED","NOT_ECLIPSE","Facing blocking error in the Luna version 2 (4.4.2) when automating selenium code for select drop down menu","2020-06-03 07:23:19"
493643,"EPP","php-package","epp.packager-inbox","CLOSED","FIXED","[Welcome] Adopt Solstice theme for PHP package","2017-02-22 07:37:41"
494067,"EPP","php-package","epp.packager-inbox","CLOSED","WONTFIX","Add WTP Web Developer Tools feature","2020-05-19 13:25:33"
494695,"EPP","java-package","epp.packager-inbox","CLOSED","INVALID","Didn't update from old version","2016-05-26 16:22:43"
495378,"EPP","android-package","epp.packager-inbox","CLOSED","FIXED","Add incubation to Android Neon Package","2016-06-03 07:29:30"
496033,"EPP","Packager","epp.packager-inbox","CLOSED","FIXED","Remove WindowBuilder from RCP/RAP + Java packages in Neon","2016-06-13 16:21:27"
497192,"EPP","java-package","epp.packager-inbox","CLOSED","INVALID","Eclipse Mars does not open in Windows 10 Pro","2016-07-03 03:37:28"
497204,"EPP","java-package","epp.packager-inbox","CLOSED","INVALID","resource in project, but error says not open","2016-07-04 07:06:29"
498457,"EPP","java-package","epp.packager-inbox","CLOSED","FIXED","FileNotFoundException : org.eclipse.ui_3.108.0.v20160518-1929.jar","2020-04-25 09:33:49"
501060,"EPP","Packager","epp.packager-inbox","CLOSED","FIXED","Neon.1 RC2 packages have bundles coming from WTP Oxygen","2016-09-20 06:19:09"
501518,"EPP","java-package","epp.packager-inbox","CLOSED","INVALID","Exception while updating external folders","2016-09-15 13:19:12"
502194,"EPP","Releng","epp.packager-inbox","CLOSED","FIXED","EPP should have a releng component in bugzilla","2016-09-26 14:14:59"
503020,"EPP","cpp-package","epp.packager-inbox","CLOSED","INVALID","New eclipse not coming up - Giving java error","2016-10-08 03:52:53"
507515,"EPP","java-package","epp.packager-inbox","CLOSED","NOT_ECLIPSE","Issue encountered when updating and reinstalling ABAP Development tools on NEON version.","2016-11-15 03:33:52"
508704,"EPP","php-package","epp.packager-inbox","CLOSED","FIXED","Include TM terminal","2017-02-22 11:37:49"
510522,"EPP","Packager","epp.packager-inbox","CLOSED","DUPLICATE","splash screen in  .product seems ignored","2017-03-16 15:31:27"
511361,"EPP","javascript-package","epp.packager-inbox","CLOSED","FIXED","Remove THyM from JS package","2019-03-08 10:51:27"
513895,"EPP","Releng","epp.packager-inbox","CLOSED","FIXED","Splash screen is not displayed in Oxygen M6 Build on Windows machines","2017-12-08 06:55:29"
514000,"EPP","php-package","epp.packager-inbox","CLOSED","DUPLICATE","No Marketplace entry in Help menu","2020-05-19 13:27:23"
514280,"EPP","php-package","epp.packager-inbox","CLOSED","NOT_ECLIPSE","editor does not open","2017-04-18 10:28:16"
514697,"EPP","php-package","epp.packager-inbox","CLOSED","WONTFIX","Not possible to install PDT 5.0 on Neon.3 PHP EPP","2018-03-20 17:45:16"
515269,"EPP","Releng","epp.packager-inbox","CLOSED","FIXED","Cleanup pom.xml files and factorize some plugins executions","2018-03-07 17:07:53"
515622,"EPP","java-package","epp.packager-inbox","CLOSED","INVALID","Eclipse will not run","2017-04-23 11:02:11"
519393,"EPP","php-package","epp.packager-inbox","CLOSED","DUPLICATE","Unable update plugins","2020-05-02 10:40:05"
519481,"EPP","php-package","epp.packager-inbox","CLOSED","WORKSFORME","Unable to collapse PHP class files","2020-05-19 13:29:49"
520286,"EPP","cpp-package","epp.packager-inbox","CLOSED","DUPLICATE","lots of errors","2017-07-27 20:01:19"
521395,"EPP","cpp-package","epp.packager-inbox","CLOSED","DUPLICATE","Ctrl+Click Indexing doesn't work in C++ modules","2017-08-24 15:50:20"
521514,"EPP","java-package","epp.packager-inbox","CLOSED","FIXED","Add ""Eclipse News"" RSS feed to Java Package","2020-06-03 07:37:20"
521654,"EPP","java-package","epp.packager-inbox","CLOSED","INVALID","Getting error while starting Apache server","2017-08-31 06:47:37"
522634,"EPP","Releng","epp.packager-inbox","CLOSED","FIXED"," --add-modules=ALL-SYSTEM to eclipse.ini","2018-01-27 13:57:59"
522649,"EPP","java-package","epp.packager-inbox","CLOSED","WONTFIX","News feed plugin not installed on upgrade installs","2020-06-03 07:17:57"
525617,"EPP","jee-package","epp.packager-inbox","CLOSED","WORKSFORME","Eclipse Build download is failing - servers are down","2017-11-23 04:00:25"
526343,"EPP","java-package","epp.packager-inbox","CLOSED","INVALID","Constantly returning error message when opening the program","2017-10-23 09:21:03"
526456,"EPP","package content","epp.packager-inbox","CLOSED","WONTFIX","[Discuss][Branding] Rename Eclipse into Eclipse Photon IDE","2018-03-12 04:56:31"
526875,"EPP","modeling-package","epp.packager-inbox","CLOSED","DUPLICATE","Eclipse Modeling Package not launching in Mac Sierra","2017-11-21 04:03:22"
527226,"EPP","Packager","epp.packager-inbox","CLOSED","FIXED","[EPP] Building the OXYGEN branch fails","2017-11-17 06:51:23"
528061,"EPP","Releng","epp.packager-inbox","CLOSED","FIXED","Re-enable MPC in Photon","2017-12-04 04:21:31"
529170,"EPP","java-package","epp.packager-inbox","CLOSED","WONTFIX","MacOs didnt open the program","2017-12-26 03:20:37"
530329,"EPP","php-package","epp.packager-inbox","CLOSED","FIXED","refraining to old code","2020-05-19 13:49:24"
530726,"EPP","java-package","epp.packager-inbox","CLOSED","INVALID","Mac OS X（Cocoa）64位下载连接无效","2018-02-05 08:18:55"
532067,"EPP","java-package","epp.packager-inbox","CLOSED","INVALID","Open Bugs","2018-03-06 13:09:37"
532683,"EPP","php-package","epp.packager-inbox","CLOSED","FIXED","Photon M6 PHP Package not available","2018-03-25 16:40:16"
534696,"EPP","php-package","epp.packager-inbox","CLOSED","FIXED","Harmonize package name to Eclipse IDE for PHP ...","2020-05-19 13:32:40"
534760,"EPP","java-package","epp.packager-inbox","CLOSED","INVALID","Simple compilation fails in Eclipse Oxygen.3a","2018-05-17 09:00:29"
534949,"EPP","php-package","epp.packager-inbox","CLOSED","FIXED","Please add me as PHP package tester","2020-05-19 13:29:06"
535309,"EPP","cpp-package","epp.packager-inbox","CLOSED","FIXED","EPP builds failing","2018-05-30 07:30:26"
536102,"EPP","jee-package","epp.packager-inbox","CLOSED","NOT_ECLIPSE","Sonar lint installation issue","2019-12-09 14:59:44"
538661,"EPP","jee-package","epp.packager-inbox","CLOSED","DUPLICATE","Upgrade to Eclipse 2018-09 M3 breaks SQL editor.","2018-09-08 19:00:39"
539041,"EPP","java-package","epp.packager-inbox","CLOSED","INVALID","Unable to Install","2018-09-14 05:37:56"
540168,"EPP","java-package","epp.packager-inbox","CLOSED","INVALID","java 11","2018-10-16 15:35:57"
540983,"EPP","jee-package","epp.packager-inbox","CLOSED","FIXED","why no Eclipse IDE for Java EE Developers releases in milestone builds?","2019-04-20 11:34:18"
541760,"EPP","java-package","epp.packager-inbox","CLOSED","FIXED","Missing Java Developer links for 2018-12 M3","2018-12-07 07:22:56"
542080,"EPP","java-package","epp.packager-inbox","CLOSED","NOT_ECLIPSE","Problems occurred when invoking code from plug-in: ""org.eclipse.ui.views.properties.tabbed"".","2018-12-04 10:01:11"
543011,"EPP","java-package","epp.packager-inbox","CLOSED","INVALID","java.io.FileWriter, the File cannot be deleted","2018-12-22 14:43:03"
543054,"EPP","java-package","epp.packager-inbox","CLOSED","INVALID","Eclipse crashing while looking at files","2018-12-27 01:42:20"
543464,"EPP","java-package","epp.packager-inbox","CLOSED","DUPLICATE","2018-12 Installation Error","2019-01-15 11:15:39"
547604,"EPP","java-package","epp.packager-inbox","CLOSED","INVALID","Can't Install software","2019-05-23 15:15:12"
548444,"EPP","java-package","epp.packager-inbox","CLOSED","INVALID","The Java GUI is too big","2019-06-19 12:53:54"
548562,"EPP","java-package","epp.packager-inbox","CLOSED","INVALID","I am not able to update because of unfound repositories.","2019-07-22 17:24:52"
550277,"EPP","modeling-package","epp.packager-inbox","CLOSED","DUPLICATE","M2 Installation fails macOS Catalina Security Check","2019-08-21 03:35:52"
550404,"EPP","java-package","epp.packager-inbox","CLOSED","INVALID","sgfghg","2019-08-24 07:35:44"
550997,"EPP","Releng","epp.packager-inbox","CLOSED","FIXED","notarize mac apps","2019-12-10 10:30:12"
551207,"EPP","package content","epp.packager-inbox","CLOSED","DUPLICATE","Rust package's ""file a bug"" link goes nowhere.","2020-04-21 10:33:16"
551635,"EPP","java-package","epp.packager-inbox","CLOSED","WORKSFORME","I can't run eclipse without having a bug on it.","2019-09-30 12:47:43"
553118,"EPP","committers-package","epp.packager-inbox","CLOSED","INVALID","java.lang.ClassCastException: class org.eclipse.e4.ui.model.application.commands.impl.BindingTableImpl cannot be cast to class org.eclipse.e4.ui.model.application.commands.MBindingContext","2019-11-15 19:11:12"
563320,"EPP","java-package","epp.packager-inbox","CLOSED","NOT_ECLIPSE","Scala integration is pending","2020-08-06 03:53:10"
564310,"EPP","Packager","epp.packager-inbox","CLOSED","DUPLICATE","Wrongly sized branding icon in 4.16 RC1","2020-06-15 16:45:38"
564393,"EPP","jee-package","epp.packager-inbox","CLOSED","DUPLICATE","Unsigned content during installation for Eclipse IDE for Enterprise Java Developpers","2020-06-28 09:07:49"
564525,"EPP","javascript-package","epp.packager-inbox","CLOSED","WONTFIX","Not getting an option to create javaScript Project in this package","2020-06-22 05:00:34"
564835,"EPP","jee-package","epp.packager-inbox","CLOSED","NOT_ECLIPSE","When inputting single quotation marks or double quotation marks when editing javasscript, the cursor will automatically jump back to the last","2020-07-02 14:46:53"
485434,"EPP","Automated Error Reporting Client (AERI)","error-reports-inbox","CLOSED","FIXED","No alert mails received for Code Recommenders since end of November","2016-05-24 06:59:17"
485836,"EPP","Automated Error Reporting Client (AERI)","error-reports-inbox","CLOSED","FIXED","In Kepler, error reporting notification says 'Welcome to Eclipse Mars Error Reporting....'","2016-02-02 09:59:41"
486042,"EPP","Automated Error Reporting Client (AERI)","error-reports-inbox","CLOSED","FIXED","UI freeze in LogListener.logging - Make sure ProblemsDatabaseService does not cause UI freezes","2016-05-23 01:52:11"
486989,"EPP","Automated Error Reporting Client (AERI)","error-reports-inbox","CLOSED","WONTFIX","[client][ui] No URL tooltips on privacy policy and terms of use","2016-02-02 10:13:48"
486999,"EPP","Automated Error Reporting Client (AERI)","error-reports-inbox","CLOSED","DUPLICATE","[client][ui] Issues with configuring name & e-mail per server","2016-05-24 06:57:39"
487000,"EPP","Automated Error Reporting Client (AERI)","error-reports-inbox","CLOSED","INVALID","Enable error reporting notification only appears once","2016-02-02 09:56:16"
487001,"EPP","Automated Error Reporting Client (AERI)","error-reports-inbox","CLOSED","FIXED","[ui][client] Configuring project not possible from ""A Problem Was Found..."" dialog","2016-02-02 10:01:34"
487003,"EPP","Automated Error Reporting Client (AERI)","error-reports-inbox","CLOSED","FIXED","Changes made to anonymize options in Wizard not reflected in first error report","2016-02-02 09:55:29"
487005,"EPP","Automated Error Reporting Client (AERI)","error-reports-inbox","CLOSED","FIXED","Error Reporting Notification does not close on clicking Disable","2016-02-02 09:55:23"
487007,"EPP","Automated Error Reporting Client (AERI)","error-reports-inbox","CLOSED","FIXED","[client] Enable error reporting notification appears again after Eclipse restart","2016-02-02 09:55:03"
487009,"EPP","Automated Error Reporting Client (AERI)","error-reports-inbox","CLOSED","FIXED","Incorrect tooltip for Enable Bug Mode in preference page","2016-02-02 09:10:19"
487077,"EPP","Automated Error Reporting Client (AERI)","error-reports-inbox","CLOSED","FIXED","Check user visible strings for problems","2016-02-03 11:11:10"
487192,"EPP","Automated Error Reporting Client (AERI)","error-reports-inbox","CLOSED","DUPLICATE","NPE below LogListener.logging","2016-07-07 03:48:00"
487193,"EPP","Automated Error Reporting Client (AERI)","error-reports-inbox","CLOSED","FIXED","NoSuchMethodError while opening the Preference Page on Luna","2016-04-26 16:37:09"
487651,"EPP","Automated Error Reporting Client (AERI)","error-reports-inbox","CLOSED","FIXED","[client] NLS missing message: LOG_WARN_AERI_FAILURE","2016-02-11 08:56:09"
487711,"EPP","Automated Error Reporting Client (AERI)","error-reports-inbox","CLOSED","FIXED","Unexpected response : UNKNOWN warning","2016-05-30 02:30:46"
488154,"EPP","Automated Error Reporting Client (AERI)","error-reports-inbox","CLOSED","FIXED","Link to bug in report details dialog (and on website)","2016-05-24 06:56:58"
488448,"EPP","Automated Error Reporting Client (AERI)","error-reports-inbox","CLOSED","WONTFIX","Whiteboard messages of closed bug not presented to the user","2016-04-26 16:36:23"
488868,"EPP","Automated Error Reporting Client (AERI)","error-reports-inbox","CLOSED","FIXED","NPE after running JUnit Plugin Test","2016-05-30 02:30:44"
488917,"EPP","Automated Error Reporting Client (AERI)","error-reports-inbox","CLOSED","DUPLICATE","[aeri] NPE: AERI failed with an error, please report","2016-03-04 03:23:33"
489522,"EPP","Automated Error Reporting Client (AERI)","error-reports-inbox","CLOSED","DUPLICATE","2 NPEs on entering empty user data","2016-05-24 06:56:01"
490051,"EPP","Automated Error Reporting Client (AERI)","error-reports-inbox","CLOSED","FIXED","[server] No triaging","2016-05-24 07:05:45"
490595,"EPP","Automated Error Reporting Client (AERI)","error-reports-inbox","CLOSED","FIXED","[AERI] EPP logging cannot generate code if path to project contains space","2016-05-30 02:30:43"
490640,"EPP","Automated Error Reporting Client (AERI)","error-reports-inbox","CLOSED","FIXED","AERI failed with error","2017-03-22 12:54:07"
491653,"EPP","Automated Error Reporting Client (AERI)","error-reports-inbox","CLOSED","FIXED","Update error reporting server to v2.0","2016-05-24 06:29:22"
492917,"EPP","Automated Error Reporting Client (AERI)","error-reports-inbox","CLOSED","FIXED","Add eclipse.uuid to error reports","2016-06-05 14:54:00"
493524,"EPP","Automated Error Reporting Client (AERI)","error-reports-inbox","CLOSED","FIXED","service temporarily unavailable","2016-05-24 06:21:21"
493566,"EPP","Automated Error Reporting Client (AERI)","error-reports-inbox","CLOSED","WORKSFORME","AERI breaks logging from a weaving hook","2016-05-16 15:21:29"
494098,"EPP","Automated Error Reporting Client (AERI)","error-reports-inbox","CLOSED","FIXED","NullPointerException below SystemSettingsCreationFunction$1.notifyChanged (thrown in EclipsePreferences.put)","2016-05-24 06:57:39"
494132,"EPP","Automated Error Reporting Client (AERI)","error-reports-inbox","CLOSED","FIXED","Extension point schema description not available","2016-06-01 03:50:14"
494156,"EPP","Automated Error Reporting Client (AERI)","error-reports-inbox","CLOSED","FIXED","SWTException below NotificationPopup$BlockPopupOnModalShellActivationListener.isVisibleAndModal (thrown in Widget.checkWidget)","2016-05-30 02:30:42"
494165,"EPP","Automated Error Reporting Client (AERI)","error-reports-inbox","CLOSED","WORKSFORME","NullPointerException in UploadReportsScheduler.send","2016-05-20 09:38:49"
494170,"EPP","Automated Error Reporting Client (AERI)","error-reports-inbox","CLOSED","FIXED","IllegalArgumentException below ReviewDialog$3.controlResized (thrown in SashForm.setWeights)","2016-05-30 02:30:45"
494171,"EPP","Automated Error Reporting Client (AERI)","error-reports-inbox","CLOSED","FIXED","ConcurrentModificationException below PopupNotificationSink$1$1.run (thrown in HashMap$HashIterator.nextNode)","2016-05-30 02:30:43"
494725,"EPP","Automated Error Reporting Client (AERI)","error-reports-inbox","CLOSED","INVALID","No bug title in 'A Problem Was Found...' dialog","2016-05-27 06:43:53"
494866,"EPP","Automated Error Reporting Client (AERI)","error-reports-inbox","CLOSED","FIXED","Allow every (3rd party) Plug-in to subscribe to its error reports","2016-05-30 02:39:54"
496625,"EPP","Automated Error Reporting Client (AERI)","error-reports-inbox","CLOSED","FIXED","Add Git tag to EPP Logging repository for Neon","2016-06-23 05:17:53"
496666,"EPP","Automated Error Reporting Client (AERI)","error-reports-inbox","CLOSED","FIXED","Error reports are sent twice when auto-sending or sending from notification","2016-06-29 07:58:31"
497383,"EPP","Automated Error Reporting Client (AERI)","error-reports-inbox","CLOSED","DUPLICATE","An unexpected error has occured in plug-in org.eclipse.epp.logging.aeri.core","2016-07-07 03:47:59"
497844,"EPP","Automated Error Reporting Client (AERI)","error-reports-inbox","CLOSED","FIXED","Example aeri.rcp.product not working","2016-07-15 10:04:42"
497886,"EPP","Automated Error Reporting Client (AERI)","error-reports-inbox","CLOSED","FIXED","Error: Plugin execution not covered by lifecycle configuration","2016-07-14 04:00:00"
497900,"EPP","Automated Error Reporting Client (AERI)","error-reports-inbox","CLOSED","FIXED","Demo projects (aeri.rcp and aeri.rcp.silent) do not integrate the error capabilities into there menu","2016-07-14 08:50:53"
498549,"EPP","Automated Error Reporting Client (AERI)","error-reports-inbox","CLOSED","INVALID","AERI failed with an error. Please report this error: Invalid UUID string:","2017-07-18 10:03:10"
500203,"EPP","Automated Error Reporting Client (AERI)","error-reports-inbox","CLOSED","FIXED","[client] Confusing configuration with only one active project","2016-08-31 03:49:32"
501262,"EPP","Automated Error Reporting Client (AERI)","error-reports-inbox","CLOSED","FIXED","Show server response of original problem for duplicates","2016-09-29 04:26:22"
