"Bug ID","Product","Component","Assignee","Status","Resolution","Summary","Changed"
497363,"Gendoc","Core","gendoc-inbox","UNCONFIRMED"," ---","The svg image is not loaded correctly from the filepath: error message instead","2016-08-16 12:14:02"
498589,"Gendoc","Core","gendoc-inbox","UNCONFIRMED"," ---","[CDO] problem with referencing a model","2016-07-27 11:49:03"
499604,"Gendoc","Others","gendoc-inbox","UNCONFIRMED"," ---","[Papyrus] new method in Papyrus bundle to replace linked elements","2016-11-25 12:01:44"
499614,"Gendoc","Core","gendoc-inbox","UNCONFIRMED"," ---","No generation when the document archive contains two files with the same name","2016-08-16 05:35:45"
501967,"Gendoc","Core","gendoc-inbox","UNCONFIRMED"," ---","[GenDoc] Variable diagram image quality","2016-09-23 11:05:18"
518539,"Gendoc","Core","gendoc-inbox","UNCONFIRMED"," ---","Wrong image file path in <image> tag","2017-06-27 04:58:17"
518540,"Gendoc","Core","gendoc-inbox","UNCONFIRMED"," ---","Does not support *.svg image.","2017-06-29 23:09:08"
518671,"Gendoc","Core","gendoc-inbox","UNCONFIRMED"," ---","MPapyrus diagrams under a package does not exist in generated document","2017-11-02 03:39:57"
519743,"Gendoc","Core","gendoc-inbox","UNCONFIRMED"," ---","Integration of Gendoc with Reqcycle","2017-07-17 04:45:36"
519744,"Gendoc","Core","gendoc-inbox","UNCONFIRMED"," ---","Run out of memory problem","2017-07-17 04:32:36"
539284,"Gendoc","Core","gendoc-inbox","UNCONFIRMED"," ---","The size of the image cannot go higher than a 17.51cm width","2018-09-20 09:18:08"
559004,"Gendoc","Core","gendoc-inbox","UNCONFIRMED"," ---","Subdocument with fragments","2020-01-15 10:56:49"
515693,"Gendoc","Core","mohamed-ali.bachtobji","UNCONFIRMED"," ---","Open GENDOC starting window as a background task","2018-03-23 07:44:56"
492845,"Gendoc","Core","gendoc-inbox","NEW"," ---","[OpenDocument] Include and rich text does not work for Open Document templates","2016-05-02 15:16:47"
499373,"Gendoc","Core","gendoc-inbox","NEW"," ---","[fragment] polymorphism does not work with fragment","2016-08-08 12:15:31"
508052,"Gendoc","Others","gendoc-inbox","NEW"," ---","Table of contents in default template","2017-06-22 09:40:48"
508594,"Gendoc","Others","gendoc-inbox","NEW"," ---","Provide Gendoc samples on git repository","2016-12-02 05:40:49"
509948,"Gendoc","Core","gendoc-inbox","NEW"," ---","getDiagram(d:Diagram, el : Sequence(OclAny)) in the GMF bundle does not work if the diagram is open in Papyrus if using absolute URIs","2017-01-04 14:13:19"
538984,"Gendoc","Core","gendoc-inbox","NEW"," ---","Generate doc from json, (and from REST API)","2018-09-12 09:56:38"
543515,"Gendoc","Others","gendoc-inbox","NEW"," ---","Gendoc tutorial error in static image section","2019-01-17 02:22:18"
492352,"Gendoc","Core","jan.celmer","NEW"," ---","Provide a test template to help Gendoc Validation","2016-04-25 07:35:10"
506543,"Gendoc","UI","antonio.campesino.robles","ASSIGNED"," ---","Support for tracking changes in the generated documents.","2017-06-26 02:41:53"
501477,"Gendoc","Core","mohamed-ali.bachtobji","ASSIGNED"," ---","Include Tag does not replace variables","2018-01-09 04:52:14"
514712,"Gendoc","Core","mohamed-ali.bachtobji","ASSIGNED"," ---","[ODT] Fill automatically the draw:name to a unique id","2018-02-22 10:35:24"
515681,"Gendoc","Core","mohamed-ali.bachtobji","ASSIGNED"," ---","Tag names should not be allowed as variable names","2018-03-23 07:44:33"
492419,"Gendoc","UI","jan.celmer","REOPENED"," ---","Gendoc Menu icon too big","2016-11-23 09:57:40"
535656,"Gendoc","Core","anne.haugommard","RESOLVED","FIXED","[Table] Cell containing multiple values are not displayed correctly in generated document","2018-07-26 03:02:41"
535660,"Gendoc","Core","anne.haugommard","RESOLVED","FIXED","[Table] Table cell containing special characters (<,>...) corrupts the generated document","2018-07-26 03:02:48"
538755,"Gendoc","UI","anne.haugommard","RESOLVED","FIXED","NullPointerException in Gendoc template wizard use","2018-09-06 15:04:45"
560985,"Gendoc","Core","anne.haugommard","RESOLVED","FIXED","AdditionalResourceService does not handle HTML Runnable resource correctly (limitation to image resources)","2020-03-20 10:29:10"
500114,"Gendoc","Others","antonio.campesino.robles","RESOLVED","FIXED","[Acceleo] The commons.mtl files of the Acceleo bundles should use UTF-8 encoding","2017-12-13 03:11:41"
500125,"Gendoc","Others","antonio.campesino.robles","RESOLVED","FIXED","Avoid conflicts in the IRegistryService","2017-12-13 03:13:33"
500510,"Gendoc","Others","antonio.campesino.robles","RESOLVED","FIXED","The getPapyrusDiagrams(EObject object) doesn't retrieve the diagrams when using a model with spaces in the name or in the path.","2017-12-13 03:13:59"
507555,"Gendoc","Others","antonio.campesino.robles","RESOLVED","FIXED","DOCXHtmlService setInTable(), setIncludePic(), setVersion() can not be unset.","2017-12-13 03:14:35"
509756,"Gendoc","Core","antonio.campesino.robles","RESOLVED","FIXED","Documentation plugin for Gendoc","2017-12-13 03:14:54"
510173,"Gendoc","Core","antonio.campesino.robles","RESOLVED","FIXED","There is no IDocumentService implementation for XLSX, ODS and CSV documents.","2017-12-13 03:15:22"
510174,"Gendoc","UI","antonio.campesino.robles","RESOLVED","FIXED","Gendoc preferences plugin throw exception when there is projects closed in the workspace.","2017-12-13 03:15:46"
526483,"Gendoc","Core","antonio.campesino.robles","RESOLVED","FIXED","Diagrams doesn't show in the generate document if the papyrus model file with blanks in the URI.","2018-01-09 04:20:39"
526488,"Gendoc","Core","antonio.campesino.robles","RESOLVED","FIXED","Not all proxies are resolved when loading resources for papyrus models for complex model dependencies.","2018-01-09 05:04:01"
526895,"Gendoc","Core","antonio.campesino.robles","RESOLVED","FIXED","A HTML gendoc bundle to convert HTML fragment to plain text and plain text to HTML.","2018-01-29 08:30:02"
530839,"Gendoc","Core","antonio.campesino.robles","RESOLVED","FIXED","Model URIs are not normalized properly before attempt to load the models","2018-02-08 01:47:43"
530842,"Gendoc","UI","antonio.campesino.robles","RESOLVED","FIXED","When generating a document inside the workbench, the output folder should be refreshed if it is in the workspace.","2018-02-09 13:30:14"
531275,"Gendoc","Core","antonio.campesino.robles","RESOLVED","FIXED","Provide a query to retrieve the papyrus diagrams own by an element.","2018-03-23 07:45:23"
531347,"Gendoc","Core","antonio.campesino.robles","RESOLVED","FIXED","Papyrus Models with no diagrams (Empty notation models) are reported as an error in the log.","2018-03-23 07:46:09"
531348,"Gendoc","UI","antonio.campesino.robles","RESOLVED","FIXED","Open context menu for a UI element that adapts to an EObject which is a proxy throws an exception and the context menu is not shown.","2018-03-23 07:47:26"
486192,"Gendoc","Core","gendoc-inbox","RESOLVED","FIXED","file name replacement of "".di"" to "".notation"" fails","2016-04-25 04:46:39"
486703,"Gendoc","Core","gendoc-inbox","RESOLVED","FIXED","The attributes of tags with an empty attribute value ('') are not parsed correctly.","2016-07-21 07:51:17"
488684,"Gendoc","Core","gendoc-inbox","RESOLVED","FIXED","Unable to load environmental variables such as ${project_loc}","2016-04-25 04:46:25"
491607,"Gendoc","Others","gendoc-inbox","RESOLVED","FIXED","Commandline execution of gendoc fails","2016-06-22 08:18:04"
491616,"Gendoc","Core","gendoc-inbox","RESOLVED","FIXED","Papyrus CSS rendering is not managed with CLI or closed editors","2016-06-22 08:19:44"
492264,"Gendoc","Core","gendoc-inbox","RESOLVED","FIXED","[Image] Empty images after generation","2016-06-09 06:20:11"
494417,"Gendoc","Core","gendoc-inbox","RESOLVED","FIXED","[Gendoc Neon] document generation for Papyrus diagrams fails","2016-06-10 05:58:59"
494418,"Gendoc","Core","gendoc-inbox","RESOLVED","FIXED","[gendoc neon] menu disappeared from papyrus model explorer","2016-07-21 10:24:10"
495781,"Gendoc","Core","gendoc-inbox","RESOLVED","FIXED","[CDO] There is more than one '/' in your model path :","2016-06-16 05:08:17"
495887,"Gendoc","Core","gendoc-inbox","RESOLVED","FIXED","Switch to Java 1.6 execution environment","2016-06-10 11:54:18"
495894,"Gendoc","Core","gendoc-inbox","RESOLVED","FIXED","Provide a target platform for developers","2016-07-27 11:57:33"
496192,"Gendoc","Core","gendoc-inbox","RESOLVED","FIXED","Provide a juno update site","2016-06-22 08:17:23"
496848,"Gendoc","Others","gendoc-inbox","RESOLVED","FIXED","GenDoc Batch applications should not use eclipse internal packages.","2016-06-28 03:37:18"
496908,"Gendoc","Core","gendoc-inbox","RESOLVED","FIXED","[GenDoc] The org.eclipse.gendoc.services extension point should define a priority to be able to extend the default provided services","2016-07-21 07:50:49"
498361,"Gendoc","Core","gendoc-inbox","RESOLVED","FIXED","[variables] create a variable which give the folder of the template","2016-07-26 04:12:12"
500399,"Gendoc","Others","gendoc-inbox","RESOLVED","FIXED","GenDoc Errors and warnings report enhancement","2017-12-13 03:16:15"
501156,"Gendoc","Core","gendoc-inbox","RESOLVED","FIXED","Enhance some of the ""exception"" messages","2017-12-13 03:16:34"
501723,"Gendoc","UI","gendoc-inbox","RESOLVED","FIXED","GenDoc project properties and preferences.","2017-12-13 03:17:56"
501827,"Gendoc","Core","gendoc-inbox","RESOLVED","FIXED","Parameter replacement in the document metadata attributes.","2017-12-13 03:17:25"
515370,"Gendoc","Core","gendoc-inbox","RESOLVED","FIXED","Loading imported models fail if platform uris are not used as model URI.","2017-12-13 03:18:42"
517790,"Gendoc","Core","gendoc-inbox","RESOLVED","FIXED","Tag parser cannot handle unicode space chars","2017-12-13 03:19:07"
521507,"Gendoc","Core","gendoc-inbox","RESOLVED","FIXED","Recursive Fragments are not supported.","2017-12-13 03:19:33"
521509,"Gendoc","Core","gendoc-inbox","RESOLVED","FIXED","Queries that contain the characters '<' or '>' cause an error.","2017-12-13 03:19:57"
526979,"Gendoc","Core","gendoc-inbox","RESOLVED","FIXED","XMLDocumentService.cleanTags() duplicate text fragments","2018-01-09 07:09:58"
529715,"Gendoc","Others","gendoc-inbox","RESOLVED","FIXED","PAPYRUS_DOCUMENTATION_STEREOTYPE_QUALIFIED_NAME out of date for Papyrus","2018-06-12 04:05:56"
535482,"Gendoc","UI","gendoc-inbox","RESOLVED","FIXED","Conflict in handler org.eclipse.gendoc.ui.actions.GenerateDocumentation","2019-10-11 05:32:23"
540469,"Gendoc","Core","gendoc-inbox","RESOLVED","FIXED","[Gendoc] [Sirius] Sirius 6.0.0 throws a clast cast exception to org.eclipse.sirius.diagram.ui.tools.internal.part.SiriusDiagramGraphicalViewer","2018-10-26 07:07:20"
552031,"Gendoc","UI","gendoc-inbox","RESOLVED","FIXED","Menu to launch the Gendoc wizard in Papyrus is not available in context menu.","2019-10-11 05:31:49"
552039,"Gendoc","Core","gendoc-inbox","RESOLVED","FIXED","Models with blanks in the name are not open properly","2019-10-11 10:06:05"
492954,"Gendoc","Core","jan.celmer","RESOLVED","FIXED","The acceleo gmf bundle declares the query getDiagramsInModel but it does not implement it.","2016-06-22 08:15:50"
494772,"Gendoc","Core","jan.celmer","RESOLVED","FIXED","Change master version to 0.6.0","2016-07-21 09:07:35"
506575,"Gendoc","Core","mohamed-ali.bachtobji","RESOLVED","FIXED","Provide a getAppliedComment function in the papyrus module","2018-03-23 07:42:37"
515404,"Gendoc","Core","mohamed-ali.bachtobji","RESOLVED","FIXED","Provide a way to get tables from Papyrus or Sirius","2018-03-23 07:42:55"
510165,"Gendoc","Core","anne.haugommard","CLOSED","FIXED","Add build associated to Gerrit changes","2017-12-13 03:20:17"
501157,"Gendoc","UI","antonio.campesino.robles","CLOSED","FIXED","[GenDoc] Support for new document types - reuse of the UI action","2018-10-26 07:14:52"
486793,"Gendoc","Others","gendoc-inbox","CLOSED","DUPLICATE","DOCXDocumentService cleanTags() method does not work properly with '<' and '>' in text nodes.","2018-02-06 06:31:46"
506210,"Gendoc","Core","gendoc-inbox","CLOSED","FIXED","Diagram content not shown for generation from Papyrus","2017-12-13 03:21:45"
534581,"Gendoc","Core","gendoc-inbox","CLOSED","INVALID","substitute(String r, String t):String only substitutes first occurance","2018-05-11 11:24:30"
538295,"Gendoc","Others","gendoc-inbox","CLOSED","WONTFIX","NumberFormatException in .../gendoc/updates/nightly/latest/mars/compositeContent.xml","2018-10-30 06:39:36"
540401,"Gendoc","UI","gendoc-inbox","CLOSED","FIXED","Generate documentation menu is not visible in Sirius Model Explorer","2018-10-26 07:06:43"
497221,"Gendoc","Others","jan.celmer","CLOSED","FIXED","Unnecessary dependency from plugin org.eclipse.gendoc.bundle.acceleo.gmf to org.eclipse.uml2.uml","2016-07-05 04:15:06"