"Bug ID","Product","Component","Assignee","Status","Resolution","Summary","Changed"
213716,"Orbit","bundles","caniszczyk","RESOLVED","FIXED","Need(ed) to clean up map file entries for commons.collection, and pool","2007-12-21 15:36:23"
214157,"Orbit","bundles","caniszczyk","RESOLVED","FIXED","Add bundle for rome","2008-02-13 16:53:28"
214170,"Orbit","bundles","caniszczyk","RESOLVED","FIXED","Update org.apache.commons.lang to 2.3","2008-02-13 14:21:09"
214967,"Orbit","bundles","caniszczyk","RESOLVED","FIXED","org.apache.commons.pool missing about.html","2008-01-10 17:19:06"
216293,"Orbit","bundles","caniszczyk","RESOLVED","FIXED","update org.objectweb.asm to 3.1","2008-01-23 11:32:39"
216977,"Orbit","bundles","caniszczyk","RESOLVED","FIXED","antlr bundle should remove ""uses"" from manifest","2008-01-29 16:07:36"
218837,"Orbit","bundles","caniszczyk","RESOLVED","FIXED","org.apache.commons.beanutils needs dependency on org.apache.commons.logging","2008-02-13 14:19:37"
229922,"Orbit","bundles","caniszczyk","RESOLVED","FIXED","jSLP misses Activator class and Bundle-Activator header","2008-06-27 02:37:22"
238816,"Orbit","bundles","caniszczyk","RESOLVED","FIXED","Update contact info for zx","2008-08-20 16:29:30"
243755,"Orbit","bundles","caniszczyk","RESOLVED","FIXED","Add EasyMock 2.4","2008-08-11 12:21:03"
244678,"Orbit","bundles","caniszczyk","RESOLVED","FIXED","[jSLP] update to 1.0.0.RC5","2008-08-22 02:26:18"
248496,"Orbit","bundles","caniszczyk","RESOLVED","FIXED","Changes needed for EasyMock in Orbit","2008-09-24 17:07:31"
251137,"Orbit","bundles","caniszczyk","RESOLVED","FIXED","Add Apache HttpComponents HttpCore","2008-10-21 12:27:45"
263197,"Orbit","bundles","caniszczyk","RESOLVED","FIXED","org.easymock is trying to compile it's source","2009-02-02 09:34:27"
271398,"Orbit","bundles","caniszczyk","RESOLVED","FIXED","commons logging 1.1.1 has error(s) in about.html file","2009-04-06 23:03:36"
294382,"Orbit","bundles","caniszczyk","RESOLVED","FIXED","Bring JXPath 1.3.0 to orbit","2009-11-06 09:37:31"
297617,"Orbit","bundles","caniszczyk","RESOLVED","FIXED","Add Apache Lucene 2.9.1 to Orbit","2011-01-24 10:18:42"
312988,"Orbit","bundles","caniszczyk","RESOLVED","FIXED","com.google.collect does not specify its complete classpath","2010-05-16 01:22:07"
326128,"Orbit","bundles","caniszczyk","RESOLVED","FIXED","update org.objectweb.asm to 3.3.1","2011-05-18 06:12:08"
327868,"Orbit","bundles","caniszczyk","RESOLVED","FIXED","Add org.antlr.runtime 3.2 to orbit","2011-02-07 04:53:50"
333929,"Orbit","bundles","caniszczyk","RESOLVED","FIXED","Add com.google.gwtorm 1.1.4","2011-01-12 10:39:45"
334126,"Orbit","bundles","caniszczyk","RESOLVED","FIXED","Add com.google.gerrit.reviewdb 2.1.5","2011-01-12 10:51:55"
334127,"Orbit","bundles","caniszczyk","RESOLVED","FIXED","Add com.google.gerrit.common 2.1.5","2011-01-12 11:09:33"
334437,"Orbit","bundles","caniszczyk","RESOLVED","FIXED","Add org.jdom 1.1.1","2011-01-21 15:20:00"
334465,"Orbit","bundles","caniszczyk","RESOLVED","FIXED","Add org.apache.commons.io 2.0.1","2011-01-20 03:01:23"
334501,"Orbit","bundles","caniszczyk","RESOLVED","FIXED","Add com.google.gerrit.prettify 2.1.5","2011-01-17 04:38:38"
334683,"Orbit","bundles","caniszczyk","RESOLVED","FIXED","Gerrit common bundle does not export classes to workspace","2011-01-20 03:04:24"
334857,"Orbit","bundles","caniszczyk","RESOLVED","FIXED","Add org.apache.httpcomponents.httpcore","2011-01-20 17:45:02"
334858,"Orbit","bundles","caniszczyk","RESOLVED","FIXED","Add org.apache.httpcomponents.httpcore.nio","2011-01-20 17:45:13"
334970,"Orbit","bundles","caniszczyk","RESOLVED","FIXED","Add org.apache.httpcomponents.httpclient 4.1","2011-01-25 12:10:12"
336468,"Orbit","bundles","caniszczyk","RESOLVED","FIXED","Add org.apache.commons.math 2.1","2011-02-07 11:14:23"
338615,"Orbit","bundles","caniszczyk","RESOLVED","FIXED","com.goole.gwtjsonrpc, com.google.gwtorm, com.google.gerrit.* should have execution environment set to 1.6","2011-03-02 18:36:37"
341262,"Orbit","bundles","caniszczyk","RESOLVED","FIXED","org.apache.htpcomponents.httpclient 4.1 bundle needs additional package import","2012-01-03 10:36:57"
346210,"Orbit","bundles","caniszczyk","RESOLVED","FIXED","org.objectweb.asm lost ""Bundle-Localization: plugin""","2011-05-18 10:11:35"
390500,"Orbit","bundles","caniszczyk","RESOLVED","FIXED","Add JavaEWAH 0.5.6","2013-08-26 22:42:45"
396199,"Orbit","bundles","caniszczyk","RESOLVED","FIXED","Add apache commons compress 1.3","2013-03-03 15:58:40"
408925,"Orbit","bundles","caniszczyk","RESOLVED","FIXED","Hamcrest library 1.3 bundle shows different content than real hamcrest 1.3","2013-05-28 11:16:28"
413025,"Orbit","bundles","caniszczyk","RESOLVED","FIXED","Invalid Eclipse-SourceBundle Header in javaewah.source_0.5.6.v201210150900.jar","2013-08-26 17:23:40"
425448,"Orbit","bundles","caniszczyk","RESOLVED","FIXED","Add JavaEWAH 0.7.9","2014-01-13 09:14:36"
435135,"Orbit","bundles","caniszczyk","RESOLVED","FIXED","Apache Commons IO 2.2","2014-05-21 13:13:08"
526271,"Orbit","bundles","christian.mohr","RESOLVED","FIXED","ch.qos.logback.classic missing package import ch.qos.logback.core.rolling","2017-12-21 02:54:34"
513272,"Orbit","bundles","christian.pontesegger","RESOLVED","FIXED","Include com.cronutils in orbit","2017-04-07 03:11:18"
355829,"Orbit","bundles","danail.branekov","RESOLVED","FIXED","Include org.jmock 1.2.0 in Orbit","2011-09-02 03:58:02"
366116,"Orbit","bundles","danail.branekov","RESOLVED","FIXED","should org.jmock_1.2.0 not be a singleton?","2011-12-12 04:42:53"
163745,"Orbit","bundles","david_williams","RESOLVED","FIXED","setup build process","2007-01-27 12:32:17"
170724,"Orbit","bundles","david_williams","RESOLVED","FIXED","org.apache.lucene needs 'org' checked in build.properties","2007-01-16 23:25:27"
171904,"Orbit","bundles","david_williams","RESOLVED","FIXED","releng files should be tagged each build","2007-06-13 02:52:45"
173473,"Orbit","bundles","david_williams","RESOLVED","FIXED","PDE build enhanced - Consider remerging set1 and set2","2007-04-25 18:26:23"
173917,"Orbit","bundles","david_williams","RESOLVED","FIXED","Map file generator","2007-02-14 14:43:52"
174548,"Orbit","bundles","david_williams","RESOLVED","FIXED","orbitBundles.map file should have timestamp","2007-03-08 05:09:31"
176459,"Orbit","bundles","david_williams","RESOLVED","FIXED","Lucene bundle build slightly broke  (so 1.4.3 version left out for now).","2007-03-07 04:07:02"
176572,"Orbit","bundles","david_williams","RESOLVED","FIXED","Need to reinstantiate org.junit in set 2","2007-03-07 08:30:31"
176901,"Orbit","bundles","david_williams","RESOLVED","FIXED","need improved version parsing for web page","2007-03-10 22:48:09"
176904,"Orbit","bundles","david_williams","RESOLVED","FIXED","Odd file produced during builds","2007-03-11 01:43:02"
178723,"Orbit","bundles","david_williams","RESOLVED","FIXED","prebuilt jar files should not be conditioned (by us) for pack200","2007-06-13 11:23:06"
179232,"Orbit","bundles","david_williams","RESOLVED","FIXED","add org.apache..log4j, version 1.2.8","2007-05-22 09:59:49"
179233,"Orbit","bundles","david_williams","RESOLVED","FIXED","add org.apache.axis 1.4","2007-05-22 10:00:59"
179235,"Orbit","bundles","david_williams","RESOLVED","FIXED","add org.apache.wsil4j 1.0.0","2007-05-22 10:01:29"
179236,"Orbit","bundles","david_williams","RESOLVED","FIXED","org.uddi4j  2.0.5","2007-04-23 22:50:06"
179237,"Orbit","bundles","david_williams","RESOLVED","FIXED","org.wsdl4j  1.4.0","2007-05-22 19:05:00"
184117,"Orbit","releng","david_williams","RESOLVED","FIXED","Move releng files to HEAD?","2008-01-01 23:01:23"
185383,"Orbit","bundles","david_williams","RESOLVED","FIXED","Add Rhino 1.6.2","2007-05-30 02:02:43"
188509,"Orbit","bundles","david_williams","RESOLVED","FIXED","resolve wdl4j  conflicts","2007-05-30 22:44:20"
188654,"Orbit","bundles","david_williams","RESOLVED","FIXED","support use of Axis 1.4 callbacks in Orbit","2007-06-19 00:46:25"
188906,"Orbit","bundles","david_williams","RESOLVED","WONTFIX","Why are the junit bundles directory bundles?","2015-04-28 13:14:43"
189581,"Orbit","bundles","david_williams","RESOLVED","FIXED","Misc fix up for some legal related files","2007-09-10 13:52:53"
193254,"Orbit","bundles","david_williams","RESOLVED","FIXED","some axis pre-reqs are optional","2007-11-09 13:55:52"
199577,"Orbit","bundles","david_williams","RESOLVED","FIXED","Questionable ""requires"" in Rhino","2007-11-27 10:18:18"
202218,"Orbit","bundles","david_williams","RESOLVED","FIXED","WSDL 1.5 needs to have no embedded jars","2007-09-18 14:56:48"
203157,"Orbit","releng","david_williams","RESOLVED","FIXED","rsync error should cause ""build failure""","2007-09-14 10:16:31"
204361,"Orbit","bundles","david_williams","RESOLVED","WONTFIX","Upgrade Xerces bundle to 2.9.1","2012-01-18 14:04:23"
208658,"Orbit","bundles","david_williams","RESOLVED","FIXED","change wsdl prereq in org.apache.axis","2007-11-28 12:53:53"
209370,"Orbit","bundles","david_williams","RESOLVED","FIXED","Axis bundle does not support WS attachments","2008-04-10 16:18:56"
213665,"Orbit","releng","david_williams","RESOLVED","FIXED","Move Cruise Control to 2.7.1","2008-01-01 22:56:51"
213794,"Orbit","bundles","david_williams","RESOLVED","FIXED","Small fix needed to catalog.xsd in xml.resolver 1.2","2007-12-27 20:34:01"
216377,"Orbit","bundles","david_williams","RESOLVED","FIXED","fix xerces bundle manifests","2008-02-01 13:01:24"
218378,"Orbit","releng","david_williams","RESOLVED","FIXED","java_cup.runtime not written to http format map file","2008-02-09 03:58:23"
219687,"Orbit","bundles","david_williams","RESOLVED","FIXED","javax.mail references javax.activation","2008-02-22 09:27:14"
220481,"Orbit","bundles","david_williams","RESOLVED","FIXED","[patch] org.mozilla.javascript v1_6_2","2008-02-28 16:19:36"
220483,"Orbit","bundles","david_williams","RESOLVED","FIXED","[patch] org.mozilla.javascript v1_6_2 licenses may be incorrect","2008-02-28 16:51:52"
221047,"Orbit","bundles","david_williams","RESOLVED","FIXED","make Xerces dependency in org.jdom bundle optional","2008-03-07 19:06:14"
221429,"Orbit","bundles","david_williams","RESOLVED","FIXED","javax.xml.soap should pre-req system.bundle","2008-03-19 17:41:38"
221735,"Orbit","bundles","david_williams","RESOLVED","FIXED","xalan should require system.bundle","2008-03-06 16:58:01"
222584,"Orbit","bundles","david_williams","RESOLVED","FIXED","sat4j bundles produced by PDE Build don't match Orbit bundles","2009-03-09 10:01:41"
226068,"Orbit","bundles","david_williams","RESOLVED","FIXED","add geronimo versions of javax.mail and javax.activation","2008-04-13 08:11:33"
226213,"Orbit","bundles","david_williams","RESOLVED","FIXED","xalan 2.7.1 should require serializer","2008-04-11 08:36:42"
227268,"Orbit","bundles","david_williams","RESOLVED","FIXED","org.apache.commons.discovery has dependeny on org.apache.commons.logging","2009-02-17 00:06:57"
227388,"Orbit","bundles","david_williams","RESOLVED","FIXED","Add api versions to javax.xml bundle's manifest","2009-01-21 17:28:34"
230008,"Orbit","bundles","david_williams","RESOLVED","FIXED","Add org.wsdl4j  1.6.2","2008-06-13 13:35:09"
230059,"Orbit","releng","david_williams","RESOLVED","FIXED","Move Cruise Control to 2.7.2","2008-05-03 01:36:45"
231106,"Orbit","bundles","david_williams","RESOLVED","FIXED","Log4j Bundle Missing Package Version Numbers","2009-03-07 15:32:08"
241723,"Orbit","bundles","david_williams","RESOLVED","FIXED","Need to make ant dependency optional for org.apache.axis","2008-08-07 14:50:10"
244291,"Orbit","bundles","david_williams","RESOLVED","FIXED","Export without Version in Bundles Xalan/Xerces","2008-09-30 06:59:38"
245951,"Orbit","bundles","david_williams","RESOLVED","FIXED","javax.xml.rpc should use import package instead of require bundle","2009-02-16 23:19:03"
249094,"Orbit","bundles","david_williams","RESOLVED","FIXED","Export Version in Serializer and Resolver","2009-02-17 00:22:34"
253632,"Orbit","bundles","david_williams","RESOLVED","FIXED","Circular dependency between org.apache.xerces and org.apache.xml.resolver","2008-11-04 13:33:50"
261382,"Orbit","bundles","david_williams","RESOLVED","FIXED","Have another version of wsil4j that depends on wsdl4j v1.5.1","2009-01-21 13:18:09"
262250,"Orbit","releng","david_williams","RESOLVED","FIXED","TestLayout give one erroneous result","2009-01-24 16:43:20"
263497,"Orbit","releng","david_williams","RESOLVED","FIXED","Add icons to show test pass/fail status","2009-10-02 12:20:07"
270669,"Orbit","bundles","david_williams","RESOLVED","FIXED","apache.axis classes not visible","2009-04-01 15:44:11"
273056,"Orbit","bundles","david_williams","RESOLVED","FIXED","javax.activation 1_1_0 does not include versions in package numbers","2009-05-04 01:28:27"
273060,"Orbit","bundles","david_williams","RESOLVED","FIXED","javax.mail 1_4_0 does not include versions in package exports","2009-06-08 15:59:11"
275122,"Orbit","bundles","david_williams","RESOLVED","FIXED","xalan signature is correupted in pack.gz process","2009-05-12 17:10:16"
275222,"Orbit","releng","david_williams","RESOLVED","FIXED","Orbit downloads don't use the mirrors","2013-09-24 13:05:15"
275908,"Orbit","bundles","david_williams","RESOLVED","FIXED","exclude nested jars from jar processor for 4 bundles","2009-05-12 17:31:18"
279519,"Orbit","bundles","david_williams","RESOLVED","FIXED","javax.activation should require system.bundle","2009-07-02 09:00:46"
295949,"Orbit","releng","david_williams","RESOLVED","FIXED","Layout test should be ok with OSGI-INF/i18n/bundle.properties","2010-10-04 08:41:55"
299187,"Orbit","releng","david_williams","RESOLVED","FIXED","Need branched build for Galileo SR2","2010-01-09 21:39:46"
299313,"Orbit","bundles","david_williams","RESOLVED","WORKSFORME","javax.activation - require system.bundle to ensure use of JRE packages in OSGi","2010-01-12 11:40:56"
299587,"Orbit","releng","david_williams","RESOLVED","FIXED","fix scripts so two builds can be signed from two threads","2010-01-14 09:17:38"
309619,"Orbit","bundles","david_williams","RESOLVED","FIXED","org.apache.commons.discovery has too narrow range for JUnit prereq","2010-04-19 00:01:31"
309723,"Orbit","releng","david_williams","RESOLVED","FIXED","Orbit doesn't create source jars with 3.6 based builder","2010-04-28 02:49:06"
310766,"Orbit","releng","david_williams","RESOLVED","FIXED","Change scripts to produce ""repository"" instead of ""updateSite""","2010-05-03 11:27:22"
312168,"Orbit","releng","david_williams","RESOLVED","FIXED","a couple of externalized string keys are displayed","2010-05-10 10:16:37"
312778,"Orbit","releng","david_williams","RESOLVED","FIXED","Add the milestones to Bugzilla","2010-05-13 10:43:56"
313265,"Orbit","releng","david_williams","RESOLVED","FIXED","recreate repo with RC1 based builder to correct labels","2010-05-19 09:22:02"
313457,"Orbit","releng","david_williams","RESOLVED","FIXED","build repository no longer contains zipped instructions","2010-05-19 14:08:11"
317133,"Orbit","bundles","david_williams","RESOLVED","WONTFIX","Third-party plug-in providing javax.servlet.jsp.el version 2.1 or greater breaks WPE preview","2010-12-03 10:51:37"
317625,"Orbit","bundles","david_williams","RESOLVED","FIXED","Differences in javax.xml.soap bundle version 1.3 and 1.2 can cause classloader issues","2010-12-03 10:56:19"
318299,"Orbit","bundles","david_williams","RESOLVED","NOT_ECLIPSE","JUnit can not find test class if you run with Categories runner","2013-03-04 04:23:45"
323331,"Orbit","bundles","david_williams","RESOLVED","FIXED","com.sun.xml.bind does not specify Bundle-Localization header","2010-11-02 22:54:47"
324464,"Orbit","bundles","david_williams","RESOLVED","FIXED","javax.xml.soap bundle does not specify provider","2016-05-18 01:08:30"
328729,"Orbit","releng","david_williams","RESOLVED","FIXED","Add Indigo target milestones to Orbit bugzilla","2010-10-26 11:55:58"
331824,"Orbit","bundles","david_williams","RESOLVED","FIXED","remove old WSDL bundles from current, ongoing Orbit builds","2011-01-18 08:47:53"
334487,"Orbit","releng","david_williams","RESOLVED","FIXED","avoid 'bundles' directory on download page links","2011-02-28 08:43:29"
334488,"Orbit","releng","david_williams","RESOLVED","FIXED","avoid 'bundles' directory in GET HTTP style map files","2011-02-28 01:26:35"
338447,"Orbit","releng","david_williams","RESOLVED","FIXED","Orbit bundles now contain Eclipse-SourceReferences","2011-03-02 11:31:47"
338743,"Orbit","bundles","david_williams","RESOLVED","FIXED","Download page problems for org.openid4java and org.objenesis","2011-03-03 22:10:32"
344560,"Orbit","bundles","david_williams","RESOLVED","FIXED","org.apache.batik.pdf export package org.apache.commons.io and should not","2011-05-10 09:44:04"
344773,"Orbit","releng","david_williams","RESOLVED","FIXED","H2 source-bundle cannot be found","2011-05-14 18:55:43"
346781,"Orbit","bundles","david_williams","RESOLVED","FIXED","org.apache.hadoop.zookeeper modules are named with ""apaha"" instead of ""apache""","2011-05-21 15:34:32"
346854,"Orbit","bundles","david_williams","RESOLVED","FIXED","com.google.inject needs to export all packages (and, as ""1.2"" instead of ""2.0"")","2011-05-24 20:20:27"
355582,"Orbit","releng","david_williams","RESOLVED","FIXED","Non-existent reference repo results in over-inclusion of ""changed"" bundles.","2011-10-18 01:14:19"
355586,"Orbit","bundles","david_williams","RESOLVED","FIXED","derby's qualifier increases each build","2011-08-31 11:07:04"
357523,"Orbit","releng","david_williams","RESOLVED","FIXED","orbit builds no longer auto-upload to 'downloads' server","2011-09-19 00:00:34"
358155,"Orbit","releng","david_williams","RESOLVED","FIXED","cleanup cvs storage of download site files","2011-09-19 16:50:31"
361067,"Orbit","releng","david_williams","RESOLVED","FIXED","should not use ""base builder"" but standard Eclipse-SDK/PDE","2012-01-19 14:51:31"
361068,"Orbit","releng","david_williams","RESOLVED","FIXED","should update to latest ""base builder""","2011-10-16 01:28:52"
361069,"Orbit","releng","david_williams","RESOLVED","FIXED","should move to current version of Cruisecontrol","2011-10-16 01:29:39"
361830,"Orbit","releng","david_williams","RESOLVED","FIXED","promote script does not fixup map file URLs","2011-10-24 14:00:26"
361842,"Orbit","releng","david_williams","RESOLVED","FIXED","map files have invalid repos URLs while on build machine","2011-10-24 21:04:45"
364151,"Orbit","releng","david_williams","RESOLVED","FIXED","Problems getting the ""prereq"" eclipse","2011-11-19 19:47:59"
364156,"Orbit","releng","david_williams","RESOLVED","FIXED","Problems getting the ""prereq"" eclipse -- removed prematurely","2011-11-19 19:53:03"
364157,"Orbit","releng","david_williams","RESOLVED","FIXED","Problems getting the ""prereq"" eclipse -- could fail more gracefully","2011-11-25 12:02:03"
364754,"Orbit","releng","david_williams","RESOLVED","FIXED","many of our ""packed"" jars do not verify correcty","2012-01-31 18:46:21"
365186,"Orbit","bundles","david_williams","RESOLVED","FIXED","javax.xml has extra (original) jar in CVS","2012-01-20 15:07:56"
366233,"Orbit","releng","david_williams","RESOLVED","FIXED","fix recent build breaks","2011-12-09 15:13:53"
367557,"Orbit","releng","david_williams","RESOLVED","FIXED","for committer convenience, add link from ""downloads"" build page to ""committers"" download page","2012-01-05 16:42:13"
367972,"Orbit","bundles","david_williams","RESOLVED","FIXED","xmlpull changes qualifier every build","2012-01-05 18:13:44"
368999,"Orbit","releng","david_williams","RESOLVED","FIXED","Orbit's repo should have optional dependencies as non-greedy by default.","2012-01-20 13:35:44"
369939,"Orbit","releng","david_williams","RESOLVED","FIXED","Several ""Orbit IP Log"" entries missing contact and project info","2012-01-27 18:18:42"
371396,"Orbit","bundles","david_williams","RESOLVED","FIXED","should com.google.collect be removed from active builds?","2012-05-23 02:14:08"
371685,"Orbit","releng","david_williams","RESOLVED","FIXED","add clause to retention policy about aggressively removing bundles from Orbit, if recommended by package authors","2012-02-23 20:00:06"
373209,"Orbit","bundles","david_williams","RESOLVED","FIXED","export version on javax.xml.rpc packages","2012-09-13 23:52:33"
377941,"Orbit","releng","david_williams","RESOLVED","FIXED","sax parsing error for ip_log in latest builds","2012-04-28 14:29:31"
377953,"Orbit","releng","david_williams","RESOLVED","FIXED","large number of IP Log data errors","2012-04-28 15:05:33"
380801,"Orbit","bundles","david_williams","RESOLVED","FIXED","org.objectweb.asm 4.0","2013-03-03 16:21:11"
386231,"Orbit","bundles","david_williams","RESOLVED","FIXED","ICU4J incorrectly references the Unicode License in its about.html","2014-04-24 15:55:52"
387693,"Orbit","releng","david_williams","RESOLVED","FIXED","Orbit build broken due to missing prereq eclipse","2012-08-21 13:00:06"
388140,"Orbit","bundles","david_williams","RESOLVED","FIXED","problems building ch.qos.logback.slf4j 1.0.3 and remove old loggers","2012-09-13 18:28:21"
388967,"Orbit","bundles","david_williams","RESOLVED","FIXED","head version of o.a.ant has name of o.a.tools.ant in .project file","2012-09-06 12:12:35"
389187,"Orbit","bundles","david_williams","RESOLVED","FIXED","Add Mozilla Rhino Version: 1.7R4","2012-09-14 18:06:52"
389573,"Orbit","bundles","david_williams","RESOLVED","FIXED","remove rhino 1.6.2 from active builds","2012-09-14 00:38:53"
389988,"Orbit","releng","david_williams","RESOLVED","FIXED","Rename and add description to Orbit features in p2 repo to make clear what's inside","2013-03-04 00:05:28"
392026,"Orbit","bundles","david_williams","RESOLVED","WORKSFORME","org.apache.batik.bridge.xml missing IP Log xml file?","2013-03-03 16:52:13"
393280,"Orbit","bundles","david_williams","RESOLVED","FIXED","javax.activation JAR has bytecode that references javax.mail","2012-11-13 14:00:06"
395124,"Orbit","bundles","david_williams","RESOLVED","WONTFIX","ICU4J should not be a singleton","2012-11-29 15:42:39"
397506,"Orbit","releng","david_williams","RESOLVED","FIXED","Need to create Juno_maintenance build","2013-01-05 17:06:44"
397507,"Orbit","releng","david_williams","RESOLVED","FIXED","mark cvs text fetch maps (directory.txt) as deprecated","2013-01-06 13:54:27"
397575,"Orbit","bundles","david_williams","RESOLVED","FIXED","ant 1.8.3 missing bundle name, provider name (localization)","2013-01-07 09:46:11"
398013,"Orbit","releng","david_williams","RESOLVED","FIXED","New Orbit builds have ""local"" in Eclipse-SourceReferences","2013-01-12 18:50:50"
402224,"Orbit","bundles","david_williams","RESOLVED","FIXED","org.mockito.source should have ""Source"" in its name","2013-03-03 11:26:46"
402226,"Orbit","bundles","david_williams","RESOLVED","FIXED","org.hamcrest.integration.source is named same as org.hamcrest.core.source","2013-03-03 11:28:25"
402650,"Orbit","bundles","david_williams","RESOLVED","FIXED","jarprocessor.exclude.children from Ant 1.8.4 and Junit 4.11","2013-03-12 18:23:26"
403486,"Orbit","bundles","david_williams","RESOLVED","FIXED","Renew signing information in some bundles","2013-03-25 06:12:21"
405122,"Orbit","bundles","david_williams","RESOLVED","FIXED","avoid packing nested jars","2013-04-08 08:49:37"
406259,"Orbit","releng","david_williams","RESOLVED","FIXED","Generate OSGi repository index file for Orbit","2013-04-26 03:39:32"
407547,"Orbit","bundles","david_williams","RESOLVED","INVALID","com.google.guava is Java 1.6 rather than 1.5","2013-05-08 14:05:10"
408439,"Orbit","releng","david_williams","RESOLVED","DUPLICATE","7 or so ""names"" and ""providers"" missing for source bundles","2016-05-18 01:06:10"
411028,"Orbit","bundles","david_williams","RESOLVED","FIXED","Add Ant 1.9.2 to Orbit","2013-08-13 18:54:01"
411814,"Orbit","releng","david_williams","RESOLVED","FIXED","Orbit has wrong ACLs assigned","2013-07-17 16:58:19"
411912,"Orbit","releng","david_williams","RESOLVED","FIXED","Prepare M-build and schedule for Kepler SR1","2013-08-27 10:23:02"
413190,"Orbit","bundles","david_williams","RESOLVED","FIXED","remove ant 1.8.2 and 1.8.3 from Orbit's active builds","2013-07-17 16:15:50"
415007,"Orbit","bundles","david_williams","RESOLVED","FIXED","remove 5 oldest versions of sat4j.core and sat4j.pb from active builds","2013-08-13 23:36:26"
416485,"Orbit","releng","david_williams","RESOLVED","FIXED","Archive some older Orbit releases","2013-09-27 01:20:28"
416774,"Orbit","releng","david_williams","RESOLVED","FIXED","update Orbit build ""tools"" to standard, recent /shared/common ones","2013-09-08 22:09:52"
416881,"Orbit","releng","david_williams","RESOLVED","WORKSFORME","More differences that expected in recent I build (I20130908233856)","2013-09-10 13:48:09"
417204,"Orbit","bundles","david_williams","RESOLVED","FIXED","remove old org.junit bundles from active builds","2015-04-28 13:17:32"
418119,"Orbit","releng","david_williams","RESOLVED","FIXED","com.thoughtworks.xstream.xml no longer in Kepler_maintenance branch","2013-09-26 13:15:11"
418147,"Orbit","releng","david_williams","RESOLVED","FIXED","infinite loop in php if expected file does not exist","2013-09-27 01:43:48"
418856,"Orbit","bundles","david_williams","RESOLVED","FIXED","Add JSch 0.1.50 to Orbit","2013-10-12 11:41:21"
419313,"Orbit","bundles","david_williams","RESOLVED","FIXED","Add JSch 0.1.50 to Platform","2014-01-10 14:26:35"
423539,"Orbit","releng","david_williams","RESOLVED","FIXED","remove tempTest* branches from orbit cvs repository","2013-12-08 12:37:10"
429660,"Orbit","bundles","david_williams","RESOLVED","FIXED","Add ICU4J 52.1.v20140218 to Orbit","2014-04-07 10:44:27"
431259,"Orbit","releng","david_williams","RESOLVED","WONTFIX","JRE IUs Missing from Orbit","2015-04-17 21:37:11"
431398,"Orbit","releng","david_williams","RESOLVED","FIXED","auto-building seems not to work ...","2015-11-09 18:04:52"
